number,value,params_colsample_bytree,params_compute_air_density,params_compute_air_density_moiust_air_correction,params_compute_wind_power_density,params_compute_wind_ramp,params_compute_wind_shear,params_dew_point_temperature,params_drop_raw_main_features,params_drop_raw_wind_features,params_encode_wind_direction,params_gust_factor,params_lags_choice,params_learning_rate,params_max_depth,params_min_child_weight,params_n_estimators,params_precip_lags_choice,params_reg_alpha,params_reg_lambda,params_spatial_agg_method,params_subsample,params_turbulence_window,params_use_base_models_pred_intervals,params_vapor_pressure,state
0,25.186296463012695,0.5708411890169282,False,True,True,True,True,False,False,False,False,True,large,0.149510534243043,4,3,350,large,0.03470017557859535,0.00021137484885896764,distance_n_turbines,0.6957622210556975,0,False,False,COMPLETE
1,21.561586380004883,0.5595363707716968,False,False,True,True,True,True,False,True,True,False,large,0.012704435765771582,5,9,706,none,3.7852452258358363e-05,1.1290871187886959e-05,None,0.742956859810517,6,False,True,COMPLETE
2,23.731504440307617,0.9139342740133783,True,False,True,True,False,False,False,False,True,True,small,0.04103439573772427,6,7,739,small,0.018893917316814546,1.039766279405913e-07,capacity,0.7469290368254307,0,True,False,COMPLETE
3,22.432649612426758,0.7063473612681896,True,False,True,True,True,True,True,True,False,False,large,0.062353817862320186,9,8,718,small,1.1356927880661899e-05,0.11528324963829566,distance_n_turbines,0.5750751522913405,0,True,False,COMPLETE
4,20.918737411499023,0.9436333167804467,False,True,True,True,True,True,True,False,False,False,large,0.0246585584538644,10,10,514,large,3.633715437369649e-06,1.8471104539906005e-05,mean,0.8066504457582526,6,True,False,COMPLETE
5,22.013845443725586,0.9336604622333815,False,True,True,True,False,True,True,True,False,True,large,0.029415740423516835,9,10,786,none,1.3069664797051981e-06,7.672648745490614e-08,None,0.7257159693501231,0,False,False,COMPLETE
6,22.2410888671875,0.5396023228038505,True,True,True,True,False,True,True,True,False,True,none,0.12133802840853287,9,3,491,small,0.00037093529574922125,1.8733486021507541e-06,distance_n_turbines,0.9009593272499268,6,True,True,COMPLETE
7,21.178682327270508,0.5517924247604653,False,True,True,False,False,True,False,True,True,True,none,0.024059693708202004,10,4,816,small,0.0014660366748052319,0.0012351174467526542,max,0.7554818691972309,6,False,True,COMPLETE
8,23.05906105041504,0.8903333285578676,True,False,False,True,False,True,False,False,False,True,none,0.016543963089864562,9,1,679,none,0.14604504542381283,1.1145669203657345e-05,capacity,0.7760152265483627,0,True,True,COMPLETE
9,22.598785400390625,0.6237264997871388,True,True,True,False,True,False,False,False,True,True,none,0.035376174711463405,9,9,903,none,1.3602248509132499e-08,0.37897429915431424,mean,0.7869365328192559,0,True,False,COMPLETE
10,22.56635284423828,0.804005786735677,False,True,False,False,True,False,True,False,False,False,small,0.2706858097253789,7,6,531,large,1.1843654439237478e-07,0.004719202793426597,mean,0.9875740681694221,2,True,False,COMPLETE
11,21.13160514831543,0.9954091592382683,False,True,False,False,False,True,True,True,True,False,none,0.021294159348279506,10,4,987,large,0.0006010336045580491,0.0014733781017351524,max,0.8599929246565702,6,False,True,COMPLETE
12,21.035898208618164,0.9915687794237636,False,True,False,False,False,True,True,True,True,False,large,0.010590026660161105,7,5,985,large,3.0637002146419393e-06,0.00773058112425107,distance_capacity,0.8914572818059331,6,False,True,COMPLETE
13,21.092906951904297,0.9955430695765157,False,True,False,False,True,True,True,False,True,False,large,0.0111960921985575,7,6,498,large,1.6958732086246287e-06,0.030395861768039305,distance_capacity,0.8900470191692803,6,False,True,COMPLETE
14,22.418807983398438,0.8244639896701811,False,True,False,False,True,True,True,True,False,False,large,0.010630407781217483,3,5,592,large,1.2767393148920511e-06,0.00010480623256602307,distance_capacity,0.9827656706223027,2,False,False,COMPLETE
15,21.28910255432129,0.8458199532145559,False,True,False,False,False,True,True,False,True,False,large,0.07112487792801148,6,1,303,large,1.2082886572295448e-05,0.012058435216655018,idw,0.8398065655296646,6,True,True,COMPLETE
16,21.154096603393555,0.731967596067083,False,True,False,False,True,True,True,False,True,False,large,0.017355005586754874,8,7,398,large,1.3851710530583112e-07,1.7659043279259707e-06,distance_capacity,0.6429762660409755,6,False,False,COMPLETE
17,20.888154983520508,0.9543978290009333,False,True,False,True,False,True,True,True,False,False,small,0.016953605129441367,5,10,998,large,1.341221958937142e-07,0.820581688832532,mean,0.9398578226393646,6,True,True,COMPLETE
18,23.438905715942383,0.674495011366073,False,False,True,True,False,False,True,True,False,False,small,0.04639060368497873,5,10,586,large,2.5134324386475633e-08,0.5328457764818475,mean,0.9417037967714039,2,True,False,COMPLETE
19,22.012252807617188,0.7683943148432129,False,True,False,True,True,True,True,False,False,False,small,0.027191697833229337,3,9,860,large,2.157874467238862e-07,1.5567529190368916e-05,mean,0.8215955596761587,6,True,True,COMPLETE
20,21.1748046875,0.9421464632619462,False,True,True,True,False,True,True,False,False,False,small,0.01735555885977241,5,8,409,large,4.241234953133052e-05,1.4342195460847048e-08,mean,0.5007758668747911,6,True,True,COMPLETE
21,21.402639389038086,0.8768364716070776,False,True,False,True,False,True,True,True,False,False,small,0.014352833583034599,4,10,990,large,4.325301925677241e-06,0.05952244849859602,idw,0.9164210031200919,6,True,True,COMPLETE
22,20.691198348999023,0.9710632658678021,False,True,False,True,False,True,True,True,False,False,large,0.010246354277543487,8,8,903,large,3.593150765190089e-07,0.00030159252597694776,distance_capacity,0.9482762233172642,6,True,True,COMPLETE
23,20.928878784179688,0.9508174893223412,False,True,False,True,False,True,True,True,False,False,large,0.02007154459623359,8,8,890,large,3.6267499963735077e-07,0.000658844808708641,mean,0.9473092870822007,6,True,True,COMPLETE
24,20.913209915161133,0.8780685653906615,False,True,False,True,False,True,True,True,False,False,small,0.014195195380751058,8,10,924,large,3.650075329702749e-08,8.340281033586225e-07,mean,0.8102934940199171,6,True,True,COMPLETE
25,21.065996170043945,0.8534348168055792,False,True,False,True,False,True,True,True,False,False,small,0.01426903063733837,8,9,940,large,4.586334233435232e-08,5.365687415853771e-07,distance_capacity,0.8589408670330803,2,True,True,COMPLETE
26,20.692472457885742,0.8953107536381614,True,False,False,True,False,False,True,True,False,False,small,0.013932489707726387,6,7,810,large,4.2680466902664753e-07,3.6736154424437956e-07,mean,0.9531911922008421,6,True,True,COMPLETE
27,20.613473892211914,0.7875122301877855,True,False,False,True,False,False,True,True,False,False,small,0.010090844881621805,6,7,824,large,5.550326402886242e-07,2.8951815808930316e-08,idw,0.9429917233130849,6,True,True,COMPLETE
28,20.67597198486328,0.7960883992091656,True,False,False,True,False,False,True,True,False,False,small,0.010075260709389642,6,7,825,none,5.317937222564952e-07,1.1077262087643692e-08,idw,0.983581448484903,6,True,True,COMPLETE
29,22.559934616088867,0.5008081635196687,True,False,False,True,False,False,False,True,False,False,small,0.07858145815857231,4,6,844,none,0.9933973060886002,1.9192794343160512e-08,idw,0.9893452730240118,2,True,True,COMPLETE
30,22.499313354492188,0.7791301829790518,True,False,False,True,False,False,True,True,False,False,small,0.11558236654023468,7,7,767,none,6.106903467769193e-07,9.708457223733274e-08,idw,0.9967381969978897,6,True,True,COMPLETE
31,20.6868953704834,0.814668538647389,True,False,False,True,False,False,True,True,False,False,small,0.01043216238139117,6,7,815,none,5.759218518554325e-07,1.3846466730547246e-08,idw,0.9555866078304704,6,True,True,COMPLETE
32,20.668241500854492,0.6673737317971973,True,False,False,True,False,False,True,True,False,False,small,0.010526577531999074,6,8,863,none,1.3148721943337675e-05,1.0504109608757412e-08,idw,0.9204441739142927,6,True,True,COMPLETE
33,20.844839096069336,0.6634484269518263,True,False,False,True,False,False,True,True,False,False,small,0.011940775720453713,6,7,756,none,1.762984723868612e-05,1.0333721286117731e-08,idw,0.9193095015259494,6,True,True,COMPLETE
34,20.67378044128418,0.7343319112276898,True,False,False,True,False,False,False,True,False,False,small,0.010069533726375052,6,6,657,none,0.00011199477859184011,3.456957261289671e-08,idw,0.8770676231696437,6,True,True,COMPLETE
35,20.785789489746094,0.7201101436043058,True,False,False,True,False,False,False,True,False,False,small,0.013024565180277057,5,6,635,none,0.00013486847090353547,4.723596915504482e-08,idw,0.8694690877278575,6,True,True,COMPLETE
36,21.73602867126465,0.6081147945034034,True,False,False,True,False,False,False,True,False,True,small,0.03303427760795182,6,8,691,none,0.0034479849710495466,2.202671540629724e-07,idw,0.6853474903745616,0,True,True,COMPLETE
37,21.300216674804688,0.6916006926893106,True,False,False,True,False,False,False,True,False,False,small,0.02071262846540594,4,5,725,none,7.277202899449153e-05,4.643868097223152e-08,None,0.9096635658821145,6,True,True,COMPLETE
38,22.306060791015625,0.7606714105235164,True,False,False,True,False,False,False,True,False,False,small,0.29171017271367794,6,4,860,none,0.0001946158358647743,1.697572743807531e-07,idw,0.9719230130435522,6,True,True,COMPLETE
39,22.475988388061523,0.62310568563865,True,False,False,True,False,False,False,True,False,True,small,0.2202204233849545,7,9,639,small,9.066979401842817e-06,3.747463089842272e-08,distance_n_turbines,0.8734011313132236,0,True,True,COMPLETE
40,20.948474884033203,0.7432278075558043,True,False,False,True,False,False,False,True,False,True,small,0.012727900334803243,5,6,793,none,0.006653533826981403,2.755599952394684e-06,capacity,0.923775558008216,6,True,True,COMPLETE
41,20.738039016723633,0.7902614280454087,True,False,False,True,False,False,True,True,False,False,small,0.010287433724621715,6,7,833,none,2.724236529438469e-05,2.4956286986057137e-08,idw,0.9692568592793952,6,True,True,COMPLETE
42,20.56048583984375,0.8168536840290437,True,False,False,True,False,False,True,True,False,False,small,0.01242442749686868,6,8,773,none,4.770871818583531e-06,1.0305659009182643e-08,idw,0.9567661634165442,6,True,True,COMPLETE
43,20.784664154052734,0.838119625331771,True,False,False,True,False,False,False,True,False,False,small,0.015728262464370993,7,8,741,none,3.7962917969100347e-06,3.955104795312337e-08,idw,0.9280158164550515,6,True,True,COMPLETE
44,21.326215744018555,0.7117476968141948,True,False,True,True,False,False,True,True,False,False,none,0.01240155216818022,6,8,779,none,0.0005641628683923174,9.053290285186826e-08,idw,0.9996920060472689,6,True,True,COMPLETE
45,21.143051147460938,0.6604716655773794,True,False,False,True,False,False,True,True,False,False,small,0.019373594895554895,5,7,676,small,7.228715935524955e-06,1.014373681299742e-08,max,0.8839637425615102,0,True,True,COMPLETE
46,21.397024154663086,0.7941610894503143,True,False,False,True,False,False,True,True,False,False,small,0.024011706173722922,7,2,882,none,1.4633283321993887e-06,1.8955683624700084e-07,idw,0.9124608571996492,6,False,False,COMPLETE
47,20.806665420532227,0.7535792081147745,True,False,True,True,True,False,False,True,True,True,none,0.011979249643431058,6,6,699,none,6.423037739253881e-05,7.156730046062861e-08,distance_n_turbines,0.8451085125212844,6,True,True,COMPLETE
48,21.06307029724121,0.6970146758995553,True,False,False,True,False,False,True,True,False,False,small,0.015159970868123773,7,9,935,none,0.00026148008774188523,4.881540596045841e-06,capacity,0.9630803515231725,6,True,True,COMPLETE
49,21.21820068359375,0.8175881073982155,True,False,False,True,False,False,True,True,False,False,small,0.010007216529312581,6,5,604,small,2.4276750325919624e-05,2.5921399006205267e-08,None,0.7774887863188001,2,False,False,COMPLETE
