number,value,params_cloud_lags_option,params_colsample_bytree,params_compute_air_density,params_compute_cloud_cover_fraction,params_compute_cooling_degree_hours,params_compute_dew_point_spread,params_compute_effective_solar,params_compute_heating_degree_hours,params_compute_humidex,params_compute_pressure_trend,params_compute_rain_indicator,params_compute_temp_gradient,params_compute_wind_chill,params_compute_wind_components,params_compute_wind_power_density,params_compute_wind_speed_gradient,params_drop_basic_meteo_features,params_drop_rad_meteo_features,params_drop_wind_meteo_features,params_lags_target,params_learning_rate,params_max_depth,params_min_child_samples,params_min_split_gain,params_n_estimators,params_num_leaves,params_precip_lags_option,params_reg_alpha,params_reg_lambda,params_rolling_temp_option,params_spatial_agg_method,params_subsample,params_temp_lags_option,state
68,536.4113016290466,small,0.6107115621499623,False,False,True,True,True,False,True,True,False,True,True,False,False,False,True,True,True,1.0,0.052902305233617594,7,13,0.0595871520457979,695,144,medium,0.17683693404477302,1.095327642198725e-08,none,population,0.7863887096196372,medium,COMPLETE
69,599.2314129036209,small,0.6893573395101843,False,False,True,True,True,False,True,True,False,True,True,False,False,False,True,True,True,1.0,0.04320853672056558,6,91,0.01651563714315407,754,150,medium,0.16942114646084802,1.1330819144113971e-08,none,population,0.7722396021992367,medium,COMPLETE
