number,value,params_cloud_lags_option,params_colsample_bytree,params_compute_air_density,params_compute_cloud_cover_fraction,params_compute_cooling_degree_hours,params_compute_dew_point_spread,params_compute_effective_solar,params_compute_heating_degree_hours,params_compute_humidex,params_compute_pressure_trend,params_compute_rain_indicator,params_compute_temp_gradient,params_compute_wind_chill,params_compute_wind_components,params_compute_wind_power_density,params_compute_wind_speed_gradient,params_drop_basic_meteo_features,params_drop_rad_meteo_features,params_drop_wind_meteo_features,params_learning_rate,params_max_depth,params_min_child_samples,params_min_split_gain,params_n_estimators,params_num_leaves,params_precip_lags_option,params_reg_alpha,params_reg_lambda,params_rolling_temp_option,params_spatial_agg_method,params_subsample,params_temp_lags_option,params_use_base_models_pred_intervals,state
67,758.6447616086815,small,0.5928281954403918,False,True,False,False,True,True,False,False,False,True,True,False,False,False,False,False,False,0.019944076121307507,4,36,0.10778400720684449,706,125,medium,3.664031385247104e-05,0.0007569284527850044,long,distance_energy,0.876637585966787,none,False,COMPLETE
68,793.4896306074164,small,0.5676782097737543,True,True,False,False,True,True,False,False,False,True,True,False,False,False,False,False,False,0.01133163323798873,3,18,0.16008218354405676,656,139,medium,0.0006741997460633733,0.00014809580895998602,long,max,0.9717729675451755,none,False,COMPLETE
69,821.3812152012455,small,0.9688610749036564,True,True,False,False,True,True,False,False,False,True,True,False,False,False,False,False,True,0.013766146892009489,5,42,0.06135962823259851,573,91,medium,7.079996891876716e-05,4.63101906377804e-06,long,population,0.8508712789920431,none,False,COMPLETE
