number,value,params_colsample_bytree,params_compute_air_density,params_compute_air_density_moiust_air_correction,params_compute_wind_power_density,params_compute_wind_ramp,params_compute_wind_shear,params_dew_point_temperature,params_drop_raw_main_features,params_drop_raw_wind_features,params_encode_wind_direction,params_gust_factor,params_lags_choice,params_learning_rate,params_max_depth,params_min_child_samples,params_min_split_gain,params_n_estimators,params_num_leaves,params_precip_lags_choice,params_reg_alpha,params_reg_lambda,params_spatial_agg_method,params_subsample,params_turbulence_window,params_use_base_models_pred_intervals,params_vapor_pressure,state
0,751.6493628571096,0.8146128819784664,True,False,False,False,True,True,False,True,False,True,large,0.09137691235626337,6,80,0.4285782039766624,668,13,none,0.0004161484616993099,5.007294955938419e-07,max,0.7112921442854705,6,True,False,COMPLETE
1,789.6424238697605,0.792297014464131,True,True,True,False,True,False,True,False,True,True,large,0.08703975095794951,10,25,0.2786662945770031,920,50,none,3.648406637977568e-08,1.914145142529848e-06,distance_capacity,0.8054379699945189,6,True,False,COMPLETE
2,808.5603700716141,0.6240109537138767,False,False,True,False,False,True,True,False,True,False,large,0.10019229172663936,4,27,0.23060702515579212,661,38,small,1.1632401445913605e-08,3.8074894072237446e-07,None,0.9413876104596257,0,True,False,COMPLETE
3,809.3997487694974,0.5881602754474404,True,False,False,False,False,False,True,True,True,True,none,0.010126212805836834,13,41,0.499179945785667,979,122,large,1.961877564132768e-06,0.1532902139919618,idw,0.5446586114679342,2,True,False,COMPLETE
4,846.9048211558614,0.7448738513580893,False,False,True,False,False,False,True,True,False,False,none,0.01712926918366405,7,40,0.13707732553100188,611,147,large,0.02867487813442687,1.335528385952245e-05,max,0.6330360952336631,0,True,False,COMPLETE
5,770.6075724052547,0.5171922376312253,True,False,False,False,False,True,False,False,True,False,large,0.05745683780144572,16,86,0.17488220032629376,339,145,large,1.2439608305053953e-05,2.576672058435973e-06,capacity,0.9589761326042656,2,False,True,COMPLETE
6,847.1221172021645,0.7102228454927066,False,False,True,False,True,False,True,False,False,False,small,0.016781952193448836,15,91,0.3583212206973728,686,111,large,0.007788588137059425,5.197111146184032e-05,idw,0.6695444697536421,0,False,False,COMPLETE
7,781.8589326100235,0.6572489221649513,False,False,False,True,True,True,True,False,False,False,none,0.011173918983920814,7,21,0.2771050081458612,815,53,large,8.149438830603469e-07,6.545712176480006e-05,max,0.6197205027697934,0,True,False,COMPLETE
8,799.1251690347004,0.9293143718488796,True,True,True,False,False,False,False,True,False,False,large,0.09048099682358107,10,90,0.4075617699021587,502,75,small,0.0003244580916276026,0.0011268338669337805,distance_capacity,0.901136504798598,6,False,False,COMPLETE
9,925.4335811234683,0.8626303668878437,True,True,True,True,False,True,False,True,True,True,none,0.23581791808648359,3,25,0.004313265783193909,731,108,small,1.501455596316038e-08,1.612673641870987e-06,distance_capacity,0.7715263835985371,2,True,False,COMPLETE
10,761.136313134135,0.9934821952897034,True,True,False,True,True,True,False,True,False,True,small,0.19031619145899284,6,65,0.4836558844586244,451,16,none,0.00047275669457930776,1.4655389806592624e-08,distance_n_turbines,0.8567298315907877,6,False,True,COMPLETE
11,735.4955891776017,0.9809445138595511,True,True,False,True,True,True,False,True,False,True,small,0.2568705963434619,6,72,0.47016829099530266,449,14,none,0.9121039309253081,1.5701037244000266e-08,distance_n_turbines,0.8365310766424072,6,False,True,COMPLETE
12,700.6687101075319,0.8487727017002656,True,True,False,True,True,True,False,True,False,True,small,0.29722962363713296,5,65,0.3964656280727688,548,13,none,0.260672223294002,3.998495250235987e-08,mean,0.7111298177043237,6,False,True,COMPLETE
13,743.8444887881668,0.896143686052599,True,True,False,True,True,True,False,True,False,True,small,0.2786169642361196,8,63,0.36524587184869434,507,26,none,0.3482505727304643,1.0353544948917822e-08,mean,0.83820229682637,6,False,True,COMPLETE
14,762.5996714680605,0.988850036121925,True,True,False,True,True,True,False,True,False,True,small,0.16131360679531315,4,70,0.34476799096119626,316,75,none,0.9362537610213211,6.691938157179087e-08,distance_n_turbines,0.7374994104138937,6,False,True,COMPLETE
15,715.9251629863334,0.9231600699128393,True,True,False,True,True,True,False,True,False,True,small,0.15512217537215817,5,5,0.4398578382572226,441,36,none,0.033197924460027194,0.0018697452419893983,mean,0.504508527241715,6,False,True,COMPLETE
16,712.1006202322546,0.8592353238120185,True,True,False,True,True,True,False,True,False,True,small,0.14481952430273226,12,12,0.41430200619211033,383,55,none,0.024606484445592103,0.0022777069571426564,mean,0.502392327991918,6,False,True,COMPLETE
17,716.601938728653,0.8186776093297357,True,True,False,True,True,True,False,True,False,True,small,0.036592867286995144,12,52,0.3183306993781185,581,58,none,0.005826029299434122,0.05248799183564697,mean,0.584405845423401,6,False,True,COMPLETE
18,730.005124158647,0.8629530876775567,False,True,False,True,True,True,False,True,False,True,small,0.13330569376438672,12,6,0.41022758849115215,386,92,none,0.10841466993504294,0.0040003889035038105,mean,0.9999636243854223,6,False,True,COMPLETE
19,736.830427705706,0.7410245845439217,True,True,False,True,True,True,False,True,False,True,small,0.050381723212649665,14,52,0.19805505222028918,550,66,none,0.002196511163419199,0.00028173638696159714,mean,0.7043012318055691,2,False,True,COMPLETE
20,710.2133736474761,0.792891784850051,True,True,False,True,True,True,False,True,False,True,small,0.2925784593540653,9,43,0.11683750946820826,783,39,small,5.2669021319838446e-05,0.9469619326540861,None,0.513291073688139,6,False,True,COMPLETE
21,700.5903830131666,0.7835442569864678,True,True,False,True,True,True,False,True,False,True,small,0.2847991079274501,9,43,0.09015065608322892,812,35,small,2.300952515452276e-05,0.016354509066095684,None,0.508590307910532,6,False,True,COMPLETE
22,722.6531671373265,0.7831314979480691,True,True,False,True,True,True,False,True,False,True,small,0.2981472701203813,9,43,0.08095568238696282,794,35,small,2.6269795368285894e-05,0.6733654000302356,None,0.5571465544598009,6,False,True,COMPLETE
23,722.597045161428,0.6807901704199011,True,True,False,True,True,True,False,True,False,True,small,0.18408405655552354,9,35,0.07457006744543249,867,24,small,1.9399815255634067e-05,0.020376772545183334,None,0.6043339268814145,6,False,True,COMPLETE
24,780.607365593237,0.7654979289998414,True,True,False,True,True,True,False,True,False,True,small,0.21504974692855683,11,57,0.09842248275383246,743,43,small,1.7867270696754986e-06,0.623093568040556,None,0.6559500408940601,6,False,True,COMPLETE
25,736.6358267310756,0.8251806007167033,True,True,False,True,True,True,False,True,False,True,small,0.12278832109531362,8,47,0.0023807474814217244,867,26,small,9.29145031998528e-05,0.018053874641345346,None,0.5504097614223843,6,False,True,COMPLETE
26,801.4402201442384,0.706947513149426,False,True,False,True,True,False,False,False,True,True,small,0.21095200395948557,8,57,0.1356464641914861,758,10,small,2.6040537071012667e-07,0.17506903702581308,capacity,0.5798246454624263,6,False,True,COMPLETE
27,740.2779562907959,0.8960059958471215,True,True,False,True,True,True,False,True,False,True,small,0.2918067565836924,3,100,0.04611077455938483,822,28,small,6.993511976337558e-05,0.0002806013923525052,None,0.5295665112409396,6,False,True,COMPLETE
28,726.796924824757,0.8455583205401571,True,True,False,True,True,True,False,True,False,True,small,0.058242315747057634,11,77,0.13907239464708382,977,87,small,4.293162964986595e-06,0.00781744260019316,None,0.6660242937573628,0,False,True,COMPLETE
29,699.0329687276884,0.7999499525162168,True,True,False,True,True,True,False,True,False,True,none,0.11905614763093018,5,32,0.19957752992427089,698,65,small,0.0006816132520807374,0.12010222366334591,None,0.7166272347647508,2,False,True,COMPLETE
30,741.5393328125879,0.7243432206688174,True,True,False,True,True,True,False,True,False,True,none,0.10689733619783087,5,34,0.1863319250762956,690,65,small,0.0004425946780884193,0.11976868829191221,max,0.720427606380007,2,False,True,COMPLETE
31,768.1636439645325,0.749605715954281,True,True,False,True,True,True,False,True,False,True,none,0.22084085622248179,6,36,0.11152199085262794,871,45,small,0.0019189457134732005,0.2551121675581749,None,0.7156116628579422,2,False,True,COMPLETE
32,705.4021751535653,0.7948881765865891,True,True,False,True,True,True,False,True,False,True,none,0.07473573379260066,7,30,0.23521831107788255,624,64,small,1.179873231039449e-07,0.03229075470690157,None,0.7780442008121705,2,False,True,COMPLETE
33,662.3423136558285,0.8021647498489813,True,True,False,True,True,True,False,True,False,True,none,0.07069266610088627,5,30,0.23196038355285586,628,64,small,1.1279364285354873e-07,0.03462277663373803,None,0.7860264985154235,2,False,True,COMPLETE
34,838.7000463818855,0.8266155430383234,True,True,True,True,True,False,True,False,True,True,none,0.03712180262894358,4,20,0.2691959058669864,649,86,small,8.060538459182849e-08,0.009162550165712895,idw,0.7994131605426877,2,True,True,COMPLETE
35,688.2995778805272,0.8889811817332889,True,False,False,False,False,True,True,True,False,True,none,0.08199796693542985,5,19,0.30477010528880455,712,97,small,3.9983956863721747e-07,0.05624877526119906,None,0.6920485380527345,2,True,True,COMPLETE
36,814.1762855499437,0.9008041693603286,False,False,True,False,False,True,True,True,True,False,none,0.07536868848782699,4,13,0.30984361207829847,698,103,small,3.5021966887761315e-07,0.05119614060568048,None,0.8869010050135243,2,True,True,COMPLETE
37,728.0332712794321,0.956853057383884,True,False,False,False,False,False,True,False,False,True,none,0.04377695587196917,5,19,0.21133751270280102,718,98,small,3.9950505930074775e-06,0.06153370209992892,None,0.7659692763239151,2,True,False,COMPLETE
38,826.6254091707638,0.575042490368842,False,False,False,False,False,True,True,True,True,False,none,0.07544328573002045,3,28,0.16184683589894927,647,126,small,5.0297687477404367e-08,0.0007581110863625639,capacity,0.6931519858346956,2,True,True,COMPLETE
39,699.343236684781,0.7646566731039921,True,False,True,False,False,False,True,False,False,False,large,0.0278571163511094,6,14,0.24859025007005842,918,77,large,1.9993294280516252e-08,0.00777118429440432,None,0.8059421688808024,2,True,False,COMPLETE
40,779.9407345133804,0.6691308233736575,True,False,True,False,False,False,True,False,False,False,large,0.02849046032216437,7,15,0.24985067863936694,937,78,large,2.0627335721842167e-08,0.303947278100357,distance_capacity,0.8052945624753808,2,True,False,COMPLETE
41,692.7688295600982,0.7738227251846431,True,False,True,False,False,False,True,False,False,False,large,0.02450045053091445,6,30,0.29478182228600636,906,123,large,2.4900415339721006e-07,0.009141283426251359,None,0.7450990312055881,2,True,False,COMPLETE
42,706.844852826107,0.7661697052454908,True,False,True,False,False,False,True,False,False,False,large,0.019902854420118132,5,24,0.30394915825018076,922,125,large,4.45537336073369e-07,0.006295412652089485,None,0.7472485414643677,2,True,False,COMPLETE
43,706.1693277682281,0.7250130452847321,True,False,True,False,False,False,True,False,False,False,large,0.02582752816011263,6,31,0.22415224323812438,992,135,large,1.2274880708821562e-07,1.439809998735998e-05,None,0.6868697404841333,2,True,False,COMPLETE
44,762.5646800515348,0.6314781872383276,True,False,True,False,False,False,True,False,False,False,large,0.01318683498915721,6,10,0.27972504324749115,897,118,large,3.00352807957685e-08,0.10534230163848028,idw,0.7927094202678728,2,True,False,COMPLETE
45,729.8378695155949,0.8096522219781691,True,False,True,False,False,False,True,False,False,False,large,0.06481791927018996,7,17,0.29204061425345984,594,70,large,1.0318919536437434e-08,0.0006171963914334321,max,0.827717436203125,2,True,False,COMPLETE
46,748.1342415626419,0.693517669196907,False,False,True,False,False,False,True,False,False,False,large,0.1089305754911436,4,23,0.2543192976121934,843,113,large,1.0272772563536856e-06,0.0026727788075063394,None,0.6423057877436149,2,True,False,COMPLETE
47,774.9843168355752,0.879858607509736,True,False,True,False,False,False,True,False,True,False,none,0.022137874840132497,3,28,0.32547738506754376,963,83,large,1.7036552545160157e-07,0.012428904231370684,None,0.7397447103795105,0,True,False,COMPLETE
48,785.3479674017067,0.8382738423919296,True,False,True,False,False,False,True,False,False,False,none,0.09144352243549439,4,8,0.3686985232722059,673,132,large,6.201125453053263e-08,0.03665007024914712,distance_n_turbines,0.8755815635559823,2,True,False,COMPLETE
49,764.3761060297034,0.7670478112141984,True,False,True,False,False,False,True,False,False,False,large,0.014633470815347336,5,38,0.33627859829382406,939,95,large,0.00021785575724996971,0.31532547822258955,distance_capacity,0.921681513399034,2,True,False,COMPLETE
50,707.301278813918,0.9224681654121027,True,False,True,False,False,False,True,False,False,False,none,0.03287579064273984,6,16,0.17153016048369119,619,59,large,7.563639080025505e-07,0.07577984186105742,None,0.761474303624127,2,True,False,COMPLETE
51,697.9606658540059,0.7990703029945422,True,False,False,False,False,True,True,True,False,True,large,0.04769992982488981,7,32,0.2541038190028389,894,101,small,6.247785986213335e-06,0.023665324802753348,None,0.8267503708693122,2,True,False,COMPLETE
52,690.8564773936001,0.8072881654674948,True,False,True,False,False,True,True,True,False,True,large,0.046036746138480855,7,32,0.25234891047746033,918,72,small,2.6108945581092205e-06,0.0037704019343946446,None,0.8335360665850678,2,True,False,COMPLETE
53,712.5864026446088,0.7994969896722307,True,False,False,False,False,True,True,True,False,True,large,0.049667709225236036,8,33,0.21104253106375087,777,107,small,4.031086966704028e-06,0.001539590567167365,None,0.8192631270909544,2,True,False,COMPLETE
54,716.747110354489,0.812701663499044,True,False,False,False,False,True,True,True,False,True,large,0.08536372945279237,7,24,0.27102993468286796,555,70,small,8.831996608215483e-06,0.00487344839512473,capacity,0.8524782587776808,2,True,False,COMPLETE
55,715.4330861802231,0.7338920789035194,True,False,False,False,False,True,True,True,False,True,large,0.06302352966716508,5,47,0.29294440082088746,893,100,small,9.486103860515152e-07,0.02575105672046385,None,0.7301010481813647,2,True,False,COMPLETE
56,706.7378875746853,0.8668175155840017,True,False,True,False,False,True,True,True,False,True,none,0.04546255468990054,7,39,0.22898675759533835,723,92,small,1.997022149627636e-06,0.0001859966007886382,None,0.7860980568235273,0,True,False,COMPLETE
57,756.8187645681097,0.8375569699957377,True,False,False,False,False,True,True,True,False,True,large,0.0383522379533671,16,31,0.1979430290589016,835,149,small,0.0012533731694680842,0.12088641001532276,idw,0.8520996129579657,2,True,False,COMPLETE
58,811.2050361157329,0.9664862267275192,False,False,False,False,False,True,True,True,False,True,none,0.06738677386447962,8,25,0.2592587376536319,756,51,small,1.0467026861464602e-05,0.0032826376906346807,distance_n_turbines,0.7572469720144015,2,True,False,COMPLETE
59,746.5050196536008,0.9407875267397107,True,False,False,False,False,True,True,True,False,True,large,0.12501094328447704,4,21,0.3546324373025972,966,72,small,5.049943528294427e-07,0.030281318045260984,max,0.6839137522589986,2,True,False,COMPLETE
60,786.0656162362108,0.7814664211787804,True,False,True,False,False,True,True,True,True,True,none,0.05413926628125517,5,48,0.39044394937274207,894,117,small,2.0457831767666507e-06,3.2335990873908574e-05,None,0.914550974626017,2,True,True,COMPLETE
61,713.5135030393576,0.7634934064827041,True,False,True,False,False,True,True,True,False,False,large,0.028679240752100724,6,28,0.24208130315003104,944,79,large,3.4179495342303795e-08,0.009807778730830923,None,0.8137235773640549,2,True,False,COMPLETE
62,699.0853065576363,0.7502705465419918,True,False,True,False,False,True,True,False,False,True,large,0.019122864206057164,6,36,0.28926999393803826,917,60,small,1.9681093637379004e-08,0.014954790166620898,None,0.8629458172507017,2,True,False,COMPLETE
63,719.1229151798776,0.7997551056323907,True,False,True,False,False,True,True,True,False,True,large,0.017921836334579323,7,37,0.28854392828417785,1000,57,small,2.416580672150312e-07,0.015067461156720864,None,0.8670276470454076,2,True,False,COMPLETE
64,699.8334698945126,0.7480282962603346,True,False,True,False,False,True,True,True,False,True,large,0.023501874748096358,6,33,0.3343061548610955,904,61,small,0.00018894696500385976,0.19912556778842808,None,0.8353481175338591,2,True,False,COMPLETE
65,734.1290681684465,0.711078885886708,True,False,False,False,False,True,True,True,False,True,large,0.09569417937847328,5,41,0.3081578746920583,494,88,small,9.264804900559734e-08,0.06837191487491256,None,0.8899205791181858,0,True,True,COMPLETE
66,709.4503634508023,0.7801721060894897,True,False,False,False,False,True,True,True,False,True,none,0.01028246020378689,6,27,0.21696370644734772,855,142,small,1.8713719677648263e-07,0.4981767387505115,None,0.7774406626284528,2,False,False,COMPLETE
67,788.4037648859088,0.8243486375410015,True,False,True,False,False,True,False,False,False,True,large,0.08282572383814575,10,44,0.2708861143225747,817,46,small,3.6897997417752025e-05,0.004369517302951019,distance_capacity,0.8387701598785773,2,True,True,COMPLETE
68,680.2157247617321,0.8809174140161483,True,True,False,True,True,True,False,True,False,True,none,0.0429145471714848,4,31,0.19353080365585312,794,54,small,6.635582292756135e-07,0.001027321451667026,None,0.9663263133124842,2,False,True,COMPLETE
69,718.7095842730172,0.8782566774859789,False,True,False,True,True,True,False,True,False,True,none,0.045704399116574874,4,19,0.1664488118296483,699,53,small,6.44576050657661e-07,0.0008298384144487226,None,0.9821666931932731,2,False,True,COMPLETE
