number,value,params_cloud_lags_option,params_colsample_bytree,params_compute_air_density,params_compute_air_density_moist,params_compute_clear_sky_fraction,params_compute_cloud_cover_fraction,params_compute_diffuse_ratio,params_compute_direct_ratio,params_compute_dni_ratio,params_compute_global_tilted_ratio,params_dew_point_temperature,params_drop_raw_features,params_drop_raw_solar_features,params_lags_target,params_learning_rate,params_max_depth,params_min_child_samples,params_min_split_gain,params_n_estimators,params_num_leaves,params_precip_lags_option,params_reg_alpha,params_reg_lambda,params_shortwave_lags_option,params_spatial_agg_method,params_subsample,params_use_solar_geometry,params_vapor_pressure,state
0,404.62640037464007,none,0.5409918014819335,True,True,True,False,True,True,True,False,False,True,True,1.0,0.1530969413305202,9,93,0.2441445840728811,965,28,large,5.073107015086015e-06,0.14688199814666067,none,mean,0.5208256620165259,False,True,COMPLETE
1,447.4661370296926,small,0.7913818122738531,True,True,False,False,True,True,False,False,False,True,True,12.0,0.05587094191275164,9,40,0.13933351169605296,885,108,none,0.5956007427823927,0.8189990563089956,small,capacity,0.6987328028750782,False,False,COMPLETE
2,412.56368022760444,none,0.5361675529020345,True,True,False,False,False,False,True,True,False,False,False,12.0,0.046813751544422036,5,54,0.1717057623055977,935,131,large,3.065876114825583e-08,0.0003339691004070113,large,distance_n_panels,0.9054483497803607,True,False,COMPLETE
3,483.50381916499873,small,0.6798568913597938,False,True,True,False,False,False,True,True,True,False,True,12.0,0.19502221934366273,4,22,0.45360534832793475,708,32,none,0.046245826707613694,2.1793562300704335e-08,small,None,0.536632331461135,True,True,COMPLETE
4,299.9027045753781,small,0.6822513657106889,False,True,False,False,False,False,False,True,False,False,False,,0.02459015084308776,10,26,0.054483507336880566,907,102,large,7.019759458194086e-08,0.9951033019391331,none,mean,0.9345891358504456,False,False,COMPLETE
5,391.29326111400195,large,0.9957470237321517,False,True,False,False,True,True,True,True,False,True,False,,0.1317785352565194,8,76,0.03365776216673205,368,134,large,0.0025540407649030992,0.0035206906865571123,small,n_panels,0.743199358892128,True,False,COMPLETE
6,368.7134879157006,small,0.8331439158056231,False,False,True,True,False,False,True,False,False,False,True,,0.08174361177256038,16,58,0.1905644941568217,739,34,small,0.43806439973713135,0.0014656592859286837,small,max,0.6793891798109823,False,False,COMPLETE
7,469.5555214712385,large,0.8642587088604793,True,False,True,False,True,True,True,True,False,True,False,1.0,0.09282061402248072,6,44,0.35183189034221646,915,103,small,2.560535843765664e-06,0.002513131016496159,large,None,0.7489860507585278,False,False,COMPLETE
8,494.5527837290162,small,0.742219942369039,True,False,True,False,False,False,True,False,True,False,True,12.0,0.025998070054492863,6,76,0.06664306226505373,820,67,none,2.485731465546521e-07,0.00012120477081356537,small,n_panels,0.8788038129073197,False,False,COMPLETE
9,436.80199718683224,large,0.5712662533199697,True,False,True,True,True,False,True,False,False,False,True,6.0,0.16680185402044262,7,75,0.3664231249962552,853,60,none,0.41047977585540685,0.083279811762249,large,capacity,0.9379463268681575,True,True,COMPLETE
10,309.8518573678436,medium,0.6496020862819969,False,True,False,True,False,False,False,True,True,False,False,,0.01271143445048785,13,7,0.08070589521622346,454,95,large,8.081174461666726e-05,4.892265776519674e-07,none,mean,0.9973162655788078,False,True,COMPLETE
11,303.8862131027017,medium,0.6413161175742351,False,True,False,True,False,False,False,True,True,False,False,,0.012542827131833868,13,7,0.009781570892776682,523,94,large,0.00014775473196607537,4.4781586236756573e-07,none,mean,0.995995003143729,False,True,COMPLETE
12,311.33614331192695,medium,0.644649674420046,False,True,False,True,False,False,False,True,True,False,False,,0.01101406939856359,12,7,0.004401017182082049,549,84,large,0.00031804678283098,3.2040773369502095e-06,none,mean,0.8369635354678611,False,True,COMPLETE
13,343.70306395400894,medium,0.712282995491047,False,True,False,True,False,False,False,True,True,False,False,,0.021078105476345657,13,26,0.11719971256239087,589,118,large,2.2412813143345065e-05,2.810136404557377e-06,medium,distance_capacity,0.9713337062104744,False,True,COMPLETE
14,404.5993779581022,medium,0.6119799001202092,False,True,False,True,False,False,False,True,True,False,False,6.0,0.022686857103417418,11,23,0.0038410418197181856,512,64,large,0.0013855839287417494,2.384642882453115e-08,none,idw,0.8421682701750659,False,False,COMPLETE
15,314.0742769823201,small,0.500981564022382,False,True,False,True,False,False,False,True,True,False,False,,0.016314899380496375,16,33,0.21441905041317047,680,147,large,2.690539427686355e-07,1.052853370599594e-05,none,mean,0.8210640261145845,False,True,COMPLETE
16,315.98057136503667,medium,0.606345581846603,False,True,False,True,False,False,False,True,True,False,False,,0.03330520653626408,14,16,0.31025273007933823,319,81,small,2.51487064438401e-08,1.8285252041597405e-07,medium,mean,0.934315167929951,False,False,COMPLETE
17,327.5253047941016,none,0.9268291541271285,False,True,False,False,False,False,False,True,False,False,False,,0.03637658200040768,11,14,0.08386132886406492,784,52,large,0.011708567783628082,2.6299521683887817e-05,none,max,0.6355915213222535,False,True,COMPLETE
18,498.0230198633463,medium,0.711878254107691,False,False,False,True,False,True,False,True,False,True,False,6.0,0.2928545522756777,10,34,0.13021096374621524,609,10,large,6.161851996776714e-06,0.025274246463915313,none,idw,0.9956560510860608,True,True,COMPLETE
19,434.2863289585146,small,0.783472153868829,False,True,False,False,False,False,False,True,True,False,False,1.0,0.015202954834435211,14,5,0.29095443952390226,440,93,small,2.4621212635898534e-07,2.215422164742642e-07,none,distance_capacity,0.7950157557706631,False,False,COMPLETE
20,367.3539976761578,small,0.6747938400573017,False,True,False,True,False,False,False,True,True,False,False,,0.016476115587702362,3,63,0.4829996669698595,639,117,large,0.0002277458519597828,0.020983812774737515,medium,distance_n_panels,0.9008837925621056,False,True,COMPLETE
21,312.89524014746274,medium,0.6298190019643736,False,True,False,True,False,False,False,True,True,False,False,,0.01012556565455115,14,13,0.06293875164524801,461,98,large,6.915890031243594e-05,3.172612449637521e-07,none,mean,0.9969475648193494,False,True,COMPLETE
22,310.60539377623513,medium,0.6714049717475385,False,True,False,True,False,False,False,True,True,False,False,,0.01328512385839249,12,6,0.08849968092925146,431,86,large,3.181977816528848e-05,9.912920296558099e-07,none,mean,0.9469749983419915,False,True,COMPLETE
23,316.97533039669185,medium,0.5983381040466623,False,True,False,True,False,False,False,True,True,False,False,,0.019785916903796504,15,29,0.04490803784821694,501,111,large,0.0011606819843393253,4.4426047973817245e-05,none,mean,0.9962362818169287,False,True,COMPLETE
24,309.909512230033,medium,0.7280943306371922,False,True,False,True,False,False,False,True,True,False,False,,0.029528420826927176,12,16,0.002722157234645765,394,73,large,1.1271120406638104e-06,3.857119605620621e-08,none,mean,0.8811121751731212,False,True,COMPLETE
25,312.8910509341554,medium,0.7774548800528466,False,True,False,True,False,False,False,True,True,False,False,,0.013354471925827527,10,44,0.10058430988126775,524,126,large,0.015662172690411817,5.924019965418081e-06,none,mean,0.954309841780362,False,True,COMPLETE
26,333.9363520737295,none,0.6645882637456885,False,False,False,False,True,True,False,False,False,True,False,,0.010369522778001478,13,13,0.03892073334930022,310,98,large,1.2254899801596127e-05,9.452733272500399e-07,none,mean,0.9151376559148899,True,False,COMPLETE
27,397.7142525239087,large,0.5748225847604959,False,True,False,True,False,False,False,True,True,False,False,1.0,0.018093629473685695,11,17,0.16315947358131455,569,50,large,0.0002172263525051797,0.0004407393275603885,none,mean,0.9689121362813383,False,True,COMPLETE
28,458.1605792989088,medium,0.694131789181006,False,True,False,False,False,False,False,True,False,False,False,6.0,0.013022926504218928,13,21,0.14555208346888981,654,92,none,7.919088082692201e-07,0.8387735979039548,medium,capacity,0.8759446585684652,False,False,COMPLETE
29,417.34473000345605,none,0.7572215167328823,True,True,True,False,True,True,False,False,False,True,True,1.0,0.04481208063799226,9,35,0.236568994714138,479,77,small,1.0990473353671981e-08,8.381571429313241e-08,none,mean,0.5397429207845352,False,True,COMPLETE
30,320.4523847215654,small,0.6445282022428346,False,True,False,True,False,False,False,True,True,False,False,,0.02395767513130174,8,87,0.03428944399629607,979,143,large,6.961057759749012e-05,8.131304673211632e-07,large,idw,0.8028255677861643,False,True,COMPLETE
31,312.0419156145532,medium,0.7305984635555381,False,True,False,True,False,False,False,True,True,False,False,,0.029802740997571017,12,11,0.010210960789725028,373,76,large,7.620594309509534e-07,1.2399847929946979e-08,none,mean,0.8723568917089434,False,True,COMPLETE
32,322.6909986596267,medium,0.8220743318996652,False,True,False,True,False,False,False,True,True,False,False,,0.06301870019636575,15,8,0.0712200800467997,373,72,large,2.2406656305357526e-06,5.6755368728687336e-08,none,mean,0.9741233783857718,False,True,COMPLETE
33,347.3382392216067,medium,0.7094409124855509,False,True,False,True,False,False,False,True,True,False,False,,0.039992602685993084,10,19,0.0017631575854315448,411,111,large,8.441383635058951e-08,8.352018560008569e-08,none,distance_n_panels,0.9147739183294235,False,True,COMPLETE
34,448.38984387559054,medium,0.575304111228732,True,True,False,True,False,False,False,True,True,False,True,12.0,0.03093029534381364,12,28,0.045731629081147966,406,89,large,5.862666669571101e-08,5.376005953486183e-07,none,mean,0.9238488834340964,False,True,COMPLETE
35,322.5255098755777,small,0.541832089432659,False,True,False,False,True,True,False,True,False,True,False,,0.02689213686414811,11,39,0.10754791263787515,343,104,none,1.237577905706623e-06,4.1080631341531745e-08,none,None,0.9559845700328455,True,False,COMPLETE
36,493.6489982434798,medium,0.6390317898151099,False,True,False,False,False,False,False,False,True,False,False,12.0,0.06098626731185625,13,23,0.02941020479898021,748,57,large,9.668095381295455e-06,1.6291012678017016e-05,small,n_panels,0.8662450635436985,False,True,COMPLETE
37,356.8083252690844,none,0.7447441062808106,True,True,True,True,False,False,True,True,False,False,True,,0.04811837682715299,15,49,0.16311860557948316,471,41,large,0.0052146742120292786,0.19232249557636447,large,max,0.897150239886413,True,False,COMPLETE
38,368.3326328321932,large,0.8578873602702939,False,False,False,False,True,True,True,True,True,True,False,,0.019860523440800745,8,17,0.06244041704193441,549,69,large,0.0005843311983967929,9.658907702065234e-05,none,distance_capacity,0.7818531807598822,False,True,COMPLETE
39,424.27177955036694,small,0.6989330205644992,False,True,True,True,False,False,False,False,False,False,False,12.0,0.0130398598033735,9,9,0.1942876310862443,921,125,none,1.321402618311845e-07,1.9733867646355147e-06,small,None,0.9788257719966662,False,False,COMPLETE
40,482.21182717472493,medium,0.8143355884748567,True,False,False,False,False,False,True,True,True,False,True,1.0,0.0741539584490647,14,27,0.39578230766787165,996,99,small,0.10655552104470231,0.0007748349238000292,large,capacity,0.7191717952835158,True,True,COMPLETE
41,313.03472777575183,medium,0.6743945038803336,False,True,False,True,False,False,False,True,True,False,False,,0.012799567544343185,12,6,0.09444298631491761,378,84,large,3.724922778541175e-05,1.0475155861954598e-06,none,mean,0.9398254044371342,False,True,COMPLETE
42,309.91916937365926,medium,0.6520476871582711,False,True,False,True,False,False,False,True,True,False,False,,0.015158271666622786,12,12,0.08015853705633796,427,88,large,3.317423583652329e-05,1.891427976858669e-07,none,mean,0.9482997388507564,False,True,COMPLETE
43,307.9452747556209,medium,0.6191820532003363,False,True,False,True,False,False,False,True,True,False,False,,0.015382987755382346,11,10,0.022726769946531115,866,103,large,3.7820319751251064e-06,1.3230915541265196e-07,none,mean,0.8920528784437343,False,True,COMPLETE
44,375.0063221314438,medium,0.6095032009028537,False,True,False,True,False,False,False,True,True,False,False,,0.01845883602771694,11,20,0.02371648544969849,884,105,large,3.279072615200797e-06,1.1290153684975015e-08,none,n_panels,0.8401503370041292,False,True,COMPLETE
45,306.2615263858657,large,0.6197485997055735,False,True,True,True,False,False,False,True,True,False,False,,0.026114252112964906,10,10,0.05464953875237669,952,116,large,4.349320192994697e-07,2.604022039947807e-08,none,mean,0.8945091743611782,False,False,COMPLETE
46,382.515206680964,large,0.5361083366814439,False,True,True,True,True,False,False,True,False,False,False,6.0,0.022536110055801035,8,10,0.13262389206663444,956,116,large,4.814558911540133e-07,0.008079269476970975,small,mean,0.6219428888725299,False,False,COMPLETE
47,344.2921777094328,large,0.6247160370585635,False,True,True,True,False,False,True,False,True,False,False,,0.016619577214621376,10,24,0.05450482962327452,851,137,none,2.838647302245326e-08,5.744172755532827e-06,medium,distance_n_panels,0.8515416741693694,False,False,COMPLETE
48,354.70179928956986,large,0.5855238706267419,True,False,True,True,False,False,False,True,True,False,True,,0.12104164279528326,7,67,0.12188933469339461,807,125,large,4.222027685139876e-06,3.7488469400770944e-07,none,max,0.8997787590478333,False,False,COMPLETE
49,301.943398173619,large,0.5110388102847719,False,True,True,False,False,True,False,True,False,True,False,,0.011774810701434888,10,31,0.02647162626203328,893,108,small,0.00015258386156135627,1.1818551969915116e-07,none,mean,0.9722222640371075,False,False,COMPLETE
50,424.75908103758314,large,0.5493300947199609,False,True,True,False,False,True,False,True,False,True,False,12.0,0.02550518905333877,7,41,0.02446729788048924,894,109,small,0.0005468055353819181,1.0326360259140307e-07,none,mean,0.7658677036980446,False,False,COMPLETE
51,306.8231005558853,large,0.5131917047332284,False,True,True,False,False,True,False,True,False,True,False,,0.01455460775268984,9,5,0.06168098620195987,936,96,small,0.00014030865913955203,2.5020363399691447e-08,none,mean,0.976273040602649,False,False,COMPLETE
52,301.84583514970797,large,0.5033235086779823,False,True,True,False,False,True,False,True,False,True,False,,0.011331894886921483,9,31,0.021514324054168678,952,117,small,0.00016069764466114292,1.9210451139896514e-08,none,mean,0.9720125456233283,False,False,COMPLETE
53,304.3844873723209,large,0.5019766218306982,False,True,True,False,False,True,False,True,False,True,False,,0.011637901057819554,9,47,0.06065329488345385,946,121,small,0.0001376815208250705,2.035907589828369e-08,none,mean,0.9762134236510286,False,False,COMPLETE
54,317.91411055972264,large,0.5192736903427113,False,True,True,False,False,True,False,True,False,True,False,,0.011637705593410796,6,50,0.05147382479392837,946,117,small,0.0005659689937500945,2.3956698934109642e-08,none,mean,0.9253885420979152,False,False,COMPLETE
55,335.5450282446871,large,0.5518475953191299,False,True,True,False,False,True,False,True,False,True,False,,0.010674408170591756,10,32,0.07723572341242464,908,134,small,0.0022264027278912097,1.320231496560227e-08,none,distance_capacity,0.9626727149151264,False,False,COMPLETE
56,419.81773724148644,large,0.527911752681766,False,True,True,False,False,True,False,True,False,True,False,6.0,0.011701951988530301,9,100,0.017407700295739646,830,124,small,0.00012544322751010473,4.9377655011413186e-08,none,idw,0.9909125591967177,True,False,COMPLETE
57,316.1670395737281,large,0.505472574643022,False,True,True,False,False,True,True,True,False,True,False,,0.010068065415869965,7,59,0.10783524898096908,996,121,small,1.816393708332005e-05,0.12893276366847528,large,mean,0.9330607663909382,False,False,COMPLETE
58,381.64460381062503,large,0.5579465674629676,False,False,True,False,False,True,False,True,False,True,False,,0.011682171826838061,8,37,0.29305630840646635,965,130,small,0.00037210528893785055,2.546784592534534e-08,medium,capacity,0.9822439330980097,False,False,COMPLETE
59,302.58246967716457,large,0.5837129860336113,False,True,True,False,True,True,False,True,False,True,False,,0.01830968179545846,10,45,0.0413014145305013,774,112,small,0.0012421392278985314,1.0513430066453857e-08,none,mean,0.9999442669006599,False,False,COMPLETE
60,400.5352159659258,large,0.5861124646707752,False,True,True,False,True,True,False,False,False,True,False,1.0,0.017452869986476494,5,43,0.03765214126453319,688,112,small,0.0017488381348377251,0.4481289203707346,small,None,0.9988907833822162,False,False,COMPLETE
61,301.7857511843885,large,0.5633552144057056,False,True,True,False,True,True,False,True,False,True,False,,0.014483948959021737,10,46,0.00013675457516438422,759,115,small,5.563385656671312e-05,1.0036373958509945e-08,none,mean,0.9633838303050645,False,False,COMPLETE
62,302.207287982968,large,0.5025522194045671,False,True,True,False,True,True,False,True,False,True,False,,0.013826890926887627,9,47,0.014403692749811625,775,107,small,0.007088008754977597,1.0597235945503246e-08,none,mean,0.9573585854878508,False,False,COMPLETE
63,302.34074736310896,large,0.5232964639516979,False,True,True,False,True,True,False,True,False,True,False,,0.014553341593697278,10,53,0.01095144248126467,753,107,small,0.003638892613288651,1.1745671694956807e-08,none,mean,0.9588368807625427,False,False,COMPLETE
64,304.71884657821175,large,0.5252485490842752,False,True,True,False,True,True,False,True,False,True,False,,0.013993268413673756,10,54,0.023099165844429705,750,108,small,0.005393650971042054,1.1441614182917212e-08,none,mean,0.9592222631888885,False,False,COMPLETE
65,300.5616114552949,large,0.5613509853769437,False,True,True,False,True,True,False,True,False,True,False,,0.021479388474944478,9,55,0.0009877012671000735,771,113,small,0.010757750383092552,1.0272457034463475e-08,none,mean,0.9418943582311916,False,False,COMPLETE
66,370.237168274732,large,0.5611100746712206,False,True,True,False,True,True,False,True,False,True,False,,0.02145535118897645,9,60,0.0004981916529720118,720,102,small,0.04235891396937365,6.593745857478316e-08,none,n_panels,0.9421211172861209,False,False,COMPLETE
67,305.40770132654023,small,0.5349083808461226,False,True,True,False,True,True,False,True,False,True,False,,0.014527282535063414,8,55,0.013551122020475025,796,106,small,0.023478463431502866,5.119394668903676e-08,none,mean,0.9160545116650507,False,False,COMPLETE
68,319.57933940599264,large,0.5149671261517554,True,True,True,False,True,True,False,True,False,True,True,,0.019731295440414746,8,72,0.0019619462818592373,832,100,small,0.09668908641985123,1.2770153520744032e-07,none,mean,0.9611756923773868,False,False,COMPLETE
69,416.19560664316106,large,0.5576278645411116,False,True,True,False,True,True,False,True,False,True,False,6.0,0.016309066516350113,11,31,0.03317829683512831,771,93,small,0.9089107842926246,1.6591510151035143e-08,none,distance_n_panels,0.9309263540311159,True,False,COMPLETE
