number,value,params_cloud_lags_option,params_colsample_bytree,params_compute_air_density,params_compute_cloud_cover_fraction,params_compute_cooling_degree_hours,params_compute_dew_point_spread,params_compute_effective_solar,params_compute_heating_degree_hours,params_compute_humidex,params_compute_pressure_trend,params_compute_rain_indicator,params_compute_temp_gradient,params_compute_wind_chill,params_compute_wind_components,params_compute_wind_power_density,params_compute_wind_speed_gradient,params_drop_basic_meteo_features,params_drop_rad_meteo_features,params_drop_wind_meteo_features,params_learning_rate,params_max_depth,params_min_child_samples,params_min_split_gain,params_n_estimators,params_num_leaves,params_precip_lags_option,params_reg_alpha,params_reg_lambda,params_rolling_temp_option,params_spatial_agg_method,params_subsample,params_temp_lags_option,params_use_base_models_pred_intervals,state
0,2962.39016855583,small,0.8227196917501869,False,False,False,False,False,False,False,False,True,True,True,False,True,True,False,True,False,0.1704843624277228,7,35,0.22564613889625051,875,28,none,0.10238503524749427,1.1838095224384507e-06,short,max,0.7703246313275904,none,False,COMPLETE
1,3005.515640349275,medium,0.8668914005928333,False,False,False,True,False,True,False,True,True,True,True,False,True,False,True,False,False,0.2720685819835299,8,43,0.4711394527292681,763,148,none,0.007395564467345764,8.212399327877082e-05,short,population,0.9781869006654709,none,False,COMPLETE
2,2836.706664327255,none,0.9213578282185357,False,False,True,True,False,True,False,True,False,False,True,False,True,True,False,True,True,0.08512733002727524,12,86,0.1651670572807083,386,107,medium,0.15175579279186316,0.0014215642943399833,none,None,0.7677899650118349,small,False,COMPLETE
3,3232.1396357010544,small,0.6851369814872009,True,False,True,False,True,True,True,False,False,True,False,False,True,False,True,True,False,0.2848538824731919,6,93,0.06367761681775908,595,50,small,2.3329030386256407e-07,2.76764088294074e-06,short,population,0.7945142437500721,small,False,COMPLETE
4,2803.674910481873,medium,0.7214190293946878,False,False,True,True,False,False,False,True,False,True,False,False,False,True,False,False,False,0.11323201175209967,8,76,0.3658553070520183,517,95,medium,1.2149668439348525e-07,0.09039253441789422,long,energy,0.597686372085626,medium,True,COMPLETE
5,2946.9212739702743,medium,0.6699469366315196,True,False,False,True,True,False,False,False,True,True,False,False,True,False,False,True,False,0.12827954716947268,16,33,0.2674348483826145,740,145,none,1.0429605186081988e-06,5.336740652174851e-08,short,population,0.5057191633287899,small,False,COMPLETE
6,2897.6387158025987,medium,0.7896998260759648,True,False,False,False,True,False,True,False,False,False,False,True,True,True,False,True,True,0.17362713578409064,12,12,0.04368277487158212,502,79,medium,1.3960547158873313e-07,3.156061407857556e-08,long,distance_energy,0.8746022364884289,small,True,COMPLETE
7,3107.959209253943,none,0.9983586659979266,False,True,True,False,True,False,True,False,True,False,True,True,False,True,True,False,False,0.09442404504704399,8,7,0.3683766483322547,948,86,small,3.5859064346195667e-07,2.0154484045207826e-06,long,population,0.8486069986928955,none,True,COMPLETE
8,2847.5322796412097,none,0.8687416636254237,True,False,True,True,False,False,False,False,True,False,True,False,True,True,False,False,False,0.013610256934506664,4,61,0.24611440841319238,376,97,none,0.011283745310954125,3.845156856047632e-06,long,population,0.6849825001757185,none,True,COMPLETE
9,2989.367325159857,medium,0.5163468700730989,True,False,False,True,False,True,True,False,True,False,True,False,True,False,True,True,True,0.02082991443708279,16,38,0.0851561368650745,696,100,small,0.021885268062786158,0.014459448375986323,long,mean,0.5890039115488803,small,False,COMPLETE
10,2868.6878178535057,medium,0.5622621278356106,False,True,True,True,False,False,False,True,False,True,False,True,False,True,False,False,True,0.034374353701702595,3,70,0.48949893323401344,539,54,medium,2.6241385297631648e-05,0.39468696528836145,none,energy,0.6471609925496544,medium,True,COMPLETE
11,2801.4308802201126,none,0.9737159855331758,False,True,True,True,False,True,False,True,False,False,False,False,False,True,False,False,True,0.0622462761352935,12,87,0.1500098554139777,301,123,medium,0.9115409798253995,0.008048415860494158,none,None,0.6827855981117242,medium,True,COMPLETE
12,2766.2878859706593,none,0.709553792105931,False,True,True,True,False,True,False,True,False,False,False,False,False,True,False,False,True,0.04984886067758447,11,77,0.40149140546217255,309,120,medium,1.071731521429674e-08,0.9497604780440284,none,idw,0.5888965250888719,medium,True,COMPLETE
13,2810.0078730333735,none,0.6148634421475044,False,True,True,True,False,True,False,True,False,False,False,False,False,True,False,False,True,0.04673642264712376,11,97,0.3598823168012608,381,124,medium,0.0004249541664378899,0.8852089593912479,none,idw,0.5153747462397613,medium,True,COMPLETE
14,2815.4186478431607,none,0.955142119764621,False,True,True,True,False,True,False,True,False,False,False,True,False,True,False,False,True,0.05585689877960534,14,82,0.13499113659555045,302,126,medium,1.005016511258337e-08,0.005665810828920085,none,None,0.6892510915581775,medium,True,COMPLETE
15,2721.5219833404276,none,0.7602814731307128,False,True,True,True,False,True,False,True,False,False,False,False,False,True,False,False,True,0.02715238332446188,10,61,0.31441097817704367,300,127,medium,2.09091986671218e-05,0.0006140390905290428,none,distance_population,0.6004291918289071,medium,True,COMPLETE
16,2715.1825524545693,none,0.7664084310065623,False,True,True,True,False,True,False,True,False,False,False,False,False,True,False,False,True,0.02453070273851077,10,58,0.41160046566064407,443,68,medium,1.34285935731086e-05,0.00018326372394601048,none,distance_population,0.5716504042242071,medium,True,COMPLETE
17,2715.2119608198973,none,0.774886104806694,False,True,True,True,False,True,False,True,False,False,False,False,False,True,False,False,True,0.02038939520382527,10,54,0.2999953484985628,454,69,medium,2.221650659770374e-05,0.00010414205458696644,none,distance_population,0.5600088221425953,medium,True,COMPLETE
18,2921.4556201428254,small,0.6332784865585858,False,True,True,False,True,True,True,True,False,False,False,True,False,False,True,False,True,0.010276563790387357,14,50,0.4333304341950903,443,64,medium,0.00037900589446596594,2.775048737314397e-05,none,distance_population,0.5426326914093769,medium,True,COMPLETE
19,2691.936014694886,none,0.8099614309058136,False,True,True,True,False,True,False,True,False,False,False,False,False,True,False,False,True,0.01835784699440486,5,23,0.3061599191291944,615,10,small,2.8684779667628197e-06,0.00037951019408632227,none,distance_population,0.6451904521900409,medium,True,COMPLETE
20,2705.5221224268607,none,0.8425528795690455,False,True,True,True,False,True,False,True,False,False,False,False,False,True,False,False,True,0.015166102737161626,5,26,0.4347759352143068,613,24,small,2.9482179485989746e-06,0.00038554362736283797,none,distance_population,0.6407666116414772,medium,True,COMPLETE
21,2689.534338014421,none,0.8365016146192215,False,True,True,True,False,True,False,True,False,False,False,False,False,True,False,False,True,0.016136818932915232,5,22,0.44029130939463446,586,14,small,3.261598774616032e-06,0.0004941455210185271,none,distance_population,0.6328756341517936,medium,True,COMPLETE
22,2696.5912431957363,none,0.8510480707754821,False,True,True,True,False,True,False,True,False,False,False,False,False,True,False,False,True,0.014558695401269273,5,23,0.4527607745537913,610,11,small,2.9250913412588206e-06,1.4497981934424937e-05,none,distance_population,0.6465050533270273,medium,True,COMPLETE
23,2682.9617466764653,none,0.9092555234256021,False,True,True,True,False,True,False,True,False,False,False,False,False,True,False,False,True,0.01038675594982357,3,20,0.49833071763832143,653,10,small,2.559142592994857e-06,2.4429015227487833e-07,none,distance_population,0.7213652168658886,medium,True,COMPLETE
24,2677.2932213225586,none,0.9135174800872797,False,True,True,True,False,True,False,True,False,False,False,False,False,True,False,False,True,0.010530522197261829,3,17,0.32297196476135537,681,10,small,0.00016749287663369686,2.2378874472397104e-07,none,distance_population,0.713568136176388,medium,True,COMPLETE
25,2758.663885656861,small,0.9124164270391136,False,True,True,True,False,True,False,True,False,False,False,False,False,True,False,False,True,0.011306388342853224,3,18,0.34354451413517556,827,33,small,0.0001837364635572934,1.6035142320138592e-07,none,max,0.7224369636794511,medium,True,COMPLETE
26,2850.477149394501,none,0.920192582867468,True,True,False,False,True,True,True,True,False,False,False,True,False,False,True,False,True,0.01060549256375778,3,13,0.49667699995993103,690,43,small,0.0022394640984749518,3.0578218812033736e-07,none,distance_energy,0.8212442622487696,medium,True,COMPLETE
27,2753.955314834495,none,0.8902416185381437,False,True,True,True,False,True,False,True,False,False,False,False,False,True,False,False,True,0.03317670986584146,4,6,0.4110574088049387,676,19,small,7.642205467810373e-05,1.8781333663663802e-08,none,mean,0.9102032389012186,medium,True,COMPLETE
28,2718.502084397402,none,0.9622097516394542,False,True,True,True,False,True,False,True,False,False,False,False,False,True,False,False,True,0.01588416314047347,6,29,0.4528333005395565,753,37,small,0.0008803941949714112,4.3965981918890866e-07,short,distance_population,0.7260866695714172,none,True,COMPLETE
29,2797.4539151525482,small,0.814909544678392,False,True,False,False,False,True,False,True,True,True,True,False,False,True,False,True,True,0.012716756229904315,7,40,0.18821864581510897,818,21,small,9.50430571964859e-05,1.5734882428672978e-05,none,max,0.7382851252799497,medium,False,COMPLETE
30,2688.133541957861,none,0.890996834847483,False,True,True,True,False,True,False,True,False,False,False,False,False,True,False,False,True,0.01783944035087644,4,16,0.38625558377233604,649,28,small,5.451471518024707e-06,1.0768546579873177e-07,short,distance_population,0.773440998957177,none,True,COMPLETE
31,2672.8759560367957,none,0.9044016153256714,False,True,True,True,False,True,False,True,False,False,False,False,False,True,False,False,True,0.017192146808530418,4,16,0.3874139594371824,567,30,small,6.9199153773445525e-06,1.3698413174888372e-07,short,distance_population,0.7903680724892214,none,True,COMPLETE
32,2702.802716450959,none,0.8890457353313532,False,True,True,True,False,True,False,True,False,False,False,False,False,True,False,False,True,0.023479225612673592,4,15,0.2727840557593655,646,28,small,6.905326363393648e-06,8.907743187801335e-08,short,distance_population,0.7940850509004557,none,True,COMPLETE
33,2687.160222766943,none,0.9336933895222297,False,True,True,True,False,True,False,True,False,False,False,False,False,True,False,False,True,0.031046533237496378,3,30,0.4023349839811643,725,40,small,8.336125797100632e-07,1.2168432243867877e-08,short,distance_population,0.7780648560145901,none,True,COMPLETE
34,2824.9724783449583,none,0.9406581006891838,False,True,True,True,False,True,False,True,False,True,True,False,False,False,True,False,False,0.03253793646197644,3,32,0.3305823572293277,555,42,none,5.445823883263426e-08,1.4216446494839432e-08,short,distance_population,0.7597380442476692,none,False,COMPLETE
35,2757.4546252535165,small,0.9323529403812134,False,True,True,True,False,True,False,True,False,False,False,False,False,True,False,True,True,0.012558263870967958,6,44,0.4731195061020372,788,48,small,5.802474118345193e-07,5.85374966245222e-07,short,distance_population,0.9168184131940749,none,True,COMPLETE
36,2772.0948983153116,none,0.9862263430896117,False,True,False,True,False,True,False,True,True,True,False,False,True,True,False,False,False,0.039884938471251755,7,9,0.3917584033340207,914,34,small,1.18270052479222e-06,1.4506614120212395e-06,short,energy,0.8261497203708265,none,False,COMPLETE
37,2779.3176741059,none,0.9082064885334825,True,False,True,False,True,False,True,False,False,False,False,False,False,False,False,True,True,0.027084477549215183,3,19,0.1994431704605011,730,18,none,5.255420810958553e-05,3.827599930639276e-08,short,distance_energy,0.7017629922366709,none,True,COMPLETE
38,2807.6724178987984,medium,0.8743656704152049,False,True,True,True,False,True,False,True,False,False,True,False,True,True,True,False,True,0.012309225554532139,4,31,0.0036399917668607784,711,58,small,6.047928762833024e-08,1.217053922216157e-08,short,mean,0.7935795297841076,none,False,COMPLETE
39,2929.532965257931,none,0.9448351896288236,True,False,False,True,True,False,False,False,True,True,False,True,False,True,False,False,False,0.07192776311701765,6,27,0.3392581591730489,795,26,small,9.008192219240363e-07,1.8524932713360144e-07,short,max,0.8592093677225903,small,True,COMPLETE
40,2915.7743658283307,small,0.8579632243290393,False,True,True,False,False,True,True,True,False,False,True,False,True,True,False,True,True,0.20700811660737148,7,36,0.27681544451674234,868,39,small,0.002771858846030215,3.578082188788738e-06,short,idw,0.7572427441338018,none,True,COMPLETE
41,2691.3753204269997,none,0.8964891583324227,False,True,True,True,False,True,False,True,False,False,False,False,False,True,False,False,True,0.019874581697883278,4,16,0.37902771835731275,644,30,small,7.379316835034262e-06,6.846752818362538e-08,short,distance_population,0.7777667066082379,none,True,COMPLETE
42,2692.136473169498,none,0.930221522894991,False,True,True,True,False,True,False,True,False,False,False,False,False,True,False,False,True,0.017318080261439942,4,10,0.3588143181789866,650,17,small,2.713608110869553e-07,9.560521683528817e-07,short,distance_population,0.8199925304065436,none,True,COMPLETE
43,2698.412782355495,none,0.9730855116262707,False,True,True,True,False,True,False,True,False,False,False,False,False,True,False,False,True,0.010094885477982282,3,5,0.4217949326562634,566,10,small,9.519582366368001e-06,1.0462894488241163e-07,short,distance_population,0.7117759764108066,none,True,COMPLETE
44,2850.9548089004825,medium,0.8693587290636948,False,False,True,True,False,False,False,False,False,False,False,False,False,True,False,False,True,0.013881313931055204,5,20,0.3799360895163827,511,25,none,5.0298971452600164e-05,3.693943232196563e-08,long,population,0.7728446856416514,none,True,COMPLETE
45,2791.970215017924,none,0.9949006645389479,True,True,True,True,False,True,False,True,True,False,False,False,False,True,False,False,False,0.022687167637092935,4,13,0.4718439300249933,675,46,small,1.5887096220467758e-06,2.6113524482796616e-07,short,None,0.9957707641482849,small,True,COMPLETE
46,2653.893886087461,none,0.8006966000469377,False,True,True,True,False,True,False,True,False,False,False,False,False,False,True,False,True,0.017597087722804376,3,26,0.2400668156926645,727,55,small,4.474356116037594e-07,1.05748216351224e-08,long,energy,0.7394962567757286,none,True,COMPLETE
47,2841.496860105321,none,0.8013195951983718,False,True,False,True,True,True,False,False,False,False,False,True,True,False,True,False,True,0.02990017871565736,3,42,0.2501593433730075,725,77,small,9.529103681216706e-08,2.889761363459118e-08,long,energy,0.6663167277441606,none,False,COMPLETE
48,2739.535018923431,medium,0.7364121401946642,False,False,True,True,False,False,True,True,False,True,False,False,False,False,True,True,True,0.040054497163331364,8,35,0.2132090933423187,770,36,small,3.978061365081854e-07,1.2521935129758925e-08,long,energy,0.7453114882346399,small,True,COMPLETE
49,2762.845645041051,none,0.8233876700784081,False,True,True,True,False,True,False,True,False,False,True,False,False,False,True,False,False,0.012051064441986805,3,25,0.23382982998614713,481,58,none,3.052963714930637e-08,1.0057467535480314e-06,long,energy,0.8868963833091409,none,True,COMPLETE
50,2761.5120684018298,none,0.6996331035649868,True,True,True,True,False,True,False,True,True,False,False,False,False,False,True,False,True,0.01415429091492745,5,48,0.12218992706736978,995,16,small,2.1782804639690634e-07,4.800672249596025e-08,long,energy,0.7384521464013831,none,True,COMPLETE
51,2766.4832523817113,none,0.8866922584022474,False,True,True,True,False,True,False,True,False,False,False,False,False,False,True,False,True,0.018300675921034803,4,16,0.28650687483198706,702,53,small,5.5915720248840814e-06,1.0417150017279311e-07,short,distance_population,0.7995245608222673,none,True,COMPLETE
52,2686.5772279195485,none,0.9135335936924321,False,True,True,True,False,True,False,True,False,False,False,False,False,True,False,False,True,0.021307234462519625,3,29,0.395793032439451,664,31,small,1.5037168911906276e-06,2.4409916358034005e-08,long,distance_population,0.6742694714072283,none,True,COMPLETE
53,2712.705103058431,none,0.9487128347070628,False,True,True,True,False,True,False,True,False,False,False,False,False,True,False,False,True,0.02631136288749096,3,32,0.3314443012057158,587,23,small,6.479662875632731e-07,2.846756920479158e-08,long,distance_population,0.6656204519051204,none,True,COMPLETE
54,2707.1400528400104,none,0.9138823706940548,False,True,True,True,False,True,False,True,False,False,False,False,False,True,False,False,True,0.021319408700475224,3,28,0.35351952522511965,745,41,small,1.2476622001537973e-06,1.1210155654424713e-08,long,idw,0.7016344434882218,none,True,COMPLETE
55,2831.180889520658,none,0.665736591384782,False,True,True,True,False,True,False,True,False,False,False,False,False,False,True,False,True,0.01628930456947148,4,20,0.3102604167377779,672,30,small,2.341771852033245e-05,5.360409052653568e-07,long,population,0.6203396658002657,none,True,COMPLETE
56,2900.2748015313887,none,0.7885654148912093,False,True,True,True,False,True,False,True,False,False,False,True,False,True,False,False,True,0.019723940364729246,9,11,0.2489869024564537,621,50,small,2.3123094509050937e-06,2.3852640724094082e-08,long,distance_population,0.6794684931637162,small,True,COMPLETE
57,2757.230461348443,none,0.9744429086505507,False,True,True,False,False,True,False,True,False,False,False,False,True,True,False,False,True,0.01132173742860853,3,23,0.40609810524043366,539,62,small,0.0002048563041786241,5.061341486350497e-08,long,None,0.7206085346237732,medium,True,COMPLETE
58,2769.526781814578,medium,0.5066497717535005,False,False,True,True,True,True,False,False,False,False,False,False,False,True,False,False,True,0.03924513872188477,5,25,0.4581225700894957,713,90,small,1.5474374363495246e-05,8.574900896078452e-06,long,mean,0.8442990915618016,none,True,COMPLETE
59,2769.0559056583625,none,0.8351812432866977,False,True,True,True,False,False,True,True,False,False,False,False,False,False,False,False,True,0.1327692747615245,6,38,0.2918897001008462,768,14,small,1.361691838780427e-07,0.05037618833903085,none,distance_energy,0.6683717466726514,medium,True,COMPLETE
60,2706.8384639121155,none,0.9590788489261773,False,True,False,True,False,True,False,True,False,False,False,False,False,True,True,False,True,0.013446406340830401,3,45,0.32103693999858496,828,150,none,0.11883294745146568,2.007908154369305e-07,none,distance_population,0.7019723880912571,none,False,COMPLETE
61,2688.2926354032206,none,0.9091045333273468,False,True,True,True,False,True,False,True,False,False,False,False,False,True,False,False,True,0.018786644610993317,4,17,0.3793161455303481,627,32,small,5.394933416833326e-06,1.2203306417123026e-07,short,distance_population,0.7797428752950869,none,True,COMPLETE
62,2692.4036518553594,none,0.8726092489336303,False,True,True,True,False,True,False,True,False,False,False,False,False,True,False,False,True,0.023932541435742055,4,21,0.39496904858690624,671,22,small,5.855734955003952e-07,6.736519850648123e-08,short,distance_population,0.7557133511801979,none,True,COMPLETE
63,2726.0776955629112,none,0.9007091708458458,False,True,True,True,False,True,False,True,False,False,False,False,False,True,False,False,True,0.01677118588799376,5,8,0.41864404222558665,569,137,small,0.042584407554697806,2.0889052536943853e-08,short,distance_population,0.7338233362641451,none,True,COMPLETE
64,2716.3905617152636,none,0.9247441671148876,False,True,True,True,False,True,False,True,False,False,False,False,False,True,False,False,True,0.014845350636126426,13,68,0.48419127935068135,600,44,small,3.3922448259061703e-05,3.3952943233489997e-07,none,distance_population,0.802556588044095,medium,True,COMPLETE
65,2697.804232135771,small,0.8460897594319374,False,True,True,True,False,True,False,True,False,False,False,False,False,True,False,False,True,0.028811152686618418,3,13,0.44231830134688027,691,34,small,4.125038565201547e-06,6.696231544280385e-07,long,distance_population,0.7693737917908696,none,True,COMPLETE
66,2915.7037729699373,none,0.8873136302819159,False,True,True,True,False,True,False,True,False,True,False,True,False,True,False,False,True,0.022013763356011212,4,29,0.36677409029752184,636,27,medium,1.821109126101585e-06,1.0124756558027205e-08,none,distance_population,0.8158639884369102,medium,True,COMPLETE
