number,value,params_cloud_lags_option,params_colsample_bytree,params_compute_air_density,params_compute_cloud_cover_fraction,params_compute_cooling_degree_hours,params_compute_dew_point_spread,params_compute_effective_solar,params_compute_heating_degree_hours,params_compute_humidex,params_compute_pressure_trend,params_compute_rain_indicator,params_compute_temp_gradient,params_compute_wind_chill,params_compute_wind_components,params_compute_wind_power_density,params_compute_wind_speed_gradient,params_drop_basic_meteo_features,params_drop_rad_meteo_features,params_drop_wind_meteo_features,params_learning_rate,params_max_depth,params_min_child_samples,params_min_split_gain,params_n_estimators,params_num_leaves,params_precip_lags_option,params_reg_alpha,params_reg_lambda,params_rolling_temp_option,params_spatial_agg_method,params_subsample,params_temp_lags_option,params_use_base_models_pred_intervals,state
67,2704.563688988202,none,0.9317170840475955,False,True,True,False,False,True,False,True,False,False,True,False,False,True,False,True,True,0.011282111654003942,3,25,0.38930564979737015,661,103,small,0.0001709985552441055,2.078942942496195e-06,short,energy,0.690157964271425,none,True,COMPLETE
68,2883.0250333725526,none,0.8586682490927217,True,True,True,True,False,True,False,True,True,False,False,False,False,True,False,False,False,0.017372297610173046,15,14,0.42722384761590126,737,14,small,1.1154226251156653e-05,6.457982784994051e-06,none,distance_population,0.7181892086255843,none,True,COMPLETE
69,2782.869038086223,none,0.8764782404365613,False,True,True,True,True,True,False,True,False,False,False,False,False,True,False,False,True,0.025664424846055224,5,18,0.3519758323025388,533,72,small,4.158378520262261e-07,1.7958889861305908e-07,short,max,0.6180390643907958,medium,True,COMPLETE
