number,value,params_cloud_lags_option,params_colsample_bytree,params_compute_air_density,params_compute_air_density_moist,params_compute_clear_sky_fraction,params_compute_cloud_cover_fraction,params_compute_diffuse_ratio,params_compute_direct_ratio,params_compute_dni_ratio,params_compute_global_tilted_ratio,params_dew_point_temperature,params_drop_raw_features,params_drop_raw_solar_features,params_lags_target,params_learning_rate,params_max_depth,params_min_child_samples,params_min_split_gain,params_n_estimators,params_num_leaves,params_precip_lags_option,params_reg_alpha,params_reg_lambda,params_shortwave_lags_option,params_spatial_agg_method,params_subsample,params_use_solar_geometry,params_vapor_pressure,state
0,703.2013234443058,large,0.6102190007299686,True,True,True,False,True,False,False,False,True,False,False,1.0,0.22037670890116637,12,40,0.45912317667424635,674,109,none,0.1297064469560418,0.016604373228294843,large,distance_n_panels,0.7801553944177735,True,True,COMPLETE
1,749.4639154713026,medium,0.5926448975832177,True,True,False,True,False,False,False,False,False,True,False,6.0,0.1078185695857768,5,52,0.40431778872009433,841,132,large,8.584328314196259e-06,0.0008145168388098159,small,max,0.5277322043814572,True,True,COMPLETE
2,683.3588198637093,small,0.5004595245107379,True,False,False,False,True,True,True,False,True,False,False,,0.028160722984686786,5,37,0.38569973697076243,684,137,small,0.24264401174717007,0.10979005760786203,large,max,0.9281453625918233,False,False,COMPLETE
3,827.3928818659583,none,0.7602466491648172,False,False,False,True,False,True,False,True,False,False,False,12.0,0.16811941106830025,13,63,0.18940096618087215,556,63,small,0.0019189831704510764,1.7814457789009854e-08,medium,distance_n_panels,0.7491447339807553,True,False,COMPLETE
4,666.9317186887484,large,0.6180347737233383,True,False,False,True,False,True,False,False,False,True,True,,0.20264154731965686,10,12,0.3714199166278608,677,100,large,0.0004681896383362358,0.17426016443462908,none,idw,0.5826388865072891,True,True,COMPLETE
5,785.526805769044,none,0.6829543828162719,True,False,True,True,False,True,False,True,True,False,False,6.0,0.24049380452493038,10,80,0.11376214845399862,919,84,small,0.015441591832474406,1.1117250969523937e-06,medium,mean,0.6143390754973819,True,True,COMPLETE
6,684.0366728182247,medium,0.9105936842219267,True,True,True,False,False,True,True,True,False,True,False,,0.013031600974809994,14,10,0.4559975678064208,664,149,large,1.4872737630275002e-08,2.8150885944827985e-06,large,idw,0.5875373646383739,False,True,COMPLETE
7,811.3214307703062,small,0.6248328399609837,False,False,True,True,True,True,True,False,True,True,False,12.0,0.03792869717681497,16,92,0.14368543288177726,903,138,small,1.5580137644329424e-06,8.432138815090742e-05,medium,idw,0.8998566932875256,False,False,COMPLETE
8,1005.7270035585794,none,0.9598247293632489,True,True,False,False,True,False,False,False,True,False,True,12.0,0.10319177708822175,4,9,0.427230836130511,429,13,large,0.0007433976568259522,6.505294624031227e-08,large,capacity,0.8209876061349539,True,True,COMPLETE
9,831.2253557713188,large,0.835085606678337,False,False,False,False,False,False,False,True,True,False,False,12.0,0.16655798463553245,6,72,0.05109064977281769,967,114,small,1.708126374710546e-06,0.003894468947229648,small,distance_n_panels,0.6074404266648318,False,False,COMPLETE
10,761.7258040427902,large,0.783958811824309,False,False,False,True,False,True,True,False,False,True,True,,0.06866983047037976,8,26,0.2952603697764667,338,57,none,4.960465903273585e-05,0.9179286980189465,none,distance_capacity,0.6940677222081706,True,True,COMPLETE
11,749.9623646613271,small,0.5008578681336882,True,False,False,False,True,True,True,False,False,True,True,,0.027105623116618554,8,29,0.3197221547741096,760,100,large,0.6030354318831184,0.6098668290602197,none,n_panels,0.9866225859209974,False,False,COMPLETE
12,743.0059032368005,small,0.5168892119334959,True,False,False,False,True,True,True,False,False,True,True,,0.019739424893826445,3,26,0.35549252459644953,541,118,small,0.017312763592326464,0.051990646344582045,none,None,0.9881597282259709,False,False,COMPLETE
13,688.9272596669035,small,0.6838486956770518,True,False,False,True,True,True,True,False,True,False,True,,0.04490070337349357,10,44,0.23891509924470036,754,82,large,0.00023466568429039882,0.14331045369501808,none,max,0.8582117282191837,False,False,COMPLETE
14,751.409528780369,large,0.5742029557857294,True,False,False,True,False,True,False,False,True,False,True,1.0,0.07350642390688089,7,6,0.368527802359385,569,45,none,0.02378241786311363,0.00029366285937811916,large,max,0.6900907613876993,True,True,COMPLETE
15,719.3440712463913,small,0.5463401788503697,True,False,False,False,True,True,True,False,False,True,True,,0.010007627512287589,11,21,0.4988923427164248,756,97,small,4.411770619924402e-08,0.0035409732393429706,none,idw,0.904688718537576,False,False,COMPLETE
16,727.9885862065738,large,0.6808832725754612,True,False,False,False,True,True,True,False,True,True,True,,0.0247389384296837,8,39,0.26343601295955,497,129,large,0.7213126380195578,4.572103765128866e-05,large,None,0.5142661274990579,True,True,COMPLETE
17,702.955242284017,medium,0.6491250341078696,True,False,False,True,False,True,False,False,False,False,False,,0.2953717487850695,5,19,0.36667332204497716,630,95,small,0.004405107217573898,0.057433848729420325,small,distance_capacity,0.6870633738325814,False,False,COMPLETE
18,722.5163337770823,small,0.5588464021135343,False,True,True,False,False,False,False,True,False,False,True,1.0,0.03687132072012159,9,57,0.2332664385560141,824,149,large,7.342320887822024e-05,0.007318206150307134,large,n_panels,0.9247318562648131,False,False,COMPLETE
19,892.1935467555313,large,0.7280118523092718,True,False,False,True,True,True,True,False,True,True,False,6.0,0.019119920749427217,3,38,0.31382471801830547,442,29,none,0.1262024524316143,1.0738115045874138e-05,none,mean,0.7530006730441237,True,True,COMPLETE
20,764.7944192919348,large,0.5323986482651555,True,False,False,False,True,True,True,False,True,True,True,,0.059933434017845774,15,13,0.4017088502889353,712,67,large,2.0862244456685268e-07,0.23361979054938867,none,capacity,0.8392976875974612,True,False,COMPLETE
21,702.2396975818497,medium,0.9744745720824941,True,True,True,False,False,True,True,True,False,True,False,,0.010873017576939982,14,18,0.48358172613665196,633,150,large,1.6519484467501163e-08,1.4589722054191202e-06,large,idw,0.5883303354673446,False,True,COMPLETE
22,692.1745430723375,medium,0.8941436379634542,True,True,True,False,False,True,True,True,False,True,False,,0.015177268920208122,12,31,0.4387187242954159,674,125,large,8.768914270447471e-06,6.137483988003701e-06,large,idw,0.6449979402863558,False,True,COMPLETE
23,683.1480173434828,medium,0.8708992549990602,True,True,True,False,False,True,True,True,False,True,False,,0.014981005562562563,14,7,0.3922375692341845,606,138,large,2.2795304202761976e-07,1.0994426892164295e-07,large,idw,0.5626615815447001,False,True,COMPLETE
24,710.7127116881725,medium,0.8258550834020201,True,True,True,False,False,True,True,True,False,True,False,,0.028893451169093334,16,15,0.34470948334494717,595,107,large,4.259968854943405e-07,2.245458365280172e-07,large,max,0.5546981890472851,False,True,COMPLETE
25,686.9581510497634,medium,0.8865948249377926,True,True,True,False,False,True,True,True,False,True,False,,0.016451115809734053,11,5,0.3864058446597768,500,138,small,1.898722036130401e-05,0.03713087043595976,large,idw,0.6515141553307424,False,True,COMPLETE
26,632.0970053617683,small,0.7356642199468499,False,True,True,True,False,False,False,True,False,False,False,,0.10311305921155527,6,51,0.2810516189104059,822,119,large,0.0008412521523937272,0.0010793692392634094,medium,idw,0.5625911534043021,False,True,COMPLETE
27,804.4012389023428,none,0.8146887570604788,False,True,True,True,False,False,False,True,False,True,False,1.0,0.10933617729380513,9,90,0.28544151566807346,845,123,large,0.000194515923938799,3.389785660093648e-05,medium,idw,0.5477955722555871,False,True,COMPLETE
28,751.4902916795727,medium,0.7308009829020463,False,True,True,True,False,False,False,True,False,False,True,6.0,0.15181901596949154,7,49,0.21092752328601885,799,92,large,0.0007867884077464609,0.001124542434259949,medium,idw,0.5589806872085858,True,True,COMPLETE
29,872.5815716265193,large,0.8582493190473914,False,True,True,True,False,False,False,True,False,False,False,1.0,0.08822917919142795,12,100,0.33525818994462336,1000,108,none,0.0044125697226741305,3.0855038369120986e-07,medium,idw,0.5006593462667973,True,True,COMPLETE
30,690.541266629842,small,0.764200473422278,False,True,True,True,False,False,False,True,False,True,False,,0.1476109945182248,13,66,0.2674793820013449,880,72,large,0.00025974808054205325,0.013933093021584873,medium,idw,0.6521225534615992,False,True,COMPLETE
31,720.5706300952965,small,0.6242030471767881,True,True,True,True,False,False,False,True,False,False,False,,0.24283810121088759,5,33,0.4116471399522837,698,138,large,0.14321348972166673,0.2000308155829246,large,max,0.7967769627077671,False,True,COMPLETE
32,667.6968441101195,small,0.5929268367643751,False,True,True,False,True,False,False,False,True,False,False,,0.04887491921886645,4,46,0.448474551500868,714,116,large,0.07936920252183681,0.0005323981483159113,small,max,0.5357207264434352,False,True,COMPLETE
33,681.4272508318405,small,0.6523700326406499,False,True,True,True,False,False,False,False,False,False,False,,0.12298055192515005,4,49,0.4550045336932431,726,117,large,0.03833008340684908,0.0003917972447569798,small,idw,0.5302917648768689,False,True,COMPLETE
34,665.2863480555454,small,0.5942296272584968,False,True,True,True,False,False,False,False,False,False,False,,0.11857741777460311,4,47,0.4734970168599504,791,105,large,0.03854419625007097,0.000403678667514872,small,distance_n_panels,0.5420816425982077,False,True,COMPLETE
35,837.7597226443314,small,0.590271171946934,False,True,True,True,True,False,False,False,True,False,False,6.0,0.18696677865447112,6,60,0.4302364918442966,809,104,large,0.0034139978089744115,0.0010901158219370649,small,distance_n_panels,0.5869301483072328,False,True,COMPLETE
36,653.84047617118,small,0.7064687897311466,False,True,True,True,False,False,False,False,False,False,False,,0.09007741863102939,4,45,0.4736901699192102,860,90,large,0.0679770248312057,0.00024364139981120273,small,distance_n_panels,0.620927629111374,True,True,COMPLETE
37,876.9798807279452,small,0.7072718915911188,False,True,True,True,False,False,False,False,False,False,False,12.0,0.08530268188320356,6,68,0.4792926431647396,860,90,large,0.001082318701046192,0.00014065951534704472,small,distance_n_panels,0.6290645721370474,True,True,COMPLETE
38,680.7795772343903,small,0.6535403972371899,False,True,True,True,False,False,False,False,False,False,False,,0.12599259078130978,3,55,0.16596003216628571,931,77,large,0.01007814046026086,0.0024441271021478244,small,distance_n_panels,0.7269746656897965,True,True,COMPLETE
39,726.2089570144266,none,0.7930480520422347,False,True,True,True,False,False,False,False,False,False,False,6.0,0.20343087041926955,4,75,0.022431457004306737,788,86,large,0.3310930254131091,2.1202995337237362e-05,small,distance_n_panels,0.5893261718380988,True,True,COMPLETE
40,844.626314025917,small,0.7049820607641846,False,True,True,True,False,False,False,False,False,False,False,12.0,0.0946503412210447,7,44,0.4706782255276749,896,102,none,0.03983912422440496,8.63142975783043e-05,small,distance_n_panels,0.6232346423543492,True,True,COMPLETE
41,658.2639850374932,small,0.5957155105862635,False,True,True,True,False,False,False,False,True,False,False,,0.05185300093121115,4,45,0.45040278546587265,737,114,large,0.07022985684776496,0.00040200912956706486,small,distance_n_panels,0.5205082723334713,True,True,COMPLETE
42,632.0826838476938,small,0.616651568066499,False,True,True,True,False,False,False,False,False,False,False,,0.05742969652345525,5,50,0.4201370509592704,779,113,large,0.00948763301779092,0.00016707857300310138,small,distance_n_panels,0.5066807953038137,True,True,COMPLETE
43,638.370934996444,small,0.6192954175442976,False,True,True,True,False,False,False,False,False,False,False,,0.07076363808207858,5,52,0.499454763761301,784,108,large,0.05754152347128536,0.00021594143977250055,small,distance_n_panels,0.5043949389740434,True,True,COMPLETE
44,618.0103782536852,small,0.6411294929017947,False,True,True,True,False,False,False,False,True,False,False,,0.0583916980733027,5,53,0.4995416447202427,941,112,large,0.008675924738469927,0.00013542102827386937,small,distance_n_panels,0.5030641072887286,True,True,COMPLETE
45,624.2023616410223,small,0.6370251858019739,False,True,True,True,False,False,False,False,False,False,False,,0.06393521629723975,5,55,0.4957419185359696,941,131,large,0.010695990001967236,0.0001713199739158266,small,distance_n_panels,0.5024382408911289,True,True,COMPLETE
46,616.8752593027851,small,0.6447577748257618,False,True,True,True,False,False,False,False,False,False,False,,0.06524074353426519,5,53,0.4977459189113174,932,131,large,0.009819983890827293,0.00013635662827581575,small,distance_n_panels,0.500287652199335,True,True,COMPLETE
47,627.1545040169018,small,0.6689113250391799,False,True,True,True,False,False,False,False,True,False,False,,0.06053570963390681,6,62,0.08406017233592811,941,131,large,0.009137717129660543,0.0017371879952296065,small,distance_n_panels,0.5187757641503049,True,True,COMPLETE
48,617.605072210339,small,0.6668681898528259,False,True,True,True,False,False,False,False,True,False,False,,0.060821416580331536,5,62,0.11359781510393063,938,131,large,0.007834800838239528,4.272564283534929e-05,small,distance_n_panels,0.5249769583869994,True,True,COMPLETE
49,878.1824325746023,small,0.6686898586647673,False,True,True,True,False,False,False,False,True,False,False,12.0,0.04320539050985491,7,61,0.09057502206668525,942,131,none,0.0021841528044020835,1.4283754474970518e-05,small,distance_n_panels,0.5313054545321836,True,True,COMPLETE
50,658.9334034822849,none,0.6424153251843856,False,True,True,True,False,False,False,False,True,False,False,,0.036116697123831865,5,80,0.11998151653063843,967,143,large,0.009198915814248152,5.9346374197240614e-05,small,mean,0.5733781637049594,True,True,COMPLETE
51,600.3833260008081,small,0.6291486632124731,False,True,True,True,False,False,False,False,True,False,False,,0.05938470778140808,5,57,0.03646192060193535,999,125,large,0.009261983943891265,0.00011678553779312084,small,distance_n_panels,0.5114332139989736,True,True,COMPLETE
52,619.784958489427,small,0.667900657334214,False,True,True,True,False,False,False,False,True,False,False,,0.07681006687281378,6,66,0.07164119958264342,994,128,large,0.0018079202563306036,6.649761513222352e-06,small,distance_n_panels,0.5001267444453805,True,True,COMPLETE
53,662.8210325849756,small,0.6446933305188683,False,True,True,True,False,False,False,False,True,False,False,,0.07927308834309436,3,57,0.0058609100843836776,992,124,large,0.001854328598895657,7.810183200820052e-06,small,distance_n_panels,0.533127368759406,True,True,COMPLETE
54,641.4863346647318,small,0.5712791358541727,False,True,True,True,False,False,False,False,True,False,False,,0.06438269753884696,6,67,0.06570416614267065,965,144,large,0.020550797661927894,2.761504934945006e-05,small,distance_capacity,0.5001580421144435,True,True,COMPLETE
55,862.4548785308707,small,0.6912803321160571,False,True,True,True,False,False,False,False,True,False,False,1.0,0.043309304416312776,7,73,0.03321832835682012,903,128,small,0.004823122420750279,2.5056227161314146e-06,small,capacity,0.6001640755185385,True,True,COMPLETE
56,720.91620061233,small,0.6335274023206772,False,True,True,True,False,False,False,False,True,False,False,,0.07266513624883465,5,57,0.12342363746544685,965,143,large,0.001860321652851831,4.163588128549677e-06,small,n_panels,0.5214689997612538,True,False,COMPLETE
57,633.6660974793404,small,0.6740831130444275,False,True,True,True,False,False,False,False,True,False,False,,0.054330691049256565,6,54,0.14999349767345377,931,135,large,0.0004425868596728491,9.164257420076559e-05,small,distance_n_panels,0.5459611750105309,True,True,COMPLETE
58,711.3988182203842,small,0.607997398859245,False,True,True,True,False,False,False,False,True,False,False,,0.066306897384696,8,41,0.053875836242763396,988,121,large,0.2807240791231269,1.6115433404823834e-05,small,None,0.5674011755815666,True,True,COMPLETE
59,667.354014676669,small,0.550802731421606,False,True,True,True,False,False,False,False,True,False,False,,0.03086974850166577,3,65,0.08147163586297218,878,134,large,0.01925612131718203,8.923711955358197e-07,small,distance_n_panels,0.5172036415896044,True,True,COMPLETE
60,754.1739467142141,none,0.6624793215459951,False,True,True,True,False,False,False,False,True,False,False,6.0,0.048062828615008685,5,71,0.1066970194318117,916,129,small,0.00615296363830542,4.3046365467073075e-05,small,distance_n_panels,0.9682023212190481,True,False,COMPLETE
61,614.5740042890142,small,0.6934698601121745,False,True,True,True,False,False,False,False,True,False,False,,0.061036379965680496,6,62,0.04065395463154599,944,126,large,0.010588099169684532,0.0022332036902194437,small,distance_n_panels,0.5236206597029817,True,True,COMPLETE
62,619.6662112411891,small,0.6956404498314941,False,True,True,True,False,False,False,False,True,False,False,,0.07621761078737477,6,59,0.037517899362001915,960,125,large,0.0029267575886498627,0.004911740061327568,small,distance_n_panels,0.5422148977931613,True,True,COMPLETE
63,614.6280976275165,small,0.6906910154194867,False,True,True,True,False,False,False,False,True,False,False,,0.08064892020419316,6,59,0.04758447995145274,977,125,large,0.0026032420781262767,0.007469574358260174,small,distance_n_panels,0.547377301203077,True,True,COMPLETE
64,652.3824548552212,small,0.6947549711507258,False,True,True,True,False,False,False,False,True,False,False,,0.0395991496915888,7,58,0.03516221981277271,962,124,large,0.0029011762666636288,0.007781184215420435,small,mean,0.5486667742614041,True,True,COMPLETE
65,600.2312743791217,small,0.7481185653753805,False,True,True,True,False,False,False,False,True,False,True,,0.05493139759382142,6,63,0.0015326622556414565,907,112,large,0.0004920262264994321,0.022726209303271655,small,distance_n_panels,0.5759132127778925,True,True,COMPLETE
66,666.7988499082239,small,0.7529097151629772,False,True,False,True,False,False,False,False,True,False,True,,0.05461539991946478,8,63,0.0022869390452015873,313,111,none,0.00010600100901169916,0.03190761783571784,none,distance_capacity,0.5796728711510908,True,True,COMPLETE
67,695.0147720178774,large,0.720194837495357,False,False,True,True,False,False,False,False,True,False,True,1.0,0.034135861324102644,9,76,0.016810504067729867,889,52,large,0.00038253150080197435,0.011777783629259074,small,None,0.6038066385012063,True,True,COMPLETE
68,687.9969501490615,small,0.7702570653494659,False,True,True,True,True,False,False,False,True,False,True,,0.05003130222586257,4,70,0.055463342161255556,908,120,large,0.016121614483623495,0.0006390373075296295,small,capacity,0.563592608602136,True,True,COMPLETE
69,815.6911492895033,small,0.7412344154671691,False,True,True,True,False,False,False,False,True,False,True,12.0,0.05839160330672299,7,64,0.18726388891822446,844,141,large,0.0012462112802887173,0.08058538663318367,small,n_panels,0.5279173631865075,True,False,COMPLETE
