number,value,params_cloud_lags_option,params_colsample_bytree,params_compute_air_density,params_compute_cloud_cover_fraction,params_compute_cooling_degree_hours,params_compute_dew_point_spread,params_compute_effective_solar,params_compute_heating_degree_hours,params_compute_humidex,params_compute_pressure_trend,params_compute_rain_indicator,params_compute_temp_gradient,params_compute_wind_chill,params_compute_wind_components,params_compute_wind_power_density,params_compute_wind_speed_gradient,params_drop_basic_meteo_features,params_drop_rad_meteo_features,params_drop_wind_meteo_features,params_learning_rate,params_max_depth,params_min_child_samples,params_min_split_gain,params_n_estimators,params_num_leaves,params_precip_lags_option,params_reg_alpha,params_reg_lambda,params_rolling_temp_option,params_spatial_agg_method,params_subsample,params_temp_lags_option,params_use_base_models_pred_intervals,state
67,411.07800186104527,none,0.5736758243115043,True,True,False,True,False,False,False,True,False,False,False,False,False,True,False,True,True,0.08763007512249699,4,96,0.18696972432075287,957,10,medium,0.00025797400743688597,2.439332070013944e-07,none,idw,0.7365659485046255,medium,False,COMPLETE
68,420.57241719302874,medium,0.5015600493218925,True,True,False,True,False,True,False,True,False,False,False,False,False,True,False,False,True,0.033772804727490856,3,89,0.1626395421647837,985,24,medium,0.0034887928147832184,7.603909455335823e-07,none,mean,0.7823455349889441,medium,False,COMPLETE
69,431.9213453380756,medium,0.5525920338898481,True,True,False,False,False,True,False,True,False,True,True,False,False,True,False,True,True,0.1092769526197928,4,38,0.20181138575225063,868,34,medium,0.00048298983782815426,1.919442734681325e-08,none,distance_population,0.705885079136701,medium,True,COMPLETE
