number,value,params_cloud_lags_option,params_colsample_bytree,params_compute_air_density,params_compute_cloud_cover_fraction,params_compute_cooling_degree_hours,params_compute_dew_point_spread,params_compute_effective_solar,params_compute_heating_degree_hours,params_compute_humidex,params_compute_pressure_trend,params_compute_rain_indicator,params_compute_temp_gradient,params_compute_wind_chill,params_compute_wind_components,params_compute_wind_power_density,params_compute_wind_speed_gradient,params_drop_basic_meteo_features,params_drop_rad_meteo_features,params_drop_wind_meteo_features,params_lags_target,params_learning_rate,params_max_depth,params_min_child_samples,params_min_split_gain,params_n_estimators,params_num_leaves,params_precip_lags_option,params_reg_alpha,params_reg_lambda,params_rolling_temp_option,params_spatial_agg_method,params_subsample,params_temp_lags_option,state
67,1078.8027093547425,small,0.5440224198605159,False,False,False,False,True,False,False,False,True,True,False,False,False,False,False,False,False,,0.011652771886272048,9,20,0.03606478728464635,884,146,none,6.277437855425811e-05,0.0025932841449080616,none,distance_energy,0.5942007921431683,small,COMPLETE
68,1124.8494132467151,medium,0.7098770743878833,True,False,False,False,True,True,False,False,True,True,False,False,False,False,True,False,False,12.0,0.017722188090458748,7,7,0.071093972507049,533,125,small,1.0832788540397588e-07,0.19561736444358124,none,mean,0.9473532971103893,small,COMPLETE
69,1254.9494389386673,small,0.7556602729493658,True,False,True,True,True,True,False,False,True,True,False,False,True,True,True,True,True,6.0,0.040665115851799286,11,10,0.35027328827950643,916,117,none,1.2891786232501599e-05,0.009218660875902356,none,distance_energy,0.6039379986195401,small,COMPLETE
