number,value,params_cloud_lags_option,params_colsample_bytree,params_compute_air_density,params_compute_air_density_moist,params_compute_clear_sky_fraction,params_compute_cloud_cover_fraction,params_compute_diffuse_ratio,params_compute_direct_ratio,params_compute_dni_ratio,params_compute_global_tilted_ratio,params_dew_point_temperature,params_drop_raw_features,params_drop_raw_solar_features,params_lags_target,params_learning_rate,params_max_depth,params_min_child_samples,params_min_split_gain,params_n_estimators,params_num_leaves,params_precip_lags_option,params_reg_alpha,params_reg_lambda,params_shortwave_lags_option,params_spatial_agg_method,params_subsample,params_use_solar_geometry,params_vapor_pressure,state
0,586.4107276297939,small,0.614010684386635,True,False,True,True,True,False,False,True,False,True,True,6.0,0.02648295889157673,14,17,0.010057328260711207,668,80,large,1.3500814553855066e-08,0.0031201627042065404,large,distance_capacity,0.7977948419475267,False,False,COMPLETE
1,593.8703250515224,none,0.5078687259378533,False,False,False,True,True,False,True,True,False,True,False,,0.03808789689507314,10,11,0.49941240440464146,559,85,large,0.025568882280299417,1.7161268089141727e-05,medium,None,0.6504887293739338,False,True,COMPLETE
2,678.0422809005578,none,0.883054245625903,False,False,False,False,False,True,False,True,True,True,True,12.0,0.27268264624282046,4,45,0.12550696304704018,382,23,small,1.364740705142221e-07,3.4340375639111554e-07,none,idw,0.8516066053521003,False,True,COMPLETE
3,510.2240357911075,none,0.5741225790878487,True,True,False,False,True,True,True,False,False,False,False,,0.031223759648895937,6,76,0.3481496625999443,749,101,small,7.243759226290383e-08,0.22841587678541542,small,distance_capacity,0.837919067974003,True,False,COMPLETE
4,735.2711212152172,none,0.9334648279406574,True,True,True,False,False,False,False,True,True,True,False,6.0,0.2661185420223157,8,64,0.3159107557361024,697,66,none,0.00012435721028049762,2.067517883330195e-05,none,idw,0.915855652465671,False,False,COMPLETE
5,826.7754639079085,none,0.8936798078788648,False,True,False,True,False,False,False,False,False,False,True,6.0,0.032030496583826076,5,68,0.013837400787159948,870,67,none,0.005835921954259933,8.658100128706845e-06,large,max,0.9173375406000295,True,True,COMPLETE
6,704.7865304721672,none,0.6653837348947721,True,True,True,True,True,True,True,True,True,False,False,1.0,0.021041238336433288,9,55,0.23508833364298237,697,95,none,1.7676258982286882e-07,1.6048757981268553e-07,large,max,0.7849474976314605,True,False,COMPLETE
7,563.5607304638667,medium,0.8950960171727298,True,False,True,True,False,True,False,False,False,True,False,,0.2545437902960481,4,31,0.36447083215674675,422,100,small,3.2035209886908784e-05,0.01015900726763482,small,mean,0.7977294744785588,True,False,COMPLETE
8,597.6409187690315,medium,0.9218324002662206,True,True,True,False,True,True,False,False,False,False,True,12.0,0.27159082402172374,14,47,0.40081770713318426,396,92,small,1.0289106446731408e-06,0.019312206331414238,none,distance_capacity,0.9121837856156727,True,False,COMPLETE
9,586.392147009148,small,0.9223498301886458,False,True,True,True,True,True,False,True,False,True,False,,0.054710901541745606,10,54,0.2609886752055266,531,112,small,0.03564753306988491,4.577227883135837e-08,medium,max,0.5036826463030863,True,True,COMPLETE
10,683.4854677788759,large,0.7621615371985151,True,True,False,False,True,True,True,False,True,False,False,1.0,0.011511912282599051,7,89,0.47556604590762575,975,148,small,0.8610955023238912,0.9175800475056146,small,n_panels,0.6701935811463428,True,False,COMPLETE
11,560.6471631835457,medium,0.7780540648389368,True,False,False,False,False,True,True,False,False,False,False,,0.10117185728081887,4,100,0.36651224577088687,843,125,small,1.7104241371144477e-05,0.5698986410526973,small,mean,0.7113069678281805,True,False,COMPLETE
12,519.8277280952323,medium,0.7835177608342306,True,False,False,False,False,True,True,False,False,False,False,,0.11183375600964844,6,99,0.3965463781325208,821,132,small,1.5263132327946882e-05,0.8444245314073753,small,distance_n_panels,0.6811425341225515,True,False,COMPLETE
13,524.9162510484101,large,0.6724982537418253,True,False,False,False,False,True,True,False,False,False,False,,0.10927033962428201,6,82,0.4292608064831719,807,142,small,2.422426087883142e-06,0.0980979750260271,small,distance_n_panels,0.5882889181278087,True,False,COMPLETE
14,570.2963466814061,medium,0.5152291160391215,True,True,False,False,True,True,True,False,False,False,False,,0.09445233054516072,12,80,0.2768483615200959,972,124,small,0.0004769546040280413,0.0005067493531534676,small,capacity,0.9866326946786845,True,False,COMPLETE
15,506.92905105628097,medium,0.8166252502454497,True,False,False,False,False,True,True,False,False,False,False,,0.15381920639772403,6,98,0.1835640070939522,776,42,large,1.2983554796475834e-08,0.08482897360200889,small,distance_n_panels,0.7162265206065064,True,False,COMPLETE
16,542.7072762232533,large,0.821285326084348,True,True,False,False,True,True,True,False,False,False,False,,0.01679247901260581,3,72,0.17882233812842108,757,34,large,1.52001593151315e-08,0.0006291062675335393,small,distance_capacity,0.7352463699633565,True,False,COMPLETE
17,758.2264709540981,small,0.9865298715976079,True,False,False,False,False,True,True,False,False,False,False,1.0,0.05916471392379034,16,90,0.13575688719804502,595,41,large,1.2974061103608883e-07,0.06665215602031263,small,distance_n_panels,0.8535726524650484,True,False,COMPLETE
18,648.2267423163672,none,0.5758311991628335,False,True,False,False,True,False,True,False,True,False,True,12.0,0.1715056662794812,8,79,0.19888020598477685,903,52,large,1.039678967777298e-08,0.0015786429683062647,medium,capacity,0.5882542622202378,False,True,COMPLETE
19,597.8791702805433,medium,0.7253502759974231,True,False,False,False,False,True,True,False,False,False,False,,0.058540015497755366,6,92,0.09282263593366608,746,63,large,1.1503368351888823e-06,0.00015015836781868177,small,None,0.8540081323762307,True,False,COMPLETE
20,525.1590711038284,none,0.8336309021296687,True,True,False,False,False,True,True,False,False,False,False,,0.16703316958636713,11,62,0.31779341131704386,477,13,large,1.1620549163486812e-07,0.08491131008258908,small,n_panels,0.7599227763777833,True,False,COMPLETE
21,511.7970771340365,medium,0.7135886120943754,True,False,False,False,False,True,True,False,False,False,False,,0.08067737151571859,6,100,0.4328086563330837,302,111,small,7.788097577704623e-06,0.2646050173300396,small,distance_n_panels,0.6988320316815629,True,False,COMPLETE
22,525.0321275353377,medium,0.7032052824292281,True,False,False,False,False,True,True,False,False,False,False,,0.07335364786520536,7,93,0.3326439804658764,326,109,small,3.8270108258420945e-06,0.16466684597780748,small,distance_n_panels,0.6128633327389335,True,False,COMPLETE
23,518.7902429085025,medium,0.5929371204178504,True,False,False,False,False,True,True,False,False,False,False,,0.04208885450086014,8,76,0.4339126687712469,618,118,none,4.933715493271143e-07,0.011265700253333103,small,distance_n_panels,0.7214140740195151,True,False,COMPLETE
24,545.7338448641048,medium,0.6352570536182175,True,False,False,False,False,True,True,False,False,False,False,,0.07722735809476926,3,85,0.4464399913489031,759,78,small,3.9319500125395866e-08,0.02387941693010523,small,distance_capacity,0.5243791269645297,True,False,COMPLETE
25,543.0345023947915,medium,0.5499239305290945,True,False,False,False,False,True,True,False,False,False,False,,0.15515753347253047,5,100,0.2875344668075465,300,101,large,0.0010374324197505486,0.34282354333060294,small,distance_n_panels,0.8190707283828421,True,False,COMPLETE
26,697.9094975452512,small,0.8250678419714843,False,False,False,False,True,False,True,False,True,False,True,6.0,0.04326022596157066,7,93,0.22108659219500387,491,53,small,5.500348638315425e-06,0.004104556655512421,none,distance_n_panels,0.6320517741250428,False,True,COMPLETE
27,724.7063988382148,large,0.7224319197377359,True,False,False,False,False,True,True,False,False,False,False,12.0,0.13665050311771157,9,71,0.35693742706345694,920,107,small,4.1334519818967056e-07,0.051082401060259845,medium,distance_capacity,0.6995381240062766,True,False,COMPLETE
28,715.1647256379191,medium,0.6690169699339048,True,True,False,False,True,True,True,False,False,False,False,1.0,0.21011646963954791,5,88,0.062129652441039046,792,84,none,3.802043155100472e-08,0.24586840870868185,large,distance_n_panels,0.7466174011857896,True,False,COMPLETE
29,647.3163885363576,small,0.6240651965139111,True,False,True,True,True,False,True,True,False,True,True,6.0,0.020491826401248105,12,31,0.39793966346529847,681,75,large,3.680512457722946e-08,0.005816555133982709,large,distance_capacity,0.7739292592049991,False,False,COMPLETE
30,547.0354413860348,none,0.5561939786581537,True,False,False,False,False,True,True,False,False,False,False,,0.028321280782506394,6,76,0.16958065214103196,611,36,large,6.835585402889592e-05,1.1762731377248473e-06,small,mean,0.5530889295604711,True,False,COMPLETE
31,523.5085582108355,medium,0.5880424634758756,True,False,False,False,False,True,True,False,False,False,False,,0.04361302384569078,8,61,0.44354018225587455,643,115,none,3.5658510285158703e-07,0.04210765423316675,small,distance_n_panels,0.7307496326771752,True,False,COMPLETE
32,522.4198015773698,medium,0.6266910928992954,True,False,False,False,False,True,True,False,False,False,False,,0.035892551863451395,7,75,0.48629492535949587,716,121,none,7.307633240052637e-07,0.011419514956109782,small,distance_n_panels,0.8241415690508538,True,False,COMPLETE
33,604.1209711018691,medium,0.5052410440956163,True,False,False,False,False,True,True,False,False,False,False,,0.074794541304006,8,84,0.4232467647670655,638,139,none,4.1257574566320135e-08,0.1889304945058165,small,None,0.6627275749647412,True,False,COMPLETE
34,554.7245244403316,medium,0.5940108340323438,False,False,False,False,False,False,True,True,False,True,False,,0.048388081684833724,5,96,0.4691090888798186,572,130,none,7.635826745020895e-06,0.0015931889219532797,small,idw,0.6925836492531025,False,True,COMPLETE
35,510.9061931857961,none,0.8488338575960779,True,False,False,True,False,True,False,False,True,False,False,,0.021504884160427562,9,34,0.338974504205317,450,91,none,2.1707565526168297e-06,0.021488839426073485,none,distance_n_panels,0.8868175966660157,True,False,COMPLETE
36,698.5042368562987,none,0.8487076192632643,False,False,False,True,False,True,False,True,True,True,True,6.0,0.014400517014558812,11,33,0.30823539380653886,340,91,none,2.5081781750200794e-06,5.686416525179883e-05,none,idw,0.8786296964112067,False,True,COMPLETE
37,704.8082621477703,none,0.8062395128695,True,True,True,True,True,False,False,False,True,False,False,12.0,0.023903013037773858,4,5,0.3426372699621776,443,72,small,0.0002515537074780933,0.27729774331279455,none,distance_n_panels,0.9820602332406403,True,False,COMPLETE
38,502.69279350004916,none,0.7363076237991142,True,False,False,True,False,True,False,True,True,False,False,,0.02838963381625439,9,35,0.25028486023499685,369,86,large,1.2687746764119833e-07,4.4878259759397106e-06,none,n_panels,0.8864812476919879,True,False,COMPLETE
39,690.9155687362462,none,0.8643179544237816,True,True,True,True,False,True,False,True,True,True,True,1.0,0.029724395108016805,9,25,0.23855511317190237,394,85,large,9.292017470540828e-08,2.99234656504408e-06,none,n_panels,0.9346155363875235,True,False,COMPLETE
40,507.19934561739564,none,0.8730143873947284,False,False,False,True,True,True,False,True,True,False,False,,0.024001290119115615,10,38,0.28906969281750944,524,102,large,1.0788892695583276e-08,1.1341910053535008e-08,none,n_panels,0.9521766203387436,False,True,COMPLETE
41,502.870138433715,none,0.8691178831116413,False,False,False,True,True,True,False,True,True,False,False,,0.0222762788841463,10,40,0.29003134747195575,514,102,large,1.0709542311018196e-08,2.214438094243361e-08,none,n_panels,0.9539765776345851,False,True,COMPLETE
42,505.579963566488,none,0.8920924908302446,False,False,False,True,True,True,False,True,True,False,False,,0.015575633223102566,10,43,0.25852829302590574,526,101,large,1.0333847486771912e-08,2.5436949335175756e-08,none,n_panels,0.9607787792091884,False,True,COMPLETE
43,509.02650411188733,none,0.9442099837765924,False,False,False,True,True,True,False,True,True,False,False,,0.016428699447003765,10,42,0.26726285473273587,538,101,large,1.5120459004855514e-08,1.1906842485509051e-08,none,n_panels,0.9560632115691524,False,True,COMPLETE
44,506.35234061740204,none,0.8873771567716462,False,False,False,True,True,True,False,True,True,False,False,,0.024297130698392237,11,40,0.21387427101721562,493,105,large,1.1438109143235724e-08,1.301618610814748e-07,none,n_panels,0.9567907909435152,False,True,COMPLETE
45,524.9466086020169,none,0.9006159179287145,False,False,False,True,True,True,False,True,True,False,False,,0.010076527913152519,13,24,0.21696858054452928,360,95,large,3.196139344506194e-08,1.683211630373784e-07,none,n_panels,0.9951903217349878,False,True,COMPLETE
46,503.4314579566341,none,0.9541054545058669,False,False,True,True,True,True,False,True,True,False,False,,0.01310399763617265,11,48,0.1443667491955939,490,85,large,2.0018584580998315e-07,3.3057758826572456e-08,none,n_panels,0.8949991110626276,False,True,COMPLETE
47,726.6505974538717,none,0.9616093970781487,False,False,True,True,True,True,False,True,True,False,False,6.0,0.013733767591849294,11,48,0.13507515598127118,486,85,large,2.1921509029801084e-07,4.547142388249922e-08,none,n_panels,0.8878071481775212,False,True,COMPLETE
48,505.9054218975754,none,0.9855872310044913,False,False,True,True,True,True,False,True,True,True,False,,0.018553910205970196,12,41,0.15775334279377937,419,70,large,7.156344905865394e-08,4.5852838880292095e-08,none,n_panels,0.9667742800713344,False,True,COMPLETE
49,726.2747658756343,none,0.98657171273296,False,False,True,True,True,False,False,True,True,True,False,12.0,0.018291013602325653,14,50,0.15931779914089328,430,60,large,2.1836216685986851e-07,3.5659849147084536e-08,none,n_panels,0.9119726839581077,False,True,COMPLETE
50,509.33881944981414,none,0.9581164348901406,False,False,True,True,True,True,False,True,True,True,False,,0.014651237815257432,12,58,0.09798583804020344,404,71,large,7.081178701953668e-08,6.91116546634888e-07,none,n_panels,0.9327187031581272,False,True,COMPLETE
51,507.7236699460678,none,0.9250830372148939,False,False,True,True,True,True,False,True,True,True,False,,0.011938873517259061,13,43,0.24616996046994521,512,79,large,2.06678413811121e-08,1.5439846957151487e-07,none,n_panels,0.9679619185309672,False,True,COMPLETE
52,510.2136608697788,none,0.912063484288442,False,False,True,True,True,True,False,True,True,True,False,,0.01875237350102513,11,39,0.20339260593569733,571,96,large,6.968643410279314e-08,1.0158427056088504e-07,none,n_panels,0.9338481325911361,False,True,COMPLETE
53,513.755011455497,none,0.9629367302410577,False,False,True,True,True,True,False,True,True,True,False,,0.024012683630817277,10,26,0.1530167099593451,466,88,large,2.3491817025884596e-08,2.3170689111418614e-08,none,n_panels,0.9650184943420841,False,True,COMPLETE
54,561.6800633359526,none,0.8876626508726398,False,False,True,True,True,True,False,True,True,False,False,,0.012359592037898636,13,37,0.1027606588248721,422,106,large,0.2109318125261684,4.477200973457493e-07,none,max,0.9073523281511992,False,True,COMPLETE
55,698.2592511083694,none,0.94129852112783,False,False,True,True,True,True,False,True,True,False,False,1.0,0.033976816911669774,11,46,0.19376360420619107,364,66,large,7.689405732832893e-08,4.884532613523317e-06,none,n_panels,0.8695396475158856,False,True,COMPLETE
56,543.5848997332881,none,0.7848423749434495,False,False,True,True,True,True,False,True,True,False,True,,0.016686344045500734,12,53,0.2578246156721429,548,96,large,2.0871548086864366e-07,7.952443553104497e-08,none,n_panels,0.9778080058293102,False,True,COMPLETE
57,554.4145374786517,none,0.7505420345350419,False,False,True,True,True,True,False,True,True,True,False,,0.010216269156292299,10,20,0.21855234382395194,506,82,large,2.098444470201067e-08,2.193529892274625e-08,medium,capacity,0.9968521265271453,False,True,COMPLETE
58,514.4405827497468,large,0.9763987681511144,False,False,True,True,True,True,False,True,True,False,False,,0.025782578328732892,9,42,0.05475619964860637,458,58,large,1.0976704283656292e-08,2.6224668595175936e-07,none,n_panels,0.9444997606611589,False,True,COMPLETE
59,510.62860906886334,none,0.9026162725273069,False,False,False,True,True,True,False,True,True,False,False,,0.0197740833176662,15,29,0.29233730678953385,373,114,large,1.0194736352832558e-06,1.6122736823208138e-06,none,n_panels,0.9032534004515199,False,True,COMPLETE
60,504.1474101481658,none,0.9921879199372925,False,False,False,True,True,True,False,True,True,False,False,,0.01552242428007901,12,51,0.15188788760377778,413,105,large,6.271308704862031e-08,1.3008829675454792e-05,large,n_panels,0.925069430873016,False,True,COMPLETE
61,505.7884409504739,none,0.9885099020156353,False,False,False,True,True,True,False,True,True,False,False,,0.013214186728181648,12,50,0.12305603008481408,412,105,large,6.137843177159717e-08,1.3291749548134169e-05,large,n_panels,0.9176331506125714,False,True,COMPLETE
62,510.1170524709034,none,0.9857668487589,False,False,False,True,True,True,False,True,True,False,False,,0.01288860821614038,13,49,0.11546525040372045,407,90,large,1.3281625015888117e-07,2.1014973925509903e-05,large,n_panels,0.9262161089110161,False,True,COMPLETE
63,511.5336156154887,none,0.9966449672193249,False,False,False,True,True,True,False,True,True,False,False,,0.015276171656549804,12,56,0.05495058671296041,339,100,large,5.464342548214065e-08,2.6786718158599098e-05,large,n_panels,0.9011956483688122,False,True,COMPLETE
64,536.0381128085538,small,0.9489103624940372,False,False,False,True,True,True,False,True,True,False,False,,0.011149293488929407,14,52,0.07261047679358705,387,110,large,3.010824991999135e-07,9.735741123019844e-06,large,mean,0.843732151091546,False,True,COMPLETE
65,572.4700323952411,none,0.9281952450452515,False,False,False,True,True,True,False,True,True,False,False,,0.017506545989174217,11,44,0.1429389829753233,428,75,large,0.0052956848141988925,0.00016829567675194436,large,None,0.8668671779649445,False,True,COMPLETE
66,751.8124201371365,none,0.9987050153668101,False,False,False,True,True,True,False,True,True,False,False,12.0,0.02127496097698313,12,58,0.12222541887490206,469,118,large,1.1895216537331014e-07,4.6454026815119e-05,large,n_panels,0.9200326643007549,False,True,COMPLETE
67,571.7502359430763,large,0.9761925825845266,False,False,False,True,True,False,False,True,True,False,False,,0.01319982213700108,10,36,0.17962542315132587,323,97,large,2.1950037945071426e-08,8.267008528284369e-06,large,max,0.9755172595190822,False,True,COMPLETE
68,658.1725102428622,none,0.6977847683954479,False,False,False,True,True,True,False,True,True,False,True,1.0,0.015537555313606928,9,47,0.16448315764591773,406,80,large,4.536320366115325e-07,6.498238151329957e-08,large,n_panels,0.9423079160600435,False,True,COMPLETE
69,757.2267521786343,none,0.9667877358975673,False,False,True,True,True,True,False,True,True,False,False,6.0,0.011383709393823176,11,50,0.08201380448936543,580,127,large,3.352579161321801e-08,3.339240636328848e-07,medium,capacity,0.806093641256784,False,True,COMPLETE
