number,value,params_cloud_lags_option,params_colsample_bytree,params_compute_air_density,params_compute_air_density_moist,params_compute_clear_sky_fraction,params_compute_cloud_cover_fraction,params_compute_diffuse_ratio,params_compute_direct_ratio,params_compute_dni_ratio,params_compute_global_tilted_ratio,params_dew_point_temperature,params_drop_raw_features,params_drop_raw_solar_features,params_lags_target,params_learning_rate,params_max_depth,params_min_child_samples,params_min_split_gain,params_n_estimators,params_num_leaves,params_precip_lags_option,params_reg_alpha,params_reg_lambda,params_shortwave_lags_option,params_spatial_agg_method,params_subsample,params_use_solar_geometry,params_vapor_pressure,state
0,21.9146042742483,medium,0.7353967420063988,False,False,True,False,True,True,False,False,True,True,True,12.0,0.01919517085694637,15,44,0.21036579698165203,808,134,small,1.499364510988365e-07,1.1755025938122473e-07,medium,n_panels,0.6942336589668012,False,False,COMPLETE
1,18.242813968792376,large,0.5621474296349813,True,True,False,False,False,False,False,False,True,True,True,,0.012311753856210791,14,93,0.36617681453755624,345,27,small,0.007646510488444181,2.599668826704358e-06,small,n_panels,0.5104270422855306,True,True,COMPLETE
2,23.752674976457964,medium,0.7476688713550685,True,True,False,True,False,True,True,True,True,True,False,12.0,0.012644516320197433,4,30,0.46178760636011923,777,68,large,2.7607910931007593e-06,0.09127128877786324,medium,mean,0.5352648910980795,True,False,COMPLETE
3,16.9249957594749,none,0.6393081174713513,False,True,False,False,True,True,False,True,False,False,False,,0.15390061621646764,12,43,0.08482467134225563,696,89,small,0.0007904092262982304,2.5654086620872528e-06,medium,None,0.619167336189306,False,True,COMPLETE
4,20.449118922423054,large,0.6935141247219493,True,False,True,True,False,False,False,False,True,False,False,6.0,0.021769869275398118,16,47,0.39272499255941073,530,50,large,3.534290263439792e-06,0.0003599283526197685,small,capacity,0.6919243136923201,True,True,COMPLETE
5,15.977090859580434,small,0.7584449549602468,False,False,True,False,True,False,False,False,False,True,False,,0.014469756802497758,16,73,0.05895611558302982,791,23,none,4.906248473898822e-08,5.762376792258367e-05,medium,distance_capacity,0.5921366617185009,False,True,COMPLETE
6,24.469091091899752,none,0.8402056730413159,False,True,True,True,True,True,False,False,False,False,False,6.0,0.013946487907222853,7,17,0.4644126292762739,381,58,small,7.91365182141425e-07,3.252509191147603e-07,large,capacity,0.9160184598788347,False,False,COMPLETE
7,23.32211749827725,large,0.8488596321899645,True,False,True,True,False,True,False,False,True,True,True,12.0,0.0428596141827172,14,23,0.12508622639532563,983,55,small,3.3776541587579503e-06,0.39423053186251594,none,capacity,0.8306007062118683,True,False,COMPLETE
8,16.641573129734113,none,0.9265379430184884,False,False,True,True,False,True,False,False,True,False,True,,0.02194779804288181,8,31,0.3964034527867355,631,62,large,6.230620577100817e-05,0.01404375648910684,small,n_panels,0.6439365215534953,False,True,COMPLETE
9,23.24642732177938,medium,0.8934854769168041,True,True,False,True,False,True,False,True,True,False,False,1.0,0.12469004786129136,15,35,0.32366748814548063,474,68,none,0.0001787975073373631,0.00017925322332535627,none,mean,0.8421940627241845,False,False,COMPLETE
10,21.323086568429062,small,0.9847629919632043,False,False,True,False,True,False,True,True,False,True,False,1.0,0.05559440764869632,11,74,0.0059384209316819606,997,12,none,0.9565825693211737,1.0387032742781994e-08,large,distance_capacity,0.7780769433137014,False,True,COMPLETE
11,16.541900338028046,small,0.9990149501258427,False,False,True,False,True,False,True,False,False,False,True,,0.039147676751391046,8,67,0.24083632846685246,596,103,none,1.58714394095744e-08,0.00550427574399849,small,distance_n_panels,0.6096142361960674,False,True,COMPLETE
12,16.81765959890771,small,0.5168465983845346,False,False,True,False,True,False,True,False,False,False,True,,0.045041125171354515,5,67,0.2362878921783605,857,107,none,1.422854994876018e-08,0.00377097119003107,medium,distance_n_panels,0.5809323957227072,False,True,COMPLETE
13,15.936210680509234,small,0.8164942091996636,False,False,True,False,True,False,True,False,False,True,True,,0.08694723936599873,9,64,0.14391082170732156,583,116,none,2.39810293287315e-08,0.0015121979398178107,small,distance_n_panels,0.5801577394953493,False,True,COMPLETE
14,16.3927772412441,small,0.8021592548987645,False,False,True,False,True,False,True,False,False,True,False,,0.09555239569552629,11,87,0.13030615868659823,718,150,none,1.257055309145607e-07,1.714513432337849e-05,medium,distance_capacity,0.7095985967080083,False,True,COMPLETE
15,16.88845973334313,small,0.6533668883632648,False,False,True,False,True,False,True,False,False,True,True,,0.22742382891746116,10,5,0.0271077356692078,873,123,none,1.25379314289073e-08,0.0004954064592372855,small,idw,0.9790701244655045,False,True,COMPLETE
16,16.206956758332765,small,0.8055022993054965,False,False,True,False,True,False,True,False,False,True,False,,0.07273005559599695,6,58,0.17288081333032235,516,34,none,2.0050229106133224e-05,3.898191509801069e-05,large,max,0.5456880751910845,False,True,COMPLETE
17,21.822590231496047,small,0.7773976336887473,False,False,True,False,True,False,True,False,False,True,True,6.0,0.029973813837821443,13,84,0.06434790089506769,618,90,none,1.5264156490472995e-07,0.002149151304801941,none,distance_n_panels,0.6495299553467593,False,True,COMPLETE
18,25.38988452421466,small,0.7176360144540364,False,False,False,False,True,False,False,True,False,True,True,1.0,0.2937694865752328,3,57,0.29597610108687133,445,117,none,0.019383193091243922,1.2952671412520468e-05,medium,distance_capacity,0.7714263541903065,True,True,COMPLETE
19,16.304370125523352,small,0.9085120092244071,False,False,True,False,True,False,True,False,False,True,False,,0.07511822364774018,9,100,0.16213464391083515,731,37,none,4.181805815956939e-07,0.03753622545907842,small,max,0.5728129193353103,False,True,COMPLETE
20,16.229348414349385,small,0.6033334244661503,False,False,True,False,True,False,False,False,False,True,False,,0.10311387913943221,10,76,0.08240472949466049,896,81,large,1.966920760630033e-05,0.0010417258592982344,medium,idw,0.5051182287930247,False,True,COMPLETE
21,16.592014032160986,small,0.8084260554193227,False,False,True,False,True,False,True,False,False,True,False,,0.06482045910590609,6,58,0.19004652465100066,542,14,none,8.0744305506188e-08,4.4326098219036036e-05,large,None,0.55645426926597,False,True,COMPLETE
22,16.31572100881582,small,0.8686321431824663,False,False,True,False,True,False,True,False,False,True,False,,0.15892088650752562,6,64,0.13957957565534584,554,35,none,1.1645911616162296e-05,7.232128046216445e-05,large,max,0.5984173472620602,False,True,COMPLETE
23,16.18690730416785,small,0.7794154202796674,False,False,True,False,True,False,True,False,False,True,False,,0.032079445962795515,8,76,0.05514582305882282,462,24,none,0.0007942285101865122,4.6203668835780476e-06,large,max,0.6534734471001268,False,True,COMPLETE
24,16.195284400598368,small,0.7042091232450113,False,False,True,False,True,False,True,False,False,True,False,,0.02916213100919552,8,79,0.042363533920405066,455,23,none,0.0016576309183645539,3.2392913751060885e-06,large,max,0.6371772943546545,False,True,COMPLETE
25,17.060234658148936,small,0.7747377009599894,False,False,True,False,True,False,True,False,False,True,False,,0.010197512351078256,9,72,0.10464573637444721,383,149,none,0.08763304344618314,2.8085178985180355e-07,large,distance_capacity,0.6657571070935596,False,True,COMPLETE
26,23.301290625892705,medium,0.6741380880458345,True,True,False,False,True,False,True,True,False,True,True,12.0,0.017565610825297808,12,85,0.04932901857087227,312,46,none,0.000532376526192002,7.407566384615536e-06,small,distance_n_panels,0.7193330130546097,True,False,COMPLETE
27,18.220325220498232,large,0.7572863060912024,False,False,True,False,True,False,True,False,False,True,False,1.0,0.030830268574382372,7,52,0.010013870150046782,774,21,none,0.0030851091497848893,5.848096279093512e-07,none,max,0.7473259381874783,False,True,COMPLETE
28,22.114283527893367,none,0.9412641405694964,False,False,True,False,True,False,False,False,False,True,True,6.0,0.025839132013630542,10,64,0.09695829777417801,683,43,large,0.00012392646351429976,0.000263778629562588,small,distance_capacity,0.570680280069491,False,True,COMPLETE
29,24.650586502059998,medium,0.7343569055667462,False,False,True,False,True,False,False,False,False,True,True,12.0,0.015294923817641738,16,93,0.2021202491367905,581,138,none,4.494626972647741e-08,2.8488836833965332e-08,medium,distance_n_panels,0.6880582871224626,False,False,COMPLETE
30,16.640657396364144,small,0.8253193229299355,False,False,True,False,True,False,True,False,False,True,False,,0.03663302898697344,11,78,0.27740782488233834,813,126,small,6.104589793782721e-07,0.0010978046510396443,large,None,0.6125154332457339,False,True,COMPLETE
31,16.12510307574019,small,0.7024140543170682,False,False,True,False,True,False,True,False,False,True,False,,0.05088118976009594,8,79,0.04425989186546083,453,29,none,0.0011205082861150786,1.2836552099029838e-06,large,max,0.6392587506588592,False,True,COMPLETE
32,16.20747460156517,small,0.7697274969295381,False,False,True,False,True,False,True,False,False,True,False,,0.0540940333170826,9,70,0.04880909793321592,418,28,none,0.016069704960809665,1.9247129117773343e-06,large,max,0.6687509765116082,False,True,COMPLETE
33,16.42685089768413,small,0.6118625510933093,False,False,True,False,True,False,True,False,False,True,False,,0.09597396397669604,7,92,0.06655295342113546,494,18,none,0.0003263784927921778,9.709870191873383e-08,large,n_panels,0.5142240426623482,False,True,COMPLETE
34,16.484859095743502,small,0.7311220190173108,True,True,False,False,False,False,True,False,True,True,False,,0.048585273076239964,8,62,0.14944308496311026,662,29,none,0.0052910515426465585,9.642380169447287e-07,medium,max,0.532537802534698,True,True,COMPLETE
35,16.878597861224264,large,0.6932105315601725,False,False,True,False,True,True,True,True,False,True,False,,0.01930103655243707,4,80,0.10640090285691015,378,11,small,4.081625229060844e-05,5.776172747064799e-06,large,mean,0.6275596659098395,False,True,COMPLETE
36,16.353654743046324,none,0.8579859575672719,True,True,False,True,False,False,False,False,False,True,False,,0.06472987979926927,12,47,0.0008909006414977369,307,40,large,0.0010629892228939085,2.355217207292485e-05,small,max,0.6055407100059808,True,False,COMPLETE
37,21.198860388019025,medium,0.6687926601724214,False,False,True,False,True,True,False,False,True,True,False,12.0,0.012161945967283936,7,92,0.07802665917161417,939,97,none,1.564683020580747e-06,8.768285093848185e-05,medium,idw,0.7304231830354023,False,True,COMPLETE
38,21.284409485984558,large,0.7884678338259646,False,True,True,True,True,False,True,False,False,False,True,6.0,0.0240178277058624,14,72,0.03474893104224455,429,50,small,0.08753593869255816,1.2751688273979036e-07,large,capacity,0.5814896243113485,False,True,COMPLETE
39,16.21055583945081,small,0.7505006544913512,True,False,False,True,False,True,False,True,True,True,False,,0.03404192205139535,5,39,0.1191630409694682,498,72,none,7.038822742766343e-06,1.5222520569877395e-06,none,n_panels,0.6699804883198484,True,False,COMPLETE
40,24.982772259780592,none,0.822304161342957,False,False,True,False,True,False,False,False,False,False,True,1.0,0.12039726317624615,9,52,0.17307408220147752,566,76,large,3.4590830571265695e-08,0.25475262512404,small,mean,0.5318356076437355,False,True,COMPLETE
41,16.119381367518113,small,0.7166662003885665,False,False,True,False,True,False,True,False,False,True,False,,0.029669974566849184,8,81,0.03686801031872999,444,24,none,0.001368977137722902,4.039394623240861e-06,large,max,0.6393640291693838,False,True,COMPLETE
42,16.140577078790077,small,0.6258719632890065,False,False,True,False,True,False,True,False,False,True,False,,0.017590489449392257,8,83,0.022058576715547194,396,27,none,0.00026402573572884697,0.0001534440165283621,large,max,0.6892784639033351,False,True,COMPLETE
43,16.263822389042897,small,0.5704550162853008,False,False,True,False,True,False,True,False,False,True,False,,0.016748897180993975,7,99,0.021989818835767436,353,59,none,0.0003335925684245681,0.0101954261010919,large,max,0.6931457048443694,False,True,COMPLETE
44,16.157894817668076,small,0.6339893045384823,False,False,True,False,True,False,True,False,False,True,False,,0.02082771361289232,10,82,0.0955875999875741,381,28,none,0.002075170875192566,0.00014451202816541083,large,distance_capacity,0.6254889929582713,False,True,COMPLETE
45,16.580042212042464,small,0.6847449504376686,False,False,True,False,False,False,True,False,True,True,False,,0.012521713564400749,15,88,0.020200990576872583,412,19,none,0.00010822423918806731,0.0005630737180453263,large,distance_n_panels,0.5960220696449566,False,True,COMPLETE
46,17.30760539608634,small,0.5559702843705969,False,True,True,True,True,True,True,False,False,False,False,,0.010446435823124772,8,69,0.42781872712775615,344,52,small,0.006250553724087479,1.0103966560314292e-05,medium,max,0.8079946743960494,False,True,COMPLETE
47,19.515591981802647,small,0.7147129039663788,True,False,True,False,True,False,True,True,False,True,True,6.0,0.014497206577619657,9,89,0.07229659687255374,619,32,none,2.570388979840414e-07,2.4646560208040653e-05,small,max,0.6882633212009204,False,False,COMPLETE
48,18.54062605322898,medium,0.6170337681423604,False,False,True,False,True,False,False,False,False,True,False,12.0,0.04104013167338414,11,82,0.1214923152139136,508,46,none,0.019023740431426746,0.002170074811732994,large,capacity,0.5576680419225469,False,True,COMPLETE
49,16.720635386957436,large,0.6469765365460509,False,False,True,False,False,False,True,False,True,True,False,,0.02653415272342986,5,96,0.029195500817186342,764,64,none,4.693985455516787e-05,0.02615535836174102,none,None,0.6403470043009005,True,True,COMPLETE
50,17.17231625341249,small,0.5010300109122173,False,False,False,True,True,True,True,False,False,False,True,,0.08206707201410735,6,75,0.3435073880150873,478,109,none,0.07171719437683219,0.00018566995620771646,medium,distance_n_panels,0.8782498339575744,False,True,COMPLETE
51,16.2175023428866,small,0.5788964213818808,False,False,True,False,True,False,True,False,False,True,False,,0.02170682737982117,10,81,0.08918105173429686,403,27,none,0.002662939553952612,0.0005807274518490632,large,distance_capacity,0.6210193062816607,False,True,COMPLETE
52,16.42373344670975,small,0.6359462125727682,False,False,True,False,True,False,True,False,False,True,False,,0.020282146806606498,8,87,0.06281927724709502,342,16,none,0.0002876664994331237,0.00013190507130841556,large,distance_capacity,0.6291301569758903,False,True,COMPLETE
53,16.128332982966782,small,0.6603567778312309,False,False,True,False,True,False,True,False,False,True,False,,0.017946508874160747,13,83,0.09741179039413761,388,36,none,0.0014788907426010445,7.98678527090077e-05,large,distance_capacity,0.589817998056537,False,True,COMPLETE
54,16.90618887783704,small,0.6642732567800885,False,False,True,False,True,False,True,False,False,True,False,,0.017075366443407704,15,68,0.0034806659163886602,442,10,none,2.394517719216437e-08,4.672923300190031e-05,large,distance_capacity,0.5860842396806842,False,True,COMPLETE
55,20.62623160074445,small,0.706906951013174,False,False,True,False,True,False,True,False,False,True,False,1.0,0.013164314249339785,16,74,0.4953803742102007,811,37,none,0.0011747062723701479,0.0045979359503168764,large,distance_capacity,0.5597282984006233,False,True,COMPLETE
56,16.52605928583416,small,0.7311260095258187,False,False,True,False,True,False,True,False,False,True,False,,0.15331604769346516,13,60,0.04341969418813601,537,84,none,0.0005561553980047748,0.001174236064445197,small,max,0.6573765336181726,False,True,COMPLETE
57,16.01017344997199,small,0.5941702384483196,False,False,True,False,True,False,False,False,False,True,False,,0.0157114758478648,13,84,0.14948611129732564,646,40,large,0.00019303232673093982,1.5488384432946402e-05,large,idw,0.7069543366141248,False,True,COMPLETE
58,16.1223696916224,none,0.591258349299718,False,False,True,False,True,False,False,True,False,True,True,,0.048458963703363986,13,77,0.1443691679277943,651,39,large,7.597685669960562e-08,1.4040856070394975e-05,medium,idw,0.9763623082503028,False,True,COMPLETE
59,15.984969423196603,none,0.554294532114767,False,True,True,False,True,False,False,True,False,True,True,,0.04949460479250174,14,65,0.2227884573819331,653,55,large,6.322104684715075e-08,2.7047981644488995e-06,medium,idw,0.9393468160793195,False,True,COMPLETE
60,18.54970330066286,none,0.5587769388520893,True,True,True,False,True,False,False,True,False,True,True,6.0,0.06053297528706999,14,55,0.22554563089793725,654,56,large,1.2557507398664056e-07,2.834480969235431e-06,medium,idw,0.9822137799667705,False,False,COMPLETE
61,16.328784623699256,none,0.5371738037892937,False,True,True,False,True,False,False,True,False,True,True,,0.04783097385365664,13,78,0.2664885496951462,702,42,large,5.140797175890117e-08,1.3295849916352143e-05,medium,idw,0.948885518363952,False,True,COMPLETE
62,15.7782316818075,none,0.5982914411775518,False,True,True,False,True,False,False,True,False,True,True,,0.05523963891680539,15,65,0.18914273065476733,599,48,large,1.2008851749634732e-08,1.1028827210772513e-06,medium,idw,0.9497695794807737,False,True,COMPLETE
63,15.85043203061218,none,0.5951226890795566,False,True,True,False,True,False,False,True,False,True,True,,0.0748788652887259,15,65,0.18992963630396714,593,48,large,1.2111705652070652e-08,4.180276838307005e-07,medium,idw,0.948598712742093,False,True,COMPLETE
64,16.21046653307732,none,0.5253671185365235,False,True,True,False,True,False,False,True,False,True,True,,0.05918646970757214,16,64,0.22061065066940122,602,47,large,1.8942306861628334e-08,5.427668846292952e-07,medium,idw,0.9162675079383104,False,True,COMPLETE
65,15.726143397356665,none,0.5933376177614876,False,True,True,False,True,False,False,True,False,True,True,,0.07454633537008447,14,67,0.17716895101262892,742,67,large,1.0222017085742529e-08,1.7217328908563104e-07,medium,idw,0.9300520675899937,False,True,COMPLETE
66,15.779202636727518,none,0.5946318797136513,False,True,True,False,True,False,False,True,False,True,True,,0.08189316297136441,15,61,0.19282437502205785,739,67,large,1.5492019686894275e-08,1.462193086060012e-07,medium,idw,0.930069159585878,False,True,COMPLETE
67,18.64233833491054,none,0.5471251962228484,False,True,True,False,True,False,False,True,False,False,True,1.0,0.07969322970778399,15,66,0.18755327334862362,740,66,large,1.4255951096735697e-08,8.264003579550033e-08,medium,idw,0.9299215454469492,False,True,COMPLETE
68,20.408257445479276,none,0.5796849744075795,False,True,False,False,True,False,False,True,False,True,True,12.0,0.08777915806688276,15,48,0.2489988441293493,850,60,large,1.2004572027145017e-08,3.598334316239009e-08,medium,idw,0.8687037449688818,True,True,COMPLETE
69,17.391488682251374,none,0.6001863646162674,False,True,True,False,False,False,False,True,False,True,True,,0.07014568280888879,15,61,0.20010272202672053,677,68,large,2.8073011797981345e-08,1.9523417697583743e-07,medium,idw,0.959687684303218,False,True,COMPLETE
