number,value,params_alpha,params_compute_air_density,params_compute_air_density_moiust_air_correction,params_compute_wind_power_density,params_compute_wind_ramp,params_compute_wind_shear,params_dew_point_temperature,params_drop_raw_main_features,params_drop_raw_wind_features,params_encode_wind_direction,params_gust_factor,params_l1_ratio,params_lags_choice,params_lags_target,params_precip_lags_choice,params_spatial_agg_method,params_turbulence_window,params_vapor_pressure,state
0,339.4763618777574,0.6617499731316049,False,False,True,True,True,True,True,True,False,False,0.9999142198295531,small,6.0,small,None,6,True,COMPLETE
1,353.0610486288562,0.6120623720947531,True,True,True,True,True,True,False,False,False,True,0.3476166020378688,small,6.0,small,max,0,False,COMPLETE
2,266.8026326862314,0.5860555423449971,False,False,True,False,False,True,False,False,False,True,0.16338301661511634,small,,none,max,2,False,COMPLETE
3,346.7161029748673,0.20232435967262333,False,True,True,False,False,True,True,True,True,True,0.7258912686016226,large,12.0,none,mean,0,True,COMPLETE
4,344.8430523961519,0.6733844748545541,True,False,False,False,False,False,False,False,False,False,0.43848165442861353,small,6.0,large,capacity,2,True,COMPLETE
5,363.157921143597,0.657726135883049,False,False,True,False,False,False,False,False,False,False,0.5737371745473585,large,1.0,small,idw,0,False,COMPLETE
6,333.88873583348965,0.36954674364277407,False,False,True,False,True,True,False,False,False,False,0.14917126910144063,small,6.0,small,distance_n_turbines,6,False,COMPLETE
7,353.38747387037506,0.5390419413462033,False,True,True,False,False,True,True,True,False,True,0.026483768767752026,none,6.0,small,None,2,True,COMPLETE
8,352.9769541485435,0.36539034198262,True,False,True,False,True,True,True,False,False,False,0.04355594406479878,large,1.0,large,distance_n_turbines,0,False,COMPLETE
9,341.46605030938684,0.13700531992694767,True,False,True,False,False,True,True,False,True,False,0.7628778104789773,none,12.0,large,max,6,True,COMPLETE
10,267.6733571309307,0.9612189394757958,False,True,False,True,False,False,False,True,True,True,0.24345907613029494,small,,none,distance_capacity,2,False,COMPLETE
11,267.6733571309307,0.8899376046240783,False,True,False,True,False,False,False,True,True,True,0.2636730478490081,small,,none,distance_capacity,2,False,COMPLETE
12,267.6733571309307,0.9833369166270338,False,True,False,True,False,False,False,True,True,True,0.23090119814838134,small,,none,distance_capacity,2,False,COMPLETE
13,267.6733571309307,0.8284335957152649,False,True,False,True,False,False,False,True,True,True,0.42438762323311346,small,,none,distance_capacity,2,False,COMPLETE
14,268.7084611964798,0.8086994842765813,False,False,False,True,False,False,False,False,True,True,0.15790420395570237,small,,none,max,2,False,COMPLETE
15,268.3132754746475,0.4457459029860996,False,True,False,True,False,False,False,True,True,True,0.5787760193862783,none,,none,idw,2,False,COMPLETE
16,285.17992283395625,0.29659457592634364,False,False,False,False,False,False,False,True,False,True,0.3100886436827843,small,,none,capacity,2,False,COMPLETE
17,268.23168796286865,0.96134296703355,False,True,False,True,False,True,False,False,True,True,0.14543377971511523,small,,none,mean,2,False,COMPLETE
18,272.6357573834828,0.8152428199539712,True,False,False,False,True,False,False,True,True,True,0.3749827584450097,large,,none,max,2,False,COMPLETE
19,368.2576780440368,0.7368136315314517,False,True,True,True,False,True,False,False,False,True,0.2060974496419941,none,1.0,none,distance_capacity,6,False,COMPLETE
20,331.3426808387789,0.04300632479436112,False,False,False,True,False,False,False,False,False,True,0.536137298118638,small,12.0,large,distance_capacity,2,False,COMPLETE
21,267.6733571309307,0.9052996274795219,False,True,False,True,False,False,False,True,True,True,0.2672041142343177,small,,none,distance_capacity,2,False,COMPLETE
22,267.6733571309307,0.9185684863497177,False,True,False,True,False,False,False,True,True,True,0.055925432022419896,small,,none,distance_capacity,2,False,COMPLETE
23,267.6733571309307,0.5367407509421388,False,True,False,True,False,False,False,True,True,True,0.28110178631691407,small,,none,distance_capacity,2,False,COMPLETE
24,273.05290123458826,0.8677463071604915,False,True,False,True,False,False,False,True,True,True,0.10981212820537953,small,,none,max,2,False,COMPLETE
25,267.6733571309307,0.7488095879972143,False,True,False,True,False,False,False,True,True,True,0.4597491730669657,small,,none,distance_capacity,2,False,COMPLETE
26,268.1850144950001,0.7835308464208588,True,True,True,False,False,True,True,True,True,True,0.20417725096136435,small,,none,capacity,2,True,COMPLETE
27,268.2269606012171,0.9881740746550435,False,True,False,True,True,False,False,True,True,True,0.37096911831319535,small,,none,idw,2,False,COMPLETE
28,336.0268010092365,0.8783706227282131,False,False,True,False,False,True,False,False,False,True,0.1202282166980281,large,1.0,large,distance_n_turbines,6,False,COMPLETE
29,354.4897965765511,0.6091729191282031,False,False,True,True,True,True,True,True,False,False,0.3149231358048801,none,12.0,none,None,0,True,COMPLETE
30,268.18084376438793,0.6939874078481472,False,True,False,True,False,False,False,True,True,True,0.9844791284090324,small,,small,mean,6,False,COMPLETE
31,267.6733571309307,0.9936530726889571,False,True,False,True,False,False,False,True,True,True,0.220406794979699,small,,none,distance_capacity,2,False,COMPLETE
32,267.6733571309307,0.9257140757520519,False,True,False,True,False,False,False,True,True,True,0.2350809607754093,small,,none,distance_capacity,2,False,COMPLETE
33,267.6733571309307,0.8499002366024911,False,True,False,True,False,False,False,True,True,True,0.0951691846590772,small,,none,distance_capacity,2,False,COMPLETE
34,329.29119483631945,0.95025443141342,True,True,False,True,False,False,False,True,True,True,0.34911713082017054,small,6.0,none,max,2,False,COMPLETE
35,268.31292512785103,0.9954328517811066,False,True,True,True,False,False,False,True,True,True,0.19351695124134874,small,,none,distance_capacity,0,True,COMPLETE
36,340.805847360496,0.6166040838323913,False,True,False,False,True,True,False,False,False,False,0.7025079385857493,small,12.0,small,distance_capacity,2,False,COMPLETE
37,355.7251340121116,0.4758993401051499,False,False,True,False,False,False,True,False,False,True,0.27941719234832013,large,6.0,none,None,0,False,COMPLETE
38,350.70413794017696,0.7542888602763722,True,True,False,True,False,True,False,True,True,False,0.4211569819682026,small,1.0,small,max,2,True,COMPLETE
39,263.61919323159475,0.7044980201249453,False,False,True,False,True,True,True,False,False,True,0.060453352102171926,small,,large,mean,2,False,COMPLETE
40,331.429537403598,0.5799756035243027,False,False,True,False,True,True,True,False,False,False,0.015326727834692605,large,6.0,large,mean,6,False,COMPLETE
41,263.61919323159475,0.6703300717990271,False,False,True,False,True,True,True,False,False,True,0.07277268229757872,small,,large,mean,2,False,COMPLETE
42,263.61919323159475,0.6904258872639771,False,False,True,False,True,True,True,False,False,True,0.077380739832912,small,,large,mean,2,False,COMPLETE
43,263.61919323159475,0.6922044052470359,False,False,True,False,True,True,True,False,False,True,0.07194277006178076,small,,large,mean,2,False,COMPLETE
44,263.61919323159475,0.6586650129021243,False,False,True,False,True,True,True,False,False,True,0.05841024473728271,small,,large,mean,2,False,COMPLETE
45,263.61919323159475,0.6935173923347093,False,False,True,False,True,True,True,False,False,True,0.0762332912385731,small,,large,mean,2,False,COMPLETE
46,265.0360447561532,0.653326556043839,False,False,True,False,True,True,True,False,False,True,0.05617657895394834,none,,large,mean,2,False,COMPLETE
47,264.9816716124494,0.658103652910424,True,False,True,False,True,True,True,False,False,True,0.02421791485281162,small,,large,mean,0,False,COMPLETE
48,268.62402059166425,0.5702758511707267,False,False,True,False,True,True,True,False,False,True,0.12705494655825095,small,,large,mean,2,True,COMPLETE
49,325.28750402881707,0.724200013947007,False,False,True,False,True,True,True,False,False,True,0.08596101906280457,small,12.0,large,mean,2,False,COMPLETE
50,336.1124964885144,0.4030375608065322,False,False,True,False,True,True,True,False,False,False,0.17191472378670425,small,1.0,large,mean,2,False,COMPLETE
51,263.61919323159475,0.7001577120787917,False,False,True,False,True,True,True,False,False,True,0.08150248090051218,small,,large,mean,2,False,COMPLETE
52,263.61919323159475,0.6472945864848426,False,False,True,False,True,True,True,False,False,True,0.05859579246142817,small,,large,mean,2,False,COMPLETE
53,263.61919323159475,0.7917316325077304,False,False,True,False,True,True,True,False,False,True,0.017085138625382475,small,,large,mean,2,False,COMPLETE
54,263.61919323159475,0.6873765330306266,False,False,True,False,True,True,True,False,False,True,0.17143245997250123,small,,large,mean,2,False,COMPLETE
55,265.0360447561532,0.5363903252500275,False,False,True,False,True,True,True,False,False,True,0.14691074598194664,none,,large,mean,2,False,COMPLETE
56,263.61919323159475,0.6239648256102229,False,False,True,False,True,True,True,False,False,True,0.08146160679149461,small,,large,mean,2,False,COMPLETE
57,263.61919323159475,0.7287842884826066,False,False,True,False,True,True,True,False,False,True,0.12167128282787477,small,,large,mean,2,False,COMPLETE
58,261.3763874834081,0.7884313221420626,True,False,True,False,True,True,True,False,False,True,0.060731107347829896,large,,large,distance_n_turbines,6,False,COMPLETE
59,325.17543462096614,0.7769655061901298,True,False,True,False,True,True,True,False,False,True,0.011705308350295714,large,6.0,large,distance_n_turbines,6,False,COMPLETE
60,261.3763874834081,0.8312845108585087,True,False,True,False,True,True,True,False,False,True,0.051498684156497346,large,,large,distance_n_turbines,6,False,COMPLETE
61,261.3763874834081,0.7544697275771032,True,False,True,False,True,True,True,False,False,True,0.04207565470161846,large,,large,distance_n_turbines,6,False,COMPLETE
62,261.3763874834081,0.7611004167771217,True,False,True,False,True,True,True,False,False,True,0.10663064182485428,large,,large,distance_n_turbines,6,False,COMPLETE
63,261.3763874834081,0.8383817708603338,True,False,True,False,True,True,True,False,False,True,0.112035476071066,large,,large,distance_n_turbines,6,False,COMPLETE
64,261.3763874834081,0.8272859257183197,True,False,True,False,True,True,True,False,False,True,0.1142946349038459,large,,large,distance_n_turbines,6,False,COMPLETE
65,261.3763874834081,0.8517416124892317,True,False,True,False,True,True,True,False,False,True,0.137152808556757,large,,large,distance_n_turbines,6,False,COMPLETE
66,266.6202767349973,0.8409226177479198,True,False,True,False,True,True,True,False,False,True,0.1821131529058515,large,,large,distance_n_turbines,6,True,COMPLETE
67,331.1939062790095,0.8133523317323182,True,False,True,False,True,True,True,False,False,True,0.13759613295098194,large,1.0,large,distance_n_turbines,6,False,COMPLETE
68,261.3763874834081,0.8680996928321143,True,False,True,False,True,True,True,False,False,True,0.12335566775731636,large,,large,distance_n_turbines,6,False,COMPLETE
69,323.53554074098685,0.8346387298922435,True,False,True,False,True,True,True,False,False,True,0.6288869581181615,large,12.0,large,distance_n_turbines,6,False,COMPLETE
