number,value,params_alpha,params_cloud_lags_option,params_compute_air_density,params_compute_air_density_moist,params_compute_clear_sky_fraction,params_compute_cloud_cover_fraction,params_compute_diffuse_ratio,params_compute_direct_ratio,params_compute_dni_ratio,params_compute_global_tilted_ratio,params_dew_point_temperature,params_drop_raw_features,params_drop_raw_solar_features,params_l1_ratio,params_lags_target,params_precip_lags_option,params_shortwave_lags_option,params_spatial_agg_method,params_use_solar_geometry,params_vapor_pressure,state
0,4180002.544052863,0.5182823989232647,small,True,False,True,False,False,False,False,False,False,False,True,0.6298127658514729,1.0,large,small,mean,False,True,COMPLETE
1,852.6626222923815,0.9986681383335878,none,True,False,False,True,False,True,True,False,False,False,False,0.5986837485674543,12.0,none,small,idw,True,True,COMPLETE
2,2166462.5423563994,0.61431945256546,small,True,False,True,True,False,False,True,False,False,False,True,0.9862542215473614,1.0,none,large,idw,False,True,COMPLETE
3,981.9706637023452,0.1199395991408428,medium,False,True,True,True,True,True,False,False,False,False,True,0.7594976431854964,12.0,large,small,distance_capacity,True,True,COMPLETE
4,713.9143460874626,0.8315678795834291,none,False,True,False,False,False,False,False,True,True,False,False,0.5568057937617583,,large,none,n_panels,True,False,COMPLETE
5,880.2735794454111,0.9578921601996473,medium,False,False,False,True,True,False,True,True,False,False,False,0.8314027701771431,12.0,large,medium,max,True,True,COMPLETE
6,726.655445480429,0.8366644306532656,medium,True,False,False,False,False,True,False,False,False,False,False,0.19292182701087227,,large,none,distance_capacity,True,True,COMPLETE
7,1125.856438588832,0.7345090664269593,large,True,False,True,False,True,False,False,False,True,False,True,0.27856157479160976,6.0,large,none,max,True,False,COMPLETE
8,2110.891280647483,0.2954222345822316,none,True,False,False,False,True,False,False,True,True,False,False,0.050868276445584726,1.0,large,none,idw,False,True,COMPLETE
9,1017.8145716852592,0.6577657864129822,small,False,True,True,False,True,False,True,True,True,True,True,0.20428429937145126,6.0,small,none,mean,False,True,COMPLETE
10,661.3247079282801,0.32914629544188156,none,False,True,False,False,False,True,False,True,True,True,False,0.42242519231574843,,small,large,n_panels,True,False,COMPLETE
11,661.3247079282801,0.39388106233037873,none,False,True,False,False,False,True,False,True,True,True,False,0.3957923868199213,,small,large,n_panels,True,False,COMPLETE
12,661.3247079282801,0.3438763765237628,none,False,True,False,False,False,True,False,True,True,True,False,0.3887135166249256,,small,large,n_panels,True,False,COMPLETE
13,674.5460939217636,0.34413719050108715,none,False,True,False,False,False,True,False,True,True,True,False,0.3873609540838597,,small,large,distance_n_panels,True,False,COMPLETE
14,676.7532739570091,0.12414971563951854,large,False,True,False,False,False,True,False,True,True,True,False,0.41808320680076655,,small,large,n_panels,True,False,COMPLETE
15,667.5513774808961,0.448618968875285,none,False,True,False,False,False,True,False,True,True,True,False,0.46918655580231167,,small,large,capacity,True,False,COMPLETE
16,662.1344888048166,0.23092327260796147,none,False,True,False,False,False,True,False,True,True,True,False,0.033877498644558246,,small,medium,n_panels,True,False,COMPLETE
17,680.951913125814,0.4640939159316269,none,False,True,False,False,False,True,False,True,True,True,False,0.2571365550421529,,small,large,None,True,False,COMPLETE
18,876.1807743740127,0.204925104336888,large,False,True,False,True,False,True,True,True,True,True,False,0.6558912849043301,6.0,small,large,n_panels,False,False,COMPLETE
19,670.194072385514,0.015127095886365571,none,False,True,False,False,False,True,False,True,True,True,False,0.331609165566362,,none,large,capacity,True,False,COMPLETE
20,681.8668994141284,0.5382438293935652,none,False,True,False,False,False,True,False,True,True,True,False,0.1296292640775143,,small,medium,None,True,False,COMPLETE
21,661.3247079282801,0.37741947774825746,none,False,True,False,False,False,True,False,True,True,True,False,0.49209548446034534,,small,large,n_panels,True,False,COMPLETE
22,661.3247079282801,0.4023452156275931,none,False,True,False,False,False,True,False,True,True,True,False,0.3629596099645056,,small,large,n_panels,True,False,COMPLETE
23,661.3247079282801,0.27649250227528493,none,False,True,False,False,False,True,False,True,True,True,False,0.4556133712718253,,small,large,n_panels,True,False,COMPLETE
24,674.5460939217636,0.19032665889123204,none,False,True,False,False,False,True,False,True,True,True,False,0.5343983391151634,,small,large,distance_n_panels,True,False,COMPLETE
25,661.3247079282801,0.5691328648457574,none,False,True,False,False,False,True,False,True,True,True,False,0.3342560778150099,,small,large,n_panels,True,False,COMPLETE
26,32312.382098529964,0.3102471707753472,small,False,True,True,True,True,True,True,True,True,True,True,0.7105139901657207,1.0,none,large,n_panels,False,False,COMPLETE
27,924.0929388351461,0.41638627594324884,large,False,True,False,False,False,True,False,True,True,True,False,0.26189401453675887,6.0,small,large,n_panels,True,False,COMPLETE
28,933.5033648001439,0.11166639474554277,medium,False,True,False,False,False,True,False,True,True,True,False,0.4277586785991866,12.0,small,small,n_panels,True,False,COMPLETE
29,77499.92429833913,0.48865747291382744,small,True,True,True,False,False,True,False,False,False,True,True,0.610125303557049,1.0,small,medium,mean,False,False,COMPLETE
30,681.2046893012748,0.3567106403219427,none,False,True,False,False,False,True,False,True,True,True,False,0.12890000027715104,,none,small,capacity,True,False,COMPLETE
31,661.3247079282801,0.39393257565927453,none,False,True,False,False,False,True,False,True,True,True,False,0.4997119960650773,,small,large,n_panels,True,False,COMPLETE
32,661.3247079282801,0.2690141519656546,none,False,True,False,False,False,True,False,True,True,True,False,0.5487593990549142,,small,large,n_panels,True,False,COMPLETE
33,661.3247079282801,0.3663666362516774,none,False,True,False,False,False,True,False,True,True,True,False,0.47981931595966587,,small,large,n_panels,True,False,COMPLETE
34,852.6556508885642,0.5098105255335181,none,True,False,False,True,False,True,True,False,False,True,False,0.37873631587480866,12.0,small,large,distance_capacity,True,False,COMPLETE
35,776.0312052660753,0.6216224672875816,none,False,True,True,False,False,True,False,True,True,True,True,0.6126937372464054,,none,small,None,True,False,COMPLETE
36,659.3721017915941,0.42992528938313174,medium,False,True,False,True,False,False,False,False,False,True,False,0.8740691435799708,,small,large,idw,True,True,COMPLETE
37,876.3190338107428,0.44949474355881236,medium,True,False,False,True,True,False,True,False,False,False,False,0.9746809766259554,12.0,small,large,idw,False,True,COMPLETE
38,1278.7153736019197,0.5486873325798389,medium,False,True,False,True,False,False,False,False,False,True,False,0.7609240566655185,1.0,large,large,idw,True,True,COMPLETE
39,836.7017532497939,0.15819583116313124,medium,False,False,True,True,True,False,False,False,False,False,True,0.8483661003939034,,small,small,idw,True,True,COMPLETE
40,973.795216347043,0.7049917204158462,medium,True,True,False,True,False,False,True,False,False,False,False,0.3065461043365555,6.0,none,none,max,True,True,COMPLETE
41,659.3721017915941,0.32186413503168837,medium,False,True,False,True,False,False,False,False,False,True,False,0.5607351552469964,,small,large,idw,True,True,COMPLETE
42,659.3721017915941,0.3233636083293532,medium,False,True,False,True,False,False,False,False,False,True,False,0.846022272357454,,small,large,idw,True,True,COMPLETE
43,659.3721017915941,0.24563542198275234,medium,False,True,False,True,False,False,False,False,False,True,False,0.9078668713943159,,small,large,idw,True,True,COMPLETE
44,659.0657512293039,0.26274620915385555,medium,False,True,False,True,False,False,False,False,False,True,False,0.9252388445423411,,large,large,idw,True,True,COMPLETE
45,664.2645670176289,0.24395754169871864,medium,False,False,False,True,False,False,False,False,False,True,False,0.9205614494165443,,large,medium,idw,True,True,COMPLETE
46,698.5115711314684,0.2854976235076234,medium,False,True,False,True,True,False,False,False,False,True,False,0.8529176733037448,,large,none,idw,False,True,COMPLETE
47,978.5106476260225,0.04504840132461213,medium,False,True,True,True,False,False,False,False,False,False,True,0.9047214567364191,12.0,large,large,idw,True,True,COMPLETE
48,672.7244046988789,0.14620041462671485,medium,True,True,False,True,False,False,False,False,False,True,False,0.7840309211294112,,large,large,idw,True,True,COMPLETE
49,1278.7153736019197,0.22181693636336508,medium,False,True,False,True,False,False,False,False,False,True,False,0.9931533171003182,1.0,large,large,idw,True,True,COMPLETE
50,661.6981253645424,0.07354167665701583,medium,False,False,False,True,True,False,False,False,False,True,False,0.9018805122993838,,large,large,idw,True,True,COMPLETE
51,659.3721017915941,0.30646932689180506,medium,False,True,False,True,False,False,False,False,False,True,False,0.8093229158166705,,small,large,idw,True,True,COMPLETE
52,659.3721017915941,0.31652718918911976,medium,False,True,False,True,False,False,False,False,False,True,False,0.8153931701795166,,small,large,idw,True,True,COMPLETE
53,659.3721017915941,0.25441236525874983,medium,False,True,False,True,False,False,False,False,False,True,False,0.9420416985213139,,small,large,idw,True,True,COMPLETE
54,659.3721017915941,0.1931212693581646,medium,False,True,False,True,False,False,False,False,False,True,False,0.7083463470823067,,small,large,idw,True,True,COMPLETE
55,699.2179729136577,0.4306691252347744,medium,False,True,False,True,False,False,False,False,False,True,False,0.8745902878732851,,small,none,idw,True,True,COMPLETE
56,858.0841219399276,0.32761600207018676,medium,False,True,False,True,False,False,False,False,False,True,False,0.9501940407449345,6.0,small,large,idw,True,True,COMPLETE
57,681.9526577848893,0.1747834140780542,medium,False,True,False,True,False,False,True,False,False,True,False,0.8039758521519926,,large,large,distance_capacity,True,True,COMPLETE
58,693.9731050342649,0.9230129477415887,medium,False,True,False,True,False,False,False,False,False,False,False,0.7270314664345496,,small,medium,mean,False,True,COMPLETE
59,684.0012556787766,0.2952569735430965,medium,False,True,False,True,False,False,False,False,False,True,False,0.883165086589345,,small,large,distance_n_panels,True,True,COMPLETE
60,877.4629233032507,0.48524955441136397,small,False,True,True,True,False,False,False,False,False,True,True,0.6557217498853298,,small,large,max,True,True,COMPLETE
61,659.3721017915941,0.32107994254345834,medium,False,True,False,True,False,False,False,False,False,True,False,0.8136205317334193,,small,large,idw,True,True,COMPLETE
62,659.3721017915941,0.3506160863690026,medium,False,True,False,True,False,False,False,False,False,True,False,0.8303250657562147,,small,large,idw,True,True,COMPLETE
63,662.3515806595043,0.22247532397986577,large,False,True,False,True,False,False,False,False,False,True,False,0.7470469957678358,,small,large,idw,True,True,COMPLETE
64,659.3721017915941,0.30838470652104005,medium,False,True,False,True,False,False,False,False,False,True,False,0.9527689769392438,,small,large,idw,True,True,COMPLETE
65,659.3721017915941,0.3848980893969629,medium,False,True,False,True,False,False,False,False,False,True,False,0.6803341733653103,,small,large,idw,True,True,COMPLETE
66,659.3721017915941,0.2577672573110722,medium,False,True,False,True,False,False,False,False,False,True,False,0.7819714180612692,,small,large,idw,True,True,COMPLETE
67,870.053963885775,0.34441271374871396,medium,False,True,False,True,False,False,False,False,False,True,False,0.8806361268743007,6.0,none,large,capacity,True,True,COMPLETE
68,682.2535994341711,0.42222943845176264,medium,True,True,False,True,False,False,False,False,False,True,False,0.9247559988229346,,small,small,idw,True,True,COMPLETE
69,1600.3949734881844,0.27771787785316143,large,False,True,False,True,True,False,True,False,False,True,False,0.862872695368312,1.0,small,large,None,True,True,COMPLETE
