number,value,params_cloud_lags_option,params_colsample_bytree,params_compute_air_density,params_compute_cloud_cover_fraction,params_compute_cooling_degree_hours,params_compute_dew_point_spread,params_compute_effective_solar,params_compute_heating_degree_hours,params_compute_humidex,params_compute_pressure_trend,params_compute_rain_indicator,params_compute_temp_gradient,params_compute_wind_chill,params_compute_wind_components,params_compute_wind_power_density,params_compute_wind_speed_gradient,params_drop_basic_meteo_features,params_drop_rad_meteo_features,params_drop_wind_meteo_features,params_lags_target,params_learning_rate,params_max_depth,params_min_child_weight,params_n_estimators,params_precip_lags_option,params_reg_alpha,params_reg_lambda,params_rolling_temp_option,params_spatial_agg_method,params_subsample,params_temp_lags_option,state
0,20.23546028137207,small,0.5809115837251482,True,False,True,False,False,True,False,True,True,False,False,False,False,True,False,False,False,6.0,0.15007141548014113,8,10,600,medium,0.05840629629910201,2.2500700831669217e-07,long,mean,0.9933930813141478,medium,COMPLETE
1,26.99772834777832,medium,0.5912720167675434,True,True,False,True,False,True,False,False,True,True,True,True,True,True,True,False,True,6.0,0.28045638096690007,10,6,667,none,2.0514088786696413e-05,0.7555093506010157,none,distance_population,0.5424410295034079,none,COMPLETE
2,24.86301612854004,medium,0.5510974444812209,True,True,True,True,False,False,False,True,True,False,False,False,False,False,True,True,False,1.0,0.045075108069824975,8,1,338,small,2.7936187685934758e-08,6.794472780402172e-07,none,idw,0.6401008967024632,small,COMPLETE
3,28.8652400970459,medium,0.5690627251127589,False,False,False,True,False,False,True,True,True,False,True,True,True,True,True,True,False,12.0,0.06833874936896979,3,10,316,none,0.0001815495113315787,8.51406541161488e-06,long,idw,0.7975282936955704,medium,COMPLETE
4,30.61470603942871,none,0.5716050116143205,True,True,False,False,False,True,True,False,True,True,False,False,True,True,True,True,False,12.0,0.050430606636043554,3,5,310,small,5.194720022109728e-07,7.58888323025169e-07,short,distance_population,0.979987654439619,none,COMPLETE
5,25.662155151367188,none,0.981249951852022,False,False,False,False,False,False,False,True,False,False,True,True,False,True,False,False,False,,0.01927757663265929,6,2,848,none,0.0010770436088495881,0.004728771896468913,none,None,0.9676098495580513,medium,COMPLETE
6,42.221221923828125,medium,0.8826067790639994,False,False,True,True,True,False,True,True,False,False,False,True,False,True,False,False,False,1.0,0.2247991163269429,3,9,662,small,1.0929211576619597e-08,2.910677243796789e-07,long,energy,0.9283742062624021,medium,COMPLETE
7,24.164743423461914,none,0.7209391448727922,False,True,True,False,False,True,False,False,False,True,False,False,True,False,True,True,True,,0.021614023492773228,9,1,839,medium,9.934079651015066e-06,0.0006181487369035186,none,max,0.7006004792379807,small,COMPLETE
8,23.62593650817871,none,0.9923076793928678,False,False,True,True,False,False,False,False,False,True,False,True,False,False,True,False,True,6.0,0.06948163702869777,8,4,628,medium,5.1370344298950174e-08,0.015035753907002899,short,None,0.7036448363535737,medium,COMPLETE
9,25.592933654785156,small,0.7214588231648609,False,True,False,False,False,True,False,False,False,True,False,False,True,False,False,True,False,,0.05909815764514782,3,4,1000,none,4.873964514932723e-05,4.7158486328429677e-07,long,max,0.9194988262684416,small,COMPLETE
10,22.372446060180664,small,0.6586787641071694,True,False,True,False,True,True,True,True,True,False,True,False,False,True,False,False,True,6.0,0.11116601090459702,6,8,503,medium,0.487561036369524,1.377742656048191e-08,long,mean,0.8258571086580664,medium,COMPLETE
11,24.139955520629883,small,0.6607546553054092,True,False,True,False,True,True,True,True,True,False,True,False,False,True,False,False,True,6.0,0.1395793489819245,6,8,464,medium,0.7765467971955916,1.2066783649628779e-08,long,mean,0.8324118089794849,medium,COMPLETE
12,22.90123176574707,small,0.805146192402351,True,False,True,False,True,True,True,True,True,False,True,False,False,True,False,False,True,6.0,0.1317384677291061,5,7,523,medium,0.6313762425932014,4.574957461460841e-08,long,mean,0.8865849126755765,medium,COMPLETE
13,22.025352478027344,small,0.5052720664213581,True,False,True,False,True,True,True,True,True,False,True,False,False,True,False,False,True,6.0,0.1250944124340324,7,10,500,medium,0.031190977615484016,5.5939111564670196e-05,long,distance_energy,0.8283548495860943,medium,COMPLETE
14,23.466577529907227,small,0.5269517108803533,True,False,True,False,True,True,False,True,True,False,False,False,False,True,False,False,False,6.0,0.19710140363437115,8,10,570,medium,0.014667171138318554,3.424055459613365e-05,long,distance_energy,0.875775550217395,medium,COMPLETE
15,23.107900619506836,small,0.5140125066704445,True,False,True,False,True,True,True,True,True,False,True,False,False,True,False,False,True,6.0,0.10029520550400813,7,10,422,medium,0.02680511134234943,1.380855108356512e-05,long,population,0.7569859469989252,none,COMPLETE
16,21.058717727661133,small,0.6289377615145022,True,False,True,False,True,True,False,True,True,False,False,False,False,True,False,False,True,6.0,0.03650039990938607,10,8,763,medium,0.018225757113097825,0.00041646749208595506,short,distance_energy,0.5767807327893314,medium,COMPLETE
17,23.53997039794922,small,0.6194666062053636,True,False,True,False,True,True,False,True,True,False,False,False,False,True,False,False,False,1.0,0.01063176986672857,10,8,772,medium,0.0023371185793712216,0.0005805134299729051,short,distance_energy,0.5300541599156982,medium,COMPLETE
18,22.214492797851562,small,0.6510032998345109,True,False,True,False,False,True,False,True,True,False,False,False,False,False,False,False,True,12.0,0.03120221711479013,9,7,764,medium,0.0814584538576192,0.0745280143630547,short,energy,0.6100393133470277,small,COMPLETE
19,21.888757705688477,small,0.7788309388901621,True,False,True,False,True,True,False,True,True,False,False,False,False,True,False,False,False,6.0,0.036009174912623024,9,9,975,small,0.0024226714406494734,0.0004198973100153667,short,population,0.6147188256938996,none,COMPLETE
20,21.462636947631836,small,0.7091452180623133,True,False,True,False,False,True,False,True,True,False,False,False,False,True,False,False,False,6.0,0.022211926116939014,10,6,731,medium,0.10554335462735734,7.393560863533622e-06,short,mean,0.5072469116714435,medium,COMPLETE
21,20.370038986206055,small,0.702232006064121,True,False,True,False,False,True,False,True,True,False,False,False,False,True,False,False,False,6.0,0.02123051430944886,10,6,714,medium,0.12160635057733361,4.6202898754265855e-06,short,mean,0.5089340397933084,medium,COMPLETE
22,21.111738204956055,small,0.6203286908435427,True,False,True,False,False,True,False,True,True,False,False,False,False,True,False,False,False,6.0,0.014128280796353686,9,7,862,medium,0.011141541205150778,2.875165809784817e-06,short,mean,0.5653149090010677,medium,COMPLETE
23,20.289472579956055,small,0.8375550979089471,True,False,True,False,False,True,False,True,True,False,False,False,False,True,False,False,False,6.0,0.03122191834772747,10,9,617,medium,0.0003058271122678928,0.00014003302109039838,short,distance_energy,0.5877207464247811,medium,COMPLETE
24,22.719482421875,small,0.845458579350021,True,False,True,False,False,True,False,True,True,False,False,False,False,True,False,False,False,6.0,0.026298743303125573,8,9,590,medium,0.0005481074365629568,8.307325036493466e-08,short,mean,0.6762929654910685,medium,COMPLETE
25,22.42816162109375,small,0.9173575082909033,True,False,True,False,False,True,False,True,True,False,False,False,False,True,False,False,False,6.0,0.0168407932699862,9,3,706,medium,3.8071958057880054e-06,2.399382406764237e-06,short,mean,0.5816390577408198,medium,COMPLETE
26,22.117517471313477,small,0.8120414819897692,True,True,False,True,False,False,False,False,False,True,False,True,True,False,False,True,False,12.0,0.013302799567444736,10,5,572,medium,0.1769278534504534,7.71495823301127e-05,short,distance_energy,0.5082122037373891,medium,COMPLETE
27,26.556228637695312,small,0.7584411392133398,True,False,True,False,False,True,False,True,True,False,False,False,False,True,False,False,False,,0.08224476548206858,5,9,616,medium,0.005005442540102508,9.876819732958113e-08,short,mean,0.7305605823734138,medium,COMPLETE
28,25.948951721191406,medium,0.9071991328235783,True,False,True,False,False,True,False,True,True,False,False,False,False,True,False,False,False,1.0,0.04236891413174893,7,6,700,small,0.0003470500909873965,2.968066996233039e-06,none,idw,0.6403798988461527,none,COMPLETE
29,29.228004455566406,none,0.7014997399232857,True,True,False,True,False,True,False,False,True,True,False,True,True,True,True,False,False,6.0,0.25153232100528455,10,6,391,none,2.526172968382685e-06,0.0033886589369319727,short,distance_population,0.5399401302859627,small,COMPLETE
30,23.17784881591797,medium,0.850601059577954,True,False,True,False,False,True,False,True,True,False,False,False,False,True,False,False,False,6.0,0.028507746974394697,9,7,665,none,0.19040156981282905,0.14579123449176054,none,None,0.6617712522717016,none,COMPLETE
31,21.55843162536621,small,0.676268894184824,True,False,True,False,False,True,False,True,True,False,False,False,False,True,False,False,True,6.0,0.036944279527625225,10,8,807,medium,0.050215577477156825,0.00020624420780486206,short,distance_energy,0.5683859957616435,medium,COMPLETE
32,20.953691482543945,small,0.6133716622461876,True,False,True,False,True,True,False,True,True,False,False,False,False,True,False,False,True,6.0,0.17984690333804038,10,9,922,medium,0.005521775073824816,1.6581559621665183e-05,short,distance_energy,0.6069199930619664,medium,COMPLETE
33,23.61808204650879,small,0.582023847112987,True,False,True,False,False,True,False,True,True,False,False,False,False,True,False,False,False,6.0,0.1755398454492438,8,9,961,medium,5.6617733492185044e-05,2.1521298056197486e-05,short,distance_energy,0.6190595572670115,medium,COMPLETE
34,26.144926071166992,small,0.553178953331842,True,True,True,True,False,False,False,True,True,False,False,False,False,True,True,True,False,6.0,0.2967265905417982,10,10,911,medium,0.006597409203840302,8.691525831846083e-07,short,distance_population,0.7675667933412238,medium,COMPLETE
35,26.167367935180664,medium,0.6083658330378763,True,False,False,False,False,True,False,True,True,False,False,False,True,True,False,False,False,1.0,0.17918011913835138,9,9,558,small,0.0001759874839426169,3.9043507931576624e-06,short,idw,0.5365222843823478,medium,COMPLETE
36,30.485082626342773,small,0.7509959140756239,False,False,True,False,False,False,False,True,True,False,False,True,False,False,True,True,False,12.0,0.15641178415791449,10,10,919,none,0.001789110770060926,2.1398593503216777e-07,none,distance_energy,0.5004467531507457,medium,COMPLETE
37,22.94510841369629,none,0.5848944571114552,True,False,False,True,True,True,False,False,False,True,False,False,False,True,False,False,True,6.0,0.08858544864628386,8,5,692,medium,0.000684030723062708,1.3102085716065635e-06,long,energy,0.5967197227784695,small,COMPLETE
38,23.78712272644043,medium,0.5431192664258851,False,True,True,False,False,False,False,True,True,False,False,True,True,True,True,False,False,,0.025159762451440006,9,2,616,small,0.007057911578706034,0.0029325577756261416,short,max,0.9560041218134471,medium,COMPLETE
39,24.938644409179688,none,0.6896117952072045,False,False,True,False,False,True,False,True,False,False,False,False,False,False,False,True,False,12.0,0.049479951224273455,10,4,638,medium,0.05621462160744775,0.00011328821002490566,none,population,0.6437875784965583,medium,COMPLETE
40,24.584054946899414,small,0.7282088645490058,True,False,False,True,True,True,False,False,True,True,True,False,False,True,False,False,True,6.0,0.21933179959216306,4,9,812,medium,0.2268402518068035,8.05447609896881e-06,long,None,0.7013542010383171,none,COMPLETE
41,21.32289695739746,small,0.6401259016694586,True,False,True,False,True,True,False,True,True,False,False,False,False,True,False,False,True,6.0,0.06223278930023116,10,8,744,medium,0.02016237984649271,0.0010047894548211405,short,distance_energy,0.5633934144709154,medium,COMPLETE
42,20.835023880004883,small,0.5981598299560567,True,False,True,False,True,True,False,True,True,False,False,False,False,True,False,False,True,6.0,0.018131200249531843,9,8,667,medium,0.003330830930544098,0.0001517426562576491,short,distance_energy,0.5825595558777467,medium,COMPLETE
43,21.280059814453125,small,0.5987797947765068,True,False,True,False,True,True,False,True,True,False,False,False,False,True,False,False,True,6.0,0.016422602172849136,9,10,668,medium,0.0002380975028639164,0.0001458004844174671,short,distance_energy,0.663248006234898,medium,COMPLETE
44,21.034826278686523,small,0.5634163201579616,True,False,True,False,True,True,True,True,True,False,False,False,False,True,False,False,True,6.0,0.021271124896897777,9,9,536,medium,0.0013896267151893014,2.1208106201602025e-05,short,distance_energy,0.5513547581597988,medium,COMPLETE
45,24.32857322692871,small,0.671107943416404,True,False,True,False,True,True,False,True,False,False,False,False,False,True,False,False,True,,0.018437618103551125,8,8,466,none,0.003443711871960468,4.097527709165818e-05,short,mean,0.5916596381757321,medium,COMPLETE
46,23.013818740844727,small,0.9420488308373374,False,True,True,False,True,False,False,True,True,False,True,True,True,True,True,False,True,6.0,0.012989157817842207,10,7,602,medium,2.0511111866763642e-05,4.202903633600262e-07,long,max,0.9974528706671283,small,COMPLETE
47,25.039907455444336,none,0.8186808036339404,True,False,True,False,False,True,True,True,True,False,False,False,False,False,False,True,True,1.0,0.031220971051846052,9,9,655,medium,0.41719907090200636,0.0014424971897963911,long,distance_energy,0.7921741348160022,medium,COMPLETE
48,21.46063804626465,small,0.5355866440425318,True,False,True,False,True,True,False,False,True,False,False,False,False,True,False,False,False,6.0,0.015118776581322066,8,10,878,medium,9.092470781382642e-05,3.19594139770959e-08,short,mean,0.5229466562430053,medium,COMPLETE
49,21.401281356811523,small,0.7820071251092304,True,False,True,False,True,True,False,True,True,True,True,False,False,True,False,False,True,6.0,0.023678795611794628,7,8,806,medium,1.1496837554480725e-07,0.008066490563275967,short,distance_population,0.8639237755905587,medium,COMPLETE
50,21.465171813964844,medium,0.6371573678056032,False,False,True,False,False,True,True,True,False,False,False,False,False,True,False,False,False,6.0,0.011232703019353685,10,10,540,small,0.9730797918522082,0.0002606355734989338,long,idw,0.6226467600225558,medium,COMPLETE
51,21.276161193847656,small,0.5585381942033341,True,False,True,False,True,True,True,True,True,False,False,False,False,True,False,False,True,6.0,0.019220179335378517,9,9,508,medium,0.0012366745372717912,1.6796213941559546e-05,short,distance_energy,0.5537346230351008,medium,COMPLETE
52,20.627347946166992,small,0.5636908463476542,True,False,True,False,True,True,True,True,True,False,False,False,False,True,False,False,True,6.0,0.020357452292784985,9,9,460,medium,0.0009853094201069583,3.265623906325258e-05,short,distance_energy,0.5478179696641069,medium,COMPLETE
53,20.861785888671875,small,0.5755134007593928,True,False,True,False,True,True,True,True,True,False,False,False,False,True,False,False,True,6.0,0.020799287234298358,9,8,355,medium,0.000603997067641944,3.7099908189646125e-05,short,distance_energy,0.5920146278357292,medium,COMPLETE
54,21.105857849121094,small,0.513840707203922,True,False,True,False,True,True,True,True,True,False,False,False,False,True,False,False,True,6.0,0.019975107130903887,9,8,349,medium,0.0006100256578940635,8.788009904297146e-05,short,energy,0.5291200012461713,medium,COMPLETE
55,21.379623413085938,small,0.5784995993736687,True,False,True,False,True,True,True,True,True,False,False,False,False,True,False,False,True,6.0,0.031204898241393688,8,7,305,medium,0.0001136751059126993,4.773590969981084e-05,short,distance_energy,0.9261804734806942,medium,COMPLETE
56,20.26350975036621,small,0.500311457787932,True,False,True,False,True,True,True,True,True,False,False,False,False,True,False,False,True,6.0,0.017202942896577707,9,8,367,medium,2.0592290373244833e-05,0.0002383963743437877,short,mean,0.5891670689563333,medium,COMPLETE
57,24.022071838378906,small,0.524114528982888,True,False,True,False,True,True,True,True,True,False,False,False,False,True,False,False,False,,0.01637944918308833,9,10,423,medium,1.8718041337802704e-05,0.0008313139560435087,long,mean,0.5812293483865316,small,COMPLETE
58,22.073745727539062,small,0.5012312767126342,True,False,False,True,False,True,True,True,True,False,True,False,False,False,False,False,True,6.0,0.01146468286589089,6,6,467,medium,6.668174941129681e-06,0.00023632861899194516,short,mean,0.5246036341461113,none,COMPLETE
59,25.88433265686035,small,0.5387082690212154,True,True,True,False,False,False,True,True,True,False,False,True,True,True,False,True,False,12.0,0.017854075472120624,8,3,389,medium,7.245685984960687e-07,4.510318218412659e-06,none,mean,0.7361772704898129,medium,COMPLETE
60,24.153661727905273,small,0.8722085605412739,True,False,True,False,True,True,True,False,True,True,False,False,False,True,True,False,True,1.0,0.026679810045392233,7,7,436,none,5.3932039523364844e-05,0.0016538005678792297,short,mean,0.6292037656494133,medium,COMPLETE
61,20.87238883972168,small,0.5718027611769778,True,False,True,False,True,True,True,True,True,False,False,False,False,True,False,False,True,6.0,0.024105120251832632,9,8,341,medium,0.00030693558162571703,3.289701152450865e-05,short,distance_energy,0.5906704119459898,medium,COMPLETE
62,21.59740447998047,small,0.5980143274721561,True,False,True,False,True,True,True,True,True,False,False,False,False,True,False,False,True,6.0,0.022994204282912274,9,8,367,medium,0.0007101142146716972,0.0004440062455783555,short,population,0.5515746848800809,medium,COMPLETE
63,20.7373104095459,small,0.520620315989016,True,False,True,False,True,True,True,True,True,False,False,False,False,True,False,False,True,6.0,0.01423160317963355,9,9,376,medium,3.433889435652982e-05,9.426534192074794e-06,short,mean,0.6000818532030255,medium,COMPLETE
64,21.47657012939453,small,0.5247530728247934,True,False,True,False,True,True,True,True,True,False,False,False,False,True,False,False,True,6.0,0.012601277168567782,10,9,384,medium,1.2142270692655445e-05,9.131841794487919e-06,short,mean,0.8967833470673794,medium,COMPLETE
65,20.8389892578125,small,0.549761026862124,True,False,True,False,True,True,True,True,True,False,False,False,False,True,False,False,True,6.0,0.01447103260267775,8,9,590,medium,2.7315769756212135e-05,1.8125246382137174e-06,short,mean,0.6791718507600308,medium,COMPLETE
66,21.206722259521484,small,0.5147823618829306,True,False,True,False,False,True,True,True,True,False,False,False,False,True,False,False,False,6.0,0.010005452883437157,9,10,732,medium,0.00010205464392356114,0.00012926695442190604,short,mean,0.5199549673526483,medium,COMPLETE
67,21.44875144958496,none,0.9673898554535288,True,False,True,False,True,True,True,True,True,False,False,False,False,True,False,False,False,6.0,0.01605416161066556,10,9,324,medium,0.040149186588086076,6.23647987350187e-05,long,None,0.5715314459590284,medium,COMPLETE
68,21.023683547973633,small,0.7321150946720776,True,False,True,False,False,True,True,True,False,False,False,False,False,True,False,False,True,6.0,0.0181816691926379,9,10,448,small,1.7164813030707237e-06,1.919006055722582e-07,short,mean,0.6077429403876717,none,COMPLETE
69,21.78424644470215,small,0.595020518526057,True,False,True,True,False,True,False,True,True,False,False,False,False,False,False,False,False,6.0,0.02858082853264238,8,9,487,medium,0.12403622776320693,7.710341571857525e-07,short,mean,0.653948411541745,medium,COMPLETE
