number,value,params_cloud_lags_option,params_colsample_bytree,params_compute_air_density,params_compute_cloud_cover_fraction,params_compute_cooling_degree_hours,params_compute_dew_point_spread,params_compute_effective_solar,params_compute_heating_degree_hours,params_compute_humidex,params_compute_pressure_trend,params_compute_rain_indicator,params_compute_temp_gradient,params_compute_wind_chill,params_compute_wind_components,params_compute_wind_power_density,params_compute_wind_speed_gradient,params_drop_basic_meteo_features,params_drop_rad_meteo_features,params_drop_wind_meteo_features,params_learning_rate,params_max_depth,params_min_child_samples,params_min_split_gain,params_n_estimators,params_num_leaves,params_precip_lags_option,params_reg_alpha,params_reg_lambda,params_rolling_temp_option,params_spatial_agg_method,params_subsample,params_temp_lags_option,params_use_base_models_pred_intervals,state
68,675.6932587637515,medium,0.69270712756098,True,True,False,True,True,False,False,False,False,True,False,True,True,True,True,True,False,0.26764140562306465,11,92,0.1708879878930875,350,130,none,0.020567798412015528,2.464283170109337e-07,short,mean,0.9554005013081432,medium,False,COMPLETE
69,643.9639014395149,medium,0.5573744873015061,True,False,False,False,False,False,False,False,True,True,False,False,False,True,True,False,False,0.07796749988495551,7,87,0.4851837435261778,732,123,none,6.585061107465734e-06,2.9106448031102864e-06,long,idw,0.7677291221938445,medium,False,COMPLETE
