number,value,params_cloud_lags_option,params_colsample_bytree,params_compute_air_density,params_compute_cloud_cover_fraction,params_compute_cooling_degree_hours,params_compute_dew_point_spread,params_compute_effective_solar,params_compute_heating_degree_hours,params_compute_humidex,params_compute_pressure_trend,params_compute_rain_indicator,params_compute_temp_gradient,params_compute_wind_chill,params_compute_wind_components,params_compute_wind_power_density,params_compute_wind_speed_gradient,params_drop_basic_meteo_features,params_drop_rad_meteo_features,params_drop_wind_meteo_features,params_learning_rate,params_max_depth,params_min_child_samples,params_min_split_gain,params_n_estimators,params_num_leaves,params_precip_lags_option,params_reg_alpha,params_reg_lambda,params_rolling_temp_option,params_spatial_agg_method,params_subsample,params_temp_lags_option,params_use_base_models_pred_intervals,state
67,547.1802640050668,medium,0.5024796532793204,False,False,False,True,True,False,False,True,True,False,True,False,False,True,False,True,True,0.018976595013596578,15,45,0.28497582522173864,304,52,small,1.3081641085239223e-07,0.00047607370575783475,none,None,0.533242013371604,none,False,COMPLETE
68,606.8526876536058,small,0.5034345497246906,False,False,False,True,True,False,False,True,True,False,True,False,False,True,False,True,True,0.01996908360872752,15,46,0.29648445660996203,363,34,small,1.329667137092619e-07,0.00038941278317407274,none,None,0.5332657944101359,small,True,COMPLETE
69,589.9136537522149,medium,0.5880827989069082,False,False,False,True,True,False,False,True,True,False,True,False,False,True,True,True,True,0.01676247373787828,15,61,0.2595637457820748,307,52,small,0.005744126942826464,0.00025518318161371286,none,None,0.5008606455702614,none,False,COMPLETE
