number,value,params_cloud_lags_option,params_colsample_bytree,params_compute_air_density,params_compute_cloud_cover_fraction,params_compute_cooling_degree_hours,params_compute_dew_point_spread,params_compute_effective_solar,params_compute_heating_degree_hours,params_compute_humidex,params_compute_pressure_trend,params_compute_rain_indicator,params_compute_temp_gradient,params_compute_wind_chill,params_compute_wind_components,params_compute_wind_power_density,params_compute_wind_speed_gradient,params_drop_basic_meteo_features,params_drop_rad_meteo_features,params_drop_wind_meteo_features,params_learning_rate,params_max_depth,params_min_child_samples,params_min_split_gain,params_n_estimators,params_num_leaves,params_precip_lags_option,params_reg_alpha,params_reg_lambda,params_rolling_temp_option,params_spatial_agg_method,params_subsample,params_temp_lags_option,params_use_base_models_pred_intervals,state
0,680.0464854815369,medium,0.9160023329512211,True,False,True,False,False,False,False,True,False,False,True,False,False,True,False,True,False,0.1785199353479038,8,54,0.26448450656074934,660,140,medium,1.469014330085283e-05,8.484397387233486e-07,short,energy,0.8684528344293377,none,True,COMPLETE
1,677.630035671263,none,0.621860479244378,False,False,False,True,True,True,False,False,True,False,True,False,False,True,False,True,False,0.1002437917086877,7,99,0.12976584467127622,843,146,medium,0.05318350957709018,0.002261126423266788,none,mean,0.6007681804617719,small,True,COMPLETE
2,665.4429419306408,none,0.9831884466242989,False,False,False,True,False,True,False,True,True,False,True,True,True,False,False,False,True,0.014084786671537433,10,24,0.18499331015346576,833,45,small,8.16062819778795e-08,4.8489938279239506e-06,short,distance_energy,0.6186440749895015,small,True,COMPLETE
3,614.9856115995118,small,0.5909535671902397,True,True,True,True,False,False,True,True,False,False,True,True,True,False,False,False,False,0.0711634815414866,3,71,0.2157583771814507,924,78,none,2.0375308104368367e-08,0.04991957983905814,short,max,0.7585787642623633,none,False,COMPLETE
4,681.1899331138125,small,0.6529555994173042,False,False,False,True,True,False,False,True,True,True,False,True,True,False,True,False,True,0.07169812029672551,15,85,0.44091664325720964,694,72,medium,0.0005649561877692007,4.158432273659141e-07,long,mean,0.6647103507140715,none,False,COMPLETE
5,751.7842780934989,medium,0.7663105158306363,True,True,False,False,True,False,False,True,True,False,True,False,False,True,True,False,True,0.2642978054392167,12,97,0.32350297071969053,722,12,none,1.0717135005214232e-08,0.17204664039191825,long,max,0.5914559591880528,small,False,COMPLETE
6,670.753509605093,small,0.7167168581514227,False,False,True,False,True,False,True,True,True,False,True,True,False,True,True,False,True,0.010853074789797464,9,41,0.013476076813063675,564,121,medium,0.033135097973445625,5.391096199733392e-08,none,distance_energy,0.9153909551568282,small,False,COMPLETE
7,691.4285728328036,small,0.8160985592778289,False,False,False,True,False,False,True,True,True,False,False,False,True,True,True,True,True,0.01736341221388257,3,12,0.30836896540007447,952,34,small,0.0001218172932822323,7.227506329080594e-06,none,mean,0.8448671402416337,none,False,COMPLETE
8,656.162639125935,small,0.7618670391902291,True,False,True,True,True,True,True,False,True,False,True,False,True,False,False,True,True,0.2734551490298707,7,67,0.020188037254265545,471,11,small,1.4091828527135747e-05,0.00010145676404975441,short,distance_energy,0.9429952210633712,none,False,COMPLETE
9,737.6412738284154,small,0.803916011478578,True,False,True,True,True,False,True,True,True,True,True,True,True,False,True,False,False,0.2681251505272468,16,64,0.33181093986175964,473,42,small,0.006015050600250771,0.0008553257038902812,short,max,0.6921936800563949,small,True,COMPLETE
10,606.4112340203809,none,0.5076698950440253,True,True,True,False,False,True,True,False,False,True,False,True,True,False,False,False,False,0.032241843948649686,4,78,0.4976610026299326,996,96,none,8.3935349643206e-07,0.44316892469267927,short,idw,0.7610623890593742,medium,False,COMPLETE
11,609.5609026228025,none,0.5024261654549659,True,True,True,False,False,True,True,False,False,True,False,True,True,False,False,False,False,0.03229944512131188,3,74,0.467669894736464,999,92,none,3.539962825055292e-07,0.4697794486904745,short,idw,0.7724615802121846,medium,False,COMPLETE
12,602.6958933711826,none,0.5072870230583902,True,True,True,False,False,True,True,False,False,True,False,True,True,False,False,False,False,0.030147289059292832,5,81,0.49791255056407047,943,105,none,5.751021871488063e-07,0.5476500057535997,short,idw,0.7802928885782269,medium,False,COMPLETE
13,597.820647292262,none,0.5058872766353059,True,True,True,False,False,True,True,False,False,True,False,True,True,False,False,False,False,0.03579467395982252,5,84,0.39141878510849404,842,108,none,1.0552580097442668e-06,0.015908588797720388,short,idw,0.5179480454569616,medium,False,COMPLETE
14,614.9291022845382,none,0.5740261968554177,True,True,True,False,False,True,True,False,False,True,False,True,True,False,False,False,False,0.02984764916183289,5,87,0.41134357347154055,333,115,none,2.251370921066189e-06,0.013116723799032889,short,idw,0.5431609329812771,medium,False,COMPLETE
15,634.1675829919844,none,0.684085583625725,True,True,True,False,False,True,True,False,False,True,False,True,True,False,False,False,False,0.02293561433586515,6,43,0.38844573501461127,811,113,none,6.674568400583185e-06,0.006547105064592772,long,distance_population,0.5102429982939136,medium,False,COMPLETE
16,643.5617062402026,none,0.5502072088881811,True,True,True,False,False,True,True,False,False,True,False,True,True,False,False,False,False,0.04480433005929537,12,88,0.37478481029829636,780,64,none,0.5830932988367995,0.0002677793292567607,short,population,0.8100459939533402,medium,False,COMPLETE
17,639.2958594885813,none,0.5514973841499263,True,True,True,False,False,True,True,False,False,True,False,True,True,False,False,False,False,0.05268261913439416,6,59,0.49004080107786135,879,100,none,2.040646169774694e-07,0.03978749196771374,short,None,0.9981847104528129,medium,False,COMPLETE
18,672.4107002160309,medium,0.6125809819564793,True,True,True,False,False,True,True,False,False,True,False,True,False,False,False,True,False,0.1032368966605357,5,46,0.4334734607925854,755,128,none,0.00014191332910735532,0.6575751030538355,none,idw,0.6994055074030825,medium,True,COMPLETE
19,642.9180320298798,none,0.8653060994271091,True,True,True,False,False,True,True,False,False,True,False,True,True,False,False,False,False,0.022010006387767424,11,31,0.3652556403380456,893,104,none,1.7535699984119435e-06,0.038668077981477623,long,idw,0.6574963326515386,medium,False,COMPLETE
20,641.5167323455589,none,0.6649649412476927,True,True,True,False,False,True,True,False,False,True,False,True,True,False,False,False,False,0.03909807847666982,8,80,0.2744604939289367,623,129,none,6.898646641368249e-08,0.0012028109813249318,short,energy,0.8174135438776503,medium,False,COMPLETE
21,602.0655576884052,none,0.5017865849197019,True,True,True,False,False,True,True,False,False,True,False,True,True,False,False,False,False,0.026269382296426468,4,79,0.49035518204610373,1000,94,none,6.038724954864954e-07,0.8180879463933474,short,idw,0.7273630202903049,medium,False,COMPLETE
22,600.7243231591743,none,0.5314488422989357,True,True,True,False,False,True,True,False,False,True,False,True,True,False,False,False,False,0.02276112324796546,5,92,0.45170495144031025,937,86,none,4.996329989333264e-06,0.1205830884452638,short,idw,0.7329018100245038,medium,False,COMPLETE
23,605.6742974600976,none,0.5524619758588383,True,True,True,False,False,True,True,False,False,True,False,True,True,False,False,False,False,0.01960801623929873,4,93,0.44577391969783137,882,85,none,4.071147777092302e-05,0.10895970421336929,short,idw,0.7175572655727512,medium,False,COMPLETE
24,638.5254687306011,none,0.5390664830790138,True,True,True,False,False,True,True,False,False,True,False,True,True,False,False,False,False,0.014936970826091798,6,92,0.4065355400478454,956,59,none,3.96369616306345e-06,0.008692870814244772,short,None,0.5513288237418502,medium,False,COMPLETE
25,617.6251800415181,medium,0.6203233590544766,True,True,True,False,False,True,True,False,False,True,False,True,True,False,False,False,False,0.0251173047199899,4,73,0.3585556676345266,855,88,none,7.957828092748142e-08,0.10347361838729076,short,distance_population,0.6466523420490149,medium,False,COMPLETE
26,733.9374028816746,none,0.5798323127294412,False,True,False,False,False,True,False,False,False,True,False,False,False,True,True,True,False,0.011370355120256246,7,100,0.4568837042796793,787,77,none,3.309829976091382e-05,0.016210503192677524,short,population,0.7212377787137868,medium,True,COMPLETE
27,603.448148855557,none,0.535834040048238,True,True,True,False,False,True,True,False,False,True,False,True,True,False,False,False,False,0.04190997887705498,5,64,0.416087529432141,1000,64,none,0.0009220646760147245,0.004339769165531221,short,idw,0.881138730426273,medium,False,COMPLETE
28,633.7190842101177,none,0.7081388047066325,True,True,True,False,False,True,True,False,False,True,False,True,True,False,False,False,False,0.06831172902065498,9,91,0.4731980998167533,922,114,small,1.4124464248954238e-06,0.14686484414910836,long,idw,0.5060271917405376,medium,False,COMPLETE
29,665.3239735546877,medium,0.643645921217832,True,True,True,False,False,True,False,False,False,True,False,False,False,True,False,True,False,0.016695669226140124,8,55,0.288244151753016,639,135,medium,1.1237362073886128e-05,1.794179669277787e-05,none,energy,0.5729200621102933,medium,True,COMPLETE
30,637.5144145620205,none,0.9839781335115716,True,True,True,False,False,True,True,False,False,True,False,True,True,False,False,False,False,0.056608186207089885,4,82,0.22665876177240749,920,107,medium,5.178223067894866e-05,0.9330371322823339,short,idw,0.6261291789051572,none,False,COMPLETE
31,604.6018505398914,none,0.5058476274580117,True,True,True,False,False,True,True,False,False,True,False,True,True,False,False,False,False,0.030316156806232626,5,78,0.48641841330642893,953,96,none,2.2223367967928448e-07,0.2666119112449604,short,idw,0.8028078616878896,medium,False,COMPLETE
32,603.1499831372955,none,0.515684718302287,True,True,True,False,False,True,True,False,False,True,False,True,True,False,False,False,False,0.025855480326280357,6,84,0.4991711550860432,958,146,none,6.349830364563615e-07,0.03147015563331103,short,idw,0.7338911915010238,medium,False,COMPLETE
33,621.2530533135276,none,0.5903505416085988,True,True,True,False,False,True,True,False,False,True,False,True,True,False,False,False,False,0.037501415599950315,7,95,0.43666817641398814,844,86,none,4.040156910783823e-06,0.9480774620607368,short,idw,0.848404343308084,medium,False,COMPLETE
34,634.321370316895,none,0.5360043098734273,False,True,False,False,False,True,False,False,False,True,False,True,True,False,False,False,False,0.10468435855002839,3,71,0.1529392497196505,899,105,none,3.3858068664643745e-08,0.08526387209419775,short,idw,0.7991905033243039,small,True,COMPLETE
35,675.9876159999498,none,0.9339168006789206,True,True,True,True,True,True,True,False,False,True,False,True,True,False,False,False,False,0.020446560961430212,5,100,0.39326130301646844,829,121,none,2.488299669182684e-07,0.0018455352539071934,short,population,0.6892542778952528,medium,False,COMPLETE
36,593.9844434495122,medium,0.5694598345274472,False,False,False,False,False,False,False,False,False,False,True,False,False,True,False,True,True,0.0133082608008581,8,77,0.4547287691351577,730,74,medium,6.278768407290387e-07,0.2650730501805501,short,mean,0.742569141585036,medium,False,COMPLETE
37,645.6461499181056,medium,0.5725506128709589,False,False,False,False,True,False,False,True,False,False,True,False,False,True,True,True,True,0.013248839020662862,10,89,0.33834727201833376,704,74,medium,4.111321954900629e-08,0.2348853896015137,none,mean,0.7459882342270086,small,False,COMPLETE
38,655.8537984693924,medium,0.6258941077100606,False,False,False,True,False,False,False,True,True,False,True,False,False,True,False,True,True,0.013933671033840911,13,68,0.08499528774909781,749,58,medium,0.0003459757666209269,1.7893223394890295e-08,long,mean,0.6114739024547259,none,True,COMPLETE
39,643.0074736510045,medium,0.6000926086624401,False,False,False,False,False,False,False,False,False,False,True,False,False,True,True,True,True,0.017607396417065123,7,76,0.4286266755620398,676,81,medium,1.5931106011632854e-07,0.016428117747531307,short,mean,0.642217413586608,medium,False,COMPLETE
40,594.29575843974,medium,0.5623896808722983,False,False,False,True,True,False,False,True,True,False,True,False,False,True,False,True,True,0.010036232621321356,8,56,0.4616220277078099,592,48,medium,1.0233094581513862e-08,9.033509763863942e-07,short,distance_energy,0.6714302698010705,none,False,COMPLETE
41,590.9866474760803,medium,0.525425067989799,False,False,False,True,True,False,False,True,True,False,True,False,False,True,False,True,True,0.010817127111607738,8,52,0.46071084695553954,579,28,medium,2.3033221363855747e-08,8.500755179610287e-07,short,distance_energy,0.6811230245414489,none,False,COMPLETE
42,602.4012227104951,medium,0.5680841630405623,False,False,False,True,True,False,False,True,True,False,True,False,False,True,False,True,True,0.010056207472795729,9,50,0.4630310673809596,589,27,medium,1.7542932687170426e-08,1.8249806374350155e-07,short,distance_energy,0.6902221310634735,none,False,COMPLETE
43,586.9838149351771,medium,0.5231413551596193,False,False,False,True,True,False,False,True,True,False,True,False,False,True,False,True,True,0.011967512829125133,10,35,0.45394878766286295,516,24,medium,1.0444004427715345e-08,1.007564995108385e-06,short,distance_energy,0.6703723322649062,none,False,COMPLETE
44,590.5271807973082,medium,0.5271348645560555,False,False,False,True,True,False,False,True,True,False,True,False,False,True,False,True,True,0.010703999486524046,8,37,0.3988631995644198,530,22,medium,2.8405021496597783e-08,2.092717508053199e-06,short,distance_energy,0.6715775669256783,none,False,COMPLETE
45,615.4604825589792,medium,0.6022353164543768,False,False,False,True,True,False,False,True,True,False,True,False,False,True,True,True,True,0.012806188276625182,10,34,0.4201133016743221,522,23,medium,2.041235882296119e-08,1.5606104628864881e-06,none,distance_energy,0.6720049051782018,none,False,COMPLETE
46,601.3445824600918,medium,0.5640594495298642,False,False,False,True,True,False,False,True,True,False,True,False,False,True,False,True,True,0.011629506674118566,8,23,0.3491483366815103,517,42,medium,1.0106480645017651e-08,1.888408138265323e-06,short,distance_energy,0.5822244460655868,none,False,COMPLETE
47,620.1577349056221,medium,0.6367786151109753,False,False,False,True,True,False,False,True,True,False,True,False,False,True,False,True,True,0.016118231946288687,11,37,0.31523160678671336,407,18,medium,4.295803941802836e-08,2.792683095424271e-07,short,distance_energy,0.6202832604454614,none,False,COMPLETE
48,589.4120939172614,medium,0.5329745748259916,False,False,False,True,True,False,False,True,True,False,True,False,False,True,False,True,True,0.010108991532094255,8,22,0.471059715819055,564,31,medium,1.0740111924709665e-07,1.1135186065004191e-05,short,distance_energy,0.7001324115891827,none,False,COMPLETE
49,596.6515883876278,medium,0.5282619689101081,False,False,False,True,True,False,False,True,True,False,True,False,False,True,False,True,True,0.012429695976956645,11,14,0.38763134870803373,443,34,medium,1.125436222022267e-07,1.923109862181565e-05,long,distance_energy,0.7033729506024545,none,False,COMPLETE
50,661.0847639542766,medium,0.8045777576951866,False,False,False,True,True,False,False,True,True,False,True,False,False,True,True,True,True,0.01511351239403248,8,25,0.24526179734711936,539,34,medium,2.92509459176176e-08,4.982520770630014e-06,short,distance_energy,0.7652012104452809,none,True,COMPLETE
51,607.9673604731911,medium,0.5573982698546467,False,False,False,True,True,False,False,True,True,False,True,False,False,True,False,True,True,0.01141183220719696,9,7,0.4672428204628492,596,47,medium,1.0008983203331033e-08,1.0882148401969003e-06,short,distance_energy,0.6621867386640274,none,False,COMPLETE
52,589.8005256695016,medium,0.5225259800488592,False,False,False,True,True,False,False,True,True,False,True,False,False,True,False,True,True,0.010002456016082954,10,28,0.4738649179726819,565,16,medium,7.6232750575826e-08,8.727616012837334e-08,short,distance_energy,0.6718007129282045,none,False,COMPLETE
53,636.6107134193923,medium,0.5206293608465857,False,False,False,True,True,False,False,True,True,False,True,False,False,True,False,True,True,0.13783213145891302,10,27,0.4383445623849122,556,14,medium,7.006980159212441e-08,1.534680465012206e-07,short,distance_energy,0.6409548902977891,none,False,COMPLETE
54,598.1905012839466,small,0.5886268747758006,False,False,False,True,True,False,False,True,True,False,True,False,False,True,False,True,True,0.010273332616085994,9,17,0.4789546635887066,491,24,medium,1.2932147549319129e-07,5.4559566692035885e-08,short,max,0.705896730584415,none,False,COMPLETE
55,593.8930061896802,medium,0.5226821112723902,False,False,False,True,True,False,False,True,True,False,True,False,False,True,False,True,True,0.013678306210997386,12,41,0.40937914727089325,430,28,medium,3.5565888604178756e-07,1.4602504732867145e-05,short,distance_energy,0.6797042437580982,none,False,COMPLETE
56,595.7635421935379,medium,0.5408415530716235,False,False,False,True,True,False,False,True,True,False,True,False,False,True,False,True,True,0.018357841680485626,13,40,0.40955739175536554,391,29,medium,3.5111582132201786e-07,1.2951989782559248e-05,short,distance_energy,0.6793347955960556,none,False,COMPLETE
57,584.4517274592596,medium,0.5219653350945639,False,False,False,True,True,False,False,True,True,False,True,False,False,True,False,True,True,0.01193511921651173,12,48,0.37400055067207205,490,10,small,2.166226533356369e-08,4.8221152987861886e-05,none,distance_energy,0.5963133309404183,none,False,COMPLETE
58,616.1856746624695,medium,0.7324458739377501,False,False,False,True,True,False,False,True,True,False,True,False,False,True,False,True,True,0.011500017042741652,14,50,0.3730245468630413,495,19,small,2.0093091193750243e-08,7.648147700031455e-05,none,distance_energy,0.6049776929179643,none,False,COMPLETE
59,618.443705913471,small,0.8377977532590054,False,False,False,True,True,False,False,True,True,False,True,False,False,True,False,True,True,0.015430407513510517,11,30,0.4308267396036998,559,17,small,5.270504072964041e-08,4.2928858175770524e-05,none,distance_energy,0.5607992150517382,none,False,COMPLETE
60,626.1190708523849,medium,0.5030495538977898,False,False,False,True,True,False,False,True,True,False,True,False,False,True,False,True,True,0.22167554830738045,16,19,0.39015737649757926,622,10,small,2.12318609419957e-08,2.8008331885785223e-06,none,distance_energy,0.6324393511671371,none,False,COMPLETE
61,587.8211545960396,medium,0.5247780117074298,False,False,False,True,True,False,False,True,True,False,True,False,False,True,False,True,True,0.011962860669033916,12,46,0.47669904229305937,425,37,medium,9.256511641480099e-08,4.3235495594807504e-07,none,distance_energy,0.593676252451516,none,False,COMPLETE
62,593.9255089071885,medium,0.5469419404453372,False,False,False,True,True,False,False,True,True,False,True,False,False,True,False,True,True,0.012147457305225016,12,45,0.4469175849656865,457,38,small,8.964090415795641e-08,3.4691488229186066e-07,none,distance_energy,0.5969550819559354,none,False,COMPLETE
63,583.614168848548,medium,0.523201375798233,False,False,False,True,True,False,False,True,True,False,True,False,False,True,False,True,True,0.010859196295803385,13,35,0.47857158143928835,353,21,medium,4.16741366069118e-08,6.132604302184258e-07,none,distance_population,0.5345556531881963,none,False,COMPLETE
64,611.6886459330107,medium,0.666558255144601,False,False,False,True,True,False,False,True,True,False,True,False,False,True,False,True,True,0.01436092380740866,13,38,0.4748416899704556,330,21,medium,0.5746884919620746,6.221760392831352e-08,none,distance_population,0.5285713219876542,none,False,COMPLETE
65,598.4877083448943,medium,0.54873416327322,False,False,False,True,True,False,False,True,True,False,True,False,False,True,False,True,True,0.010071114334709665,14,33,0.4818269301698882,359,14,medium,5.044785478124475e-08,4.893209726374318e-07,none,distance_population,0.5713182954305183,none,False,COMPLETE
66,554.9459681478861,medium,0.5189073062208769,False,False,False,True,True,False,False,True,True,False,True,False,False,True,False,True,True,0.011549836438909694,15,45,0.29614945719302355,366,37,small,1.3834826124401046e-07,0.00036631469240234376,none,None,0.6533420644369022,none,False,COMPLETE
