number,value,params_cloud_lags_option,params_colsample_bytree,params_compute_air_density,params_compute_cloud_cover_fraction,params_compute_cooling_degree_hours,params_compute_dew_point_spread,params_compute_effective_solar,params_compute_heating_degree_hours,params_compute_humidex,params_compute_pressure_trend,params_compute_rain_indicator,params_compute_temp_gradient,params_compute_wind_chill,params_compute_wind_components,params_compute_wind_power_density,params_compute_wind_speed_gradient,params_drop_basic_meteo_features,params_drop_rad_meteo_features,params_drop_wind_meteo_features,params_learning_rate,params_max_depth,params_min_child_weight,params_n_estimators,params_precip_lags_option,params_reg_alpha,params_reg_lambda,params_rolling_temp_option,params_spatial_agg_method,params_subsample,params_temp_lags_option,params_use_base_models_pred_intervals,state
0,20.95134162902832,none,0.8502994921129794,True,True,False,True,False,True,True,False,False,False,False,False,True,True,True,True,False,0.019891994055586063,8,4,824,medium,0.0023067996892657543,3.1174546182606765e-08,long,population,0.6596775532427106,none,True,COMPLETE
1,21.442306518554688,small,0.5444863588655247,False,False,False,True,False,True,False,False,True,True,False,False,True,False,False,False,False,0.09126245365420552,9,5,425,small,0.001921267866066475,0.0017525238346307978,none,distance_energy,0.7880117139215019,none,True,COMPLETE
2,26.32723045349121,none,0.6640321076294258,False,True,True,False,True,False,True,True,True,True,False,True,True,True,False,False,True,0.25485760150360504,7,7,373,none,0.00015789273160548323,0.5631798982178688,short,distance_energy,0.6113909947225533,small,False,COMPLETE
3,24.34754180908203,none,0.648331459562044,True,False,False,True,True,True,False,False,False,False,False,False,True,False,False,True,True,0.16806634188313915,7,4,810,medium,0.00012299457939176416,1.511464704421974e-08,long,energy,0.8886669553154406,none,True,COMPLETE
4,24.377058029174805,small,0.8422145334651239,True,True,True,True,False,False,False,True,True,True,True,False,False,True,True,False,True,0.09101978044057585,4,5,965,medium,3.973254066520826e-08,0.002660757404292413,short,distance_energy,0.7222832912036565,none,False,COMPLETE
5,20.050195693969727,none,0.5613693591176121,True,False,False,False,True,True,True,False,False,True,True,True,False,True,True,True,False,0.01150990355338,6,2,645,small,4.2245275811441665e-08,0.0452769955243953,long,population,0.7290877213860547,none,True,COMPLETE
6,21.41924476623535,small,0.9983035961036171,False,False,True,True,True,True,True,False,False,False,True,True,True,True,False,False,True,0.03704875948874555,8,5,965,medium,7.713601491093763e-07,1.464728078184653e-07,long,population,0.5629358874161298,medium,True,COMPLETE
7,21.79715919494629,small,0.5182288964408862,True,True,False,False,True,True,False,False,False,True,True,False,True,True,False,True,True,0.022370848182920375,7,3,341,medium,0.7405124360104812,0.0008481835952609797,short,energy,0.7879763504002391,small,False,COMPLETE
8,20.237302780151367,none,0.7043670249882437,False,True,False,True,True,True,True,True,False,False,False,True,True,False,False,False,False,0.03322585385212786,3,6,538,medium,8.364968686367397e-06,2.6756750259752324e-05,long,None,0.5184174018294672,small,True,COMPLETE
9,21.721786499023438,small,0.9403083832694149,True,True,False,False,True,True,True,False,False,False,True,False,True,False,False,False,False,0.03554823380642018,4,1,508,none,0.02186646786135574,0.0010074733001386098,none,population,0.7646646581315191,medium,True,COMPLETE
10,20.16377067565918,medium,0.5917976783668725,True,False,True,False,False,False,True,True,True,True,True,True,False,True,True,True,False,0.010048090842172784,5,10,655,small,1.3898528665627163e-08,0.653097255443478,long,idw,0.9989729036484885,none,False,COMPLETE
11,20.178508758544922,medium,0.5941470230063405,True,False,True,False,False,False,True,True,True,True,True,True,False,True,True,True,False,0.010000957556938464,5,10,658,small,1.4198801717510669e-08,0.9569060359545939,long,idw,0.9810397663280674,none,False,COMPLETE
12,20.272729873657227,medium,0.5924616388157984,True,False,True,False,False,False,True,True,True,True,True,True,False,True,True,True,False,0.01077798906661064,5,10,668,small,3.6474477887415356e-07,0.06644915050455569,long,distance_population,0.8902172473103034,none,False,COMPLETE
13,21.084566116333008,medium,0.7331184880612055,True,False,True,False,False,False,True,True,True,True,True,True,False,True,True,True,False,0.016073357129518906,5,8,758,small,3.862695617139855e-07,0.031907601230617484,long,max,0.9831054675658393,none,False,COMPLETE
14,21.108827590942383,medium,0.5008206761714522,True,False,False,False,True,False,True,False,False,True,True,True,False,True,True,True,False,0.01632732024432882,6,1,584,small,1.3809772659900555e-08,2.874021512041092e-06,long,idw,0.8632020105681573,medium,True,COMPLETE
15,20.058488845825195,none,0.5970980115908361,True,False,True,False,False,False,True,True,True,True,True,True,False,True,True,True,False,0.059038183377282255,10,8,729,small,8.466447017322323e-06,0.039881168341586615,none,mean,0.6924191968863598,none,False,COMPLETE
16,20.528236389160156,none,0.7793279274452767,True,False,False,False,False,True,True,True,False,True,True,True,False,True,True,True,False,0.06426834949253629,10,8,721,small,1.0165618361226354e-05,0.03544328428618786,none,mean,0.6873035828770977,none,False,COMPLETE
17,21.536378860473633,none,0.6613335185603427,True,False,True,False,True,False,True,False,True,True,True,True,False,True,True,True,False,0.06031848999579566,10,2,859,small,9.143115290437496e-06,8.725483844605013e-05,none,mean,0.646644239160608,none,True,COMPLETE
18,21.414094924926758,none,0.5753527978485586,False,False,True,False,False,False,False,True,False,True,True,True,False,False,True,True,False,0.115913240545984,9,8,576,none,1.7963550211320082e-06,0.009909825780791982,none,mean,0.8243941278473658,small,False,COMPLETE
19,21.134567260742188,none,0.7792244799329655,True,False,False,False,True,True,True,False,True,True,True,True,False,True,True,True,False,0.04066932291463597,6,3,748,small,1.2734580581554446e-07,2.3393910859751778e-06,none,distance_population,0.7253307487635586,medium,True,COMPLETE
20,19.847185134887695,none,0.6391795572253778,True,False,False,False,False,True,True,False,False,True,True,True,False,True,True,True,False,0.02428477396666446,8,7,890,small,0.00060972432859851,0.16615144256472392,none,max,0.5915237162382119,none,False,COMPLETE
21,19.9421329498291,none,0.6287192869988361,True,False,False,False,False,True,True,False,False,True,True,True,False,True,True,True,False,0.025826160320537788,9,7,880,small,0.0008582569362966882,0.11129381921017578,none,max,0.5925319180756152,none,False,COMPLETE
22,20.18768882751465,none,0.6347230167072618,True,False,False,False,False,True,True,False,False,True,True,True,False,True,True,True,False,0.02501454433529378,8,7,924,small,0.0015872794197411679,0.11509085353914081,none,max,0.5929825012793893,none,False,COMPLETE
23,19.712427139282227,none,0.7099851535850763,True,False,False,False,False,True,True,False,False,True,True,True,False,True,True,True,False,0.014464739141253414,9,6,896,small,0.024342174077670087,0.007509160296679461,none,max,0.5387916958724326,none,False,COMPLETE
24,20.50794219970703,none,0.7028917117657488,True,False,False,False,False,True,True,False,False,True,True,True,False,True,True,True,False,0.027843805444299534,9,6,891,small,0.0430126820639078,0.0068805059424298775,none,max,0.5247226087087901,none,False,COMPLETE
25,19.96506690979004,none,0.6990393402893139,True,False,False,False,False,True,True,False,False,True,True,True,False,True,True,True,False,0.01746542801514539,9,7,998,none,0.01602585461586708,0.15231467613318111,none,max,0.5714359206371782,none,False,COMPLETE
26,20.104249954223633,none,0.7574399923647555,False,False,False,False,False,True,False,False,False,False,False,True,False,False,True,True,True,0.014004139450657592,8,6,901,small,0.21678224664563028,0.0002313073130172667,none,max,0.5099676979694177,none,False,COMPLETE
27,20.56402587890625,none,0.8309469769833226,True,False,False,False,False,True,True,False,False,True,True,True,False,True,True,True,False,0.04423311511211342,9,9,812,small,0.0005108562552362026,0.011379296695809345,none,max,0.6241534475907897,none,False,COMPLETE
28,20.7977352142334,none,0.6286649180669762,True,False,False,False,False,True,True,False,False,True,True,True,False,True,True,True,False,0.026831816662428957,8,7,857,small,0.00886139360283163,0.23228912926997033,none,max,0.5695316429136531,medium,False,COMPLETE
29,20.853757858276367,none,0.8080534101403758,True,True,False,True,False,True,True,False,False,False,False,False,False,True,True,True,False,0.02105089117089278,10,9,813,none,0.0004803879195789332,0.00481315087171458,short,None,0.6409533009737243,small,False,COMPLETE
30,20.3629150390625,none,0.8960053121620041,True,False,False,False,False,True,True,False,False,True,True,True,False,True,True,True,False,0.014527995816098536,9,4,921,small,0.08388872696371681,0.27180185510627125,none,max,0.53845240321511,none,False,COMPLETE
31,19.975595474243164,none,0.703336334596807,True,False,False,False,False,True,True,False,False,True,True,True,False,True,True,True,False,0.018743984165454117,9,7,990,none,0.009761186770799735,0.15751265890554086,none,max,0.5816338205155918,none,False,COMPLETE
32,19.789812088012695,none,0.6816444882833558,True,False,False,False,False,True,True,False,False,True,True,True,False,True,True,True,False,0.018661907180689767,8,6,954,none,0.005995879308700339,0.01575042014986707,none,max,0.5531864846040911,none,False,COMPLETE
33,19.51818084716797,none,0.6795733061285183,True,False,False,False,False,True,True,False,False,True,True,True,False,True,True,True,False,0.013371936479527266,7,6,860,none,0.0029885662856244054,0.0003840794795443724,none,max,0.5454498534199111,none,False,COMPLETE
34,20.108951568603516,none,0.6704728793074267,False,False,False,True,False,True,False,False,False,True,False,False,False,False,True,False,False,0.01322650011659083,7,5,941,none,0.0035465606010475757,0.0002189975911553458,none,max,0.5446323633436627,none,False,COMPLETE
35,19.379987716674805,none,0.7513015888930327,True,False,False,False,False,True,True,False,False,True,True,True,False,True,True,True,True,0.013091826574983987,7,6,855,none,7.228492353275804e-05,0.0004559617759699133,none,distance_energy,0.5031995687852358,none,False,COMPLETE
36,21.04730987548828,small,0.7356273523230497,True,True,False,False,False,True,True,False,False,True,False,True,True,True,False,False,True,0.013132269371539025,7,6,790,none,0.00013686086698645638,2.043444781598265e-05,short,distance_energy,0.5099225224521164,none,False,COMPLETE
37,28.82569694519043,none,0.7561258510916319,False,False,False,True,False,True,False,False,False,False,True,False,False,True,True,True,True,0.2822690317161563,8,5,857,none,5.135838169913244e-05,0.00047049607241928253,none,distance_energy,0.5012210634124407,none,False,COMPLETE
38,20.292448043823242,none,0.6797890027625741,True,False,False,False,False,True,True,False,False,True,True,True,True,False,False,True,True,0.012374191038716278,7,4,954,none,0.0053090450122267934,0.0027322775260862175,none,distance_energy,0.5477782412422467,small,False,COMPLETE
39,20.48649787902832,small,0.7830515988308606,True,True,False,True,False,True,True,False,False,True,False,True,False,True,True,False,True,0.01925235553923926,6,6,423,none,5.0523953281424214e-05,4.253513081945165e-05,short,energy,0.5487206513986742,none,False,COMPLETE
40,22.366989135742188,none,0.7275362618822218,False,False,False,False,False,True,False,False,False,False,True,False,True,True,False,True,True,0.015566860550897052,7,5,787,none,0.16518337869597527,7.165121141814531e-06,none,distance_energy,0.6704912836410444,none,False,COMPLETE
41,19.926036834716797,none,0.6872787328100254,True,False,False,False,False,True,True,False,False,True,True,True,False,True,True,True,True,0.021770598768255083,8,6,844,none,0.0011070969334659939,0.002712133788402216,none,max,0.6236796059341362,none,False,COMPLETE
42,20.346790313720703,none,0.6559418961720247,True,False,False,False,False,True,True,False,False,True,True,True,False,True,True,True,True,0.030493528221405816,8,6,914,medium,0.00030578204927362977,0.016928402327333773,none,max,0.594501641349737,none,False,COMPLETE
43,19.6591854095459,none,0.7210831513480827,True,False,False,False,False,True,True,False,False,True,True,True,False,True,True,True,False,0.011770226314953659,7,5,965,none,4.701499433066886e-05,0.0010290683090477505,none,None,0.5363243217546279,none,False,COMPLETE
44,19.542993545532227,none,0.7255990393377594,True,False,False,False,False,True,True,False,False,True,True,True,False,True,True,True,False,0.012389890848317648,7,4,974,none,4.0938049749046334e-05,0.0008743023300651341,none,None,0.5353514256530698,none,False,COMPLETE
45,21.52254295349121,small,0.7184290652756382,True,True,False,False,False,True,True,False,False,True,True,True,False,True,True,False,True,0.011258147322245372,7,4,988,none,3.55326812167983e-05,0.0009025396710459422,none,None,0.5256604348824285,medium,False,COMPLETE
46,20.26539421081543,none,0.808141723933269,True,False,False,False,False,True,True,False,False,True,True,True,False,True,True,True,False,0.011884826666674163,6,3,973,none,2.3716814890558925e-06,0.0003685760820030317,short,None,0.5314676383852577,none,True,COMPLETE
47,24.00129508972168,medium,0.7520101820927294,True,False,False,True,True,True,True,False,False,True,True,True,True,False,False,True,False,0.21009046924190666,7,5,834,none,3.303416602207395e-05,0.0001344862664222977,none,None,0.6125219119978074,small,False,COMPLETE
48,19.137609481811523,none,0.8054473632744745,True,False,False,False,False,True,True,False,False,True,True,False,False,True,True,True,False,0.01003595241481425,4,3,937,medium,0.00022563164253813458,0.0013649582810715836,none,None,0.500282539252646,none,False,COMPLETE
49,20.38810920715332,medium,0.8685998819192494,True,False,False,False,False,True,True,False,False,False,True,False,False,True,True,True,True,0.010030006681141151,3,3,938,medium,0.0002516301357793327,0.001621901928164613,none,None,0.5616014918528917,none,True,COMPLETE
